title,author,url,cuisine,image_url,ingredients,instructions,language,nutrients,ratings,reviews,site_name,total_time,yields
Curry Bread,Namiko Chen,https://www.justonecookbook.com/curry-bread/,Japanese,https://www.justonecookbook.com/wp-content/uploads/2017/12/Curry-Bread-w600.jpg,"['1 ¼ cup bread flour', '⅓ cup cake flour ((⅓ cup + 1 Tbsp to be precise))', '1 tsp kosher/sea salt (I use Diamond Crystal; Use half for table salt)', '1 Tbsp sugar ((1 Tbsp + ½ tsp))', '1 tsp instant yeast ((1 tsp; see Notes if you use ACTIVE dry yeast))', '½ cup whole milk ((½ cup + 1 tsp; I highly recommend using whole milk instead of non-fat or reduced-fat milk.))', '1 Tbsp unsalted butter ((should be a bit less than 1 Tbsp; 1 Tbsp butter is 14 g but you will need 10 g))', '1 ½ cup Japanese curry of your choice', '1 large egg (50 g w/o shell) ((for coating the bread; I forgot to put in the ingredient picture below))', '1 cup panko (Japanese breadcrumbs)', '4 cups neutral-flavored oil (vegetable, canola, etc)']","Gather all the ingredients. Leave the unsalted butter and Japanese curry at room temperature.
To make the dough:
In a large bowl, whisk together bread flour (150 g), cake flour (50 g), kosher salt (3 g), and sugar (15 g).
Microwave the milk (125 ml) until warm to the touch, about 95ºF/35ºC. Then add in the instant dry yeast (3 g) and the warm milk.
Using the silicone spatula, combine the wet and dry ingredients together until it becomes a rough dough. [1-2 minutes]
Once the dough becomes a ball, add the unsalted butter (10 g) in the center of the dough and combine well until the butter is incorporated into the dough. At first, the dough will be sticky, wet, and oily and you might want to add more flour, but wait and try kneading a little longer. [2-3 minutes]
Once you don’t see any big chunks of butter, transfer the dough from the bowl to a lightly floured surface. Knead the dough until it becomes smooth and pliable. Read the tip on kneading below. [5 minutes]
Tip on kneading: Using the lower part of your palm, push out the dough. Then roll back up as if you’re drawing the number “8” with your hand. Rotate the dough 90 degrees every time you finish drawing “8”.
After drawing “8” a few times, bang the dough onto the work surface and fold it over away from you. This helps develop gluten (elasticity). Turn the dough 90 degrees and repeat drawing “8” again. Continue this process until the dough is smooth, supple, and silky.
When the dough is moist, smooth, and pliable, form a ball. Place the seam side down on the working surface and twist the ball a few times to close the seam.
Place the dough back into the bowl, seam side down, cover with plastic wrap, and let rise at 100ºF (38ºC) for 60 minutes, or until doubled in size (I used proof setting in my oven).
Dust your finger with flour and poke the center of the dough. If the dough doesn’t close up, it’s ready.
Transfer the dough to a lightly floured surface and gently punch/press it down.
Fold the dough into thirds widthwise.
Fold the dough into thirds lengthwise.
Turn upside down so the seam is facing down. Twist the dough to form a nice ball shape.
Measure the weight of the dough on a kitchen scale and divide the number by 8. Roughly cut the dough into 8 pieces.
Weigh each piece of dough and cut off the extra dough if it weighs more than you calculated.
Add the extra dough to the smaller dough piece(s). Hide the extra dough in the center of the small dough by pulling the dough from the side.
Twist the dough to seal the seam on your hand. Place the 8 dough balls on the baking sheet lined with a silicone baking mat (or parchment paper). Cover with plastic wrap, and let rest for 15 minutes at room temperature.
To form the curry bread:
Place the dough seam side up and flatten out each piece with your hand. Fold in thirds widthwise.
Fold in thirds lengthwise, and then turn it upside down so the seam side is on the bottom.
Flatten again, and flip so the seam side is up.
Roll out into a 3.5 inch (9 cm) circle using a rolling pin.
Cover with plastic wrap and let rest for 10 minutes. One by one, thin out the edges of the dough with your fingers, with the center thicker than the edges. The circle should be 4 inches (10 cm) in diameter.
Place the dough seam side up and put 1 to 1.5 Tbsp of curry paste in the center of the circle. Gather the opposing edges of the circle and fold the dough in half. Remember, KEEP THE CURRY OUT from the edges! It’s the most crucial part. If you didn’t read my post, read my tip #2 now in the post!
Tightly pinch the edges to seal well. If the edges are not pinched and pressed tightly, the seam might open up during proofing/deep frying.
Next, to double secure, fold the edges over to one side at least once, like folding a brown lunch bag. Press the edges again to secure.
Keeping the seam side on the bottom, put the bread back onto the silicone mat and cover with a damp towel while working on the rest of the dough.
Once all the dough has curry filling, crack the egg into a bowl and whisk well. Place the panko in a shallow bowl/tray. Using a pastry brush, coat the formed dough with egg and then panko.
Cover the bread with plastic wrap and let rise at 100ºF (38ºC) for 45-60 minutes or until 1.5 times its size (I used proof setting in my oven). If you touch the dough with your finger, the indentation will stay on the dough.
To deep fry the bread:
In a deep frying pot (I like using my 2.75QT Staub), heat the 4 cups (960 ml) oil to 320ºF (160ºC). Place 2-3 pieces of the curry bread into the oil, seam side down. After a few seconds, flip it around so the seam side is now up. You may need to hold it with a pair of tongs. Keep turning them while they deep fry, until they cook to a golden brown, about 2-3 minutes. Drain the oil well and transfer to the wire rack or some paper towels to drain while it cools. Serve hot or at room temperature.
To Store
Keep the leftovers in an airtight container and store in the refrigerator for 3 days or in the freezer for 3-4 weeks. To reheat, bake at 350ºF (177ºC) until warm inside.",en-US,{},4.62,,Just One Cookbook,220,8 serving(s)
Buttermilk Pancakes,Namiko Chen,https://www.justonecookbook.com/buttermilk-pancakes/,"American,Japanese",https://www.justonecookbook.com/wp-content/uploads/2012/08/Buttermilk-Pancakes.jpg,"['1¼ cups all-purpose flour (plain flour) ((1¼ cups = 160 g))', '1 tsp baking soda', '1 tsp baking powder', 'pinch kosher/sea salt (I use Diamond Crystal; Use half for table salt)', '1 large egg (50 g w/o shell) ((beaten))', '1¼ cups buttermilk ((1¼ cup = 295 ml) (See Notes for homemade recipe))', '2 Tbsp unsalted butter ((melted))', '¼ cup sugar ((¼ cup = 50 g))', '1 tsp almond extract', 'Cooking spray ((or butter))', 'confectioners’ sugar/powdered sugar ((optional))', 'maple syrup ((optional))', 'Strawberry Compote ((optional))']","Gather all the ingredients.
In a large bowl, put the flour, baking soda, baking powder and salt and whisk together.
In a small bowl, whisk the egg and the melted butter together.
Stir in the buttermilk and the sugar.
Add the egg mixture into flour mixture and whisk all together.
Add almond extract to the batter and mix.
Heat a large griddle pan or frying pan on medium heat. Spray with non-stick cooking spray or melt butter on the pan.
Pour about ¾ cup of batter onto hot pan from 12 inch high. This is necessary for a nice circular shape.
Cook until you see lots of bubbles start to show on surface of the pancake. It’s usually about 3 minutes.
Then flip and cook the other side for 1.5 minutes, or until a nice light brown color.
Sprinkle powder sugar and serve with maple syrup or homemade Strawberry Sauce (Compote).",en-US,{},4.43,,Just One Cookbook,30,6 serving(s)
Red Bean Pancake,Namiko Chen,https://www.justonecookbook.com/red-bean-pancake/,Japanese,https://www.justonecookbook.com/wp-content/uploads/2017/06/Red-Bean-Pancake.jpg,"['1 cup red bean paste (anko)', '2 Tbsp water', '¼ cup sugar ((4 Tbsp))', '2 large eggs (50 g each w/o shell)', '1 cup whole milk', '1 tsp pure vanilla extract', '2 cups all-purpose flour (plain flour)', '1 tsp baking powder', 'pinch kosher/sea salt (I use Diamond Crystal; Use half for table salt)', '4 Tbsp unsalted butter', 'confectioners’ sugar/powdered sugar', 'maple syrup', 'fruits of your choice']","To Prepare Red Bean Mixture
Add the red bean paste and water in a small saucepan and simmer until the paste loosens up. Turn off the heat and let cool.
To Make Pancake Batter
In a large bowl, whisk together sugar and eggs. Then add the milk, vanilla, and red bean mixture.
Add the flour, baking powder, and pinch of salt in a fine-mesh sieve and sift over the mixing bowl. Mix well to combine but do not overmix, which will develop gluten and cause a tough pancake texture.
To Cook Pancakes
In a non-stick frying pan, heat ½ Tbsp butter on medium heat. Pour the mixture on the pan and cook until you see bubbles on the pancake. Then flip over and cook until both sides are nicely golden brown. Continue to make pancakes with the rest of the batter.
To Serve and Store
Serve immediately. You can sprinkle powder sugar, maple syrup, etc. I usually eat with just maple syrup as pancakes are already sweet. To save for later, wrap 2 pancakes in a single layer with aluminum foil and put it in a freezer bag. Store in the freezer for up to a month. Use the oven toaster or oven to reheat before you serve.",en-US,{},4.56,,Just One Cookbook,30,8 serving(s)
The Best French Toast,Namiko Chen,https://www.justonecookbook.com/french-toast/,Japanese,https://www.justonecookbook.com/wp-content/uploads/2018/12/French-Toast-I.jpg,"['3 large eggs (50 g each w/o shell)', '¼ cup sugar', '½ tsp pure vanilla extract', '2 ½ cups whole milk', '1 French baguette', '2 Tbsp unsalted butter', 'confectioners’ sugar/powdered sugar ((if desired))', 'maple syrup ((if desired))']","Gather all the ingredients.
In a large bowl, beat the eggs.
Add ¼ cup sugar and ½ tsp vanilla. Whisk well to combine.
Add 2 ½ cup milk and whisk well together.
Cut the French baguette into 1.5-2 inch (4-5 cm) thickness.
Soak both sides of the bread in the mixture and place them in a deep baking dish, with the soft white side facing up.
Pour the leftover mixture into the baking dish.
Let it soak for 5 minutes, and flip to soak the other side for 5 minutes. The side facing up now is the “dry” side. You can prepare fruits, powder sugar, and maple syrup during this time.
Preheat the oven to 350 ºF (180 ºC). Grease the rimmed baking sheet with butter. Heat 1-2 Tbsp butter in the frying pan or griddle.
When the butter is melted and pan is hot, place the bread, facing the “dry” side DOWN. *The “dry” side is the side facing up in the image on the right.
Cook until the bottom is golden brown. Then turn over to cook the other side until golden.
When both sides are nicely brown, transfer to the baking sheet.
Bake at 350ºF (180ºC) for 6 minutes. For a convection oven, reduce cooking temperature by 25ºF (15ºC).
Remove from the oven and serve on a plate.
Sprinkle powder sugar and drizzle maple syrup as desired.
To Store
You can keep the leftovers in an airtight container and store in the refrigerator for up to 3 days and in the freezer for a month.",en-US,{},4.62,,Just One Cookbook,35,4 serving(s)
Strawberry Sauce (Strawberry Compote),Namiko Chen,https://www.justonecookbook.com/strawberry-sauce-strawberry-compote/,Japanese,https://www.justonecookbook.com/wp-content/uploads/2012/08/Strawberry-Sauce.jpg,"['1 lb strawberries ((454 g))', '1 lemon', '¼ cup sugar ((50 g))', '¼ cup water ((60 ml))', '1 Tbsp potato starch/cornstarch']","Gather all the ingredients.
Rinse the strawberries under cold water and use the point of the knife to remove the hull out of the tops. When you have big strawberries cut in half.
Zest and juice the lemon.
Combine ALL the ingredients in the saucepan at once, or like me, you can take mini-steps. In a small saucepan over medium heat, combine sugar, water, and corn starch and whisk well.
Add the lemon zest and juice.
Add in strawberries and mix gently.
Bring to a simmer and cook for 5 minutes stirring/breaking strawberries up constantly.
Remove from heat when the mixture thickens. Allow to cool slightly if you want to user a blender to puree it. Serve with waffles, pancakes, French toast, crepes, ice cream, cheesecake, or whatever you like.",en-US,{},4.67,,Just One Cookbook,15,4 serving(s)
Banana Bread,Namiko Chen,https://www.justonecookbook.com/banana-bread/,American,https://www.justonecookbook.com/wp-content/uploads/2015/02/Banana-Bread.jpg,"['½ Tbsp unsalted butter ((for greasing the baking dish))', '1 ⅔ cups all-purpose flour (plain flour)', '½ tsp kosher/sea salt (I use Diamond Crystal; Use half for table salt)', '½ tsp baking soda', '½ tsp baking powder', '½ cup unsalted butter ((soften))', '½ cup sugar', '2 large eggs (50 g each w/o shell) ((at room temperature))', '1 Tbsp neutral-flavored oil (vegetable, canola, etc)', '1 tsp pure vanilla extract', '4 ripe bananas ((separated; a 7-8"" medium-size banana is roughly 4 oz/113 g with peel; See Notes))', '½ cup raisins ((optional))']","Gather all the ingredients.
Preheat oven to 350°F (175°C). For a convection oven, reduce cooking temperature by 25ºF (15ºC). Grease an 8” square baking dish (the bottom and sides) with butter.
In a bowl, combine 1 ⅔ cup (200 g) flour, ½ tsp salt, ½ tsp baking soda, and ½ tsp baking powder and whisk all together.
In another bowl, whisk together ½ cup (113 g) soften butter and ½ cup (100 g) sugar.
Add 2 eggs, 1 Tbsp oil, and 1 tsp vanilla and beat with the whisk until well blended.
Mash 3 bananas with a fork and mix into the egg mixture.
Add the flour mixture to the banana mixture and stir just until blended. Add raisins, if you like to include them.
Pour the batter into the prepared pan, spreading it evenly with the rubber spatula. Slice 1 banana thinly into rounds and decorate on top of the banana bread.
Bake at 350°F (175°C) until a toothpick inserted into the center of the bread comes out clean, about 1 hour. Remove the baking dish from the oven and let cool for 20 minutes.
To Store
Wrap each slice or the whole cake with plastic wrap. Store at the cool place and enjoy within 2-3 days.",en-US,{},4.58,,Just One Cookbook,75,1 serving(s)
Japanese Rice Porridge (Okayu),Namiko Chen,https://www.justonecookbook.com/rice-porridge-okayu/,Japanese,https://www.justonecookbook.com/wp-content/uploads/2019/12/Rice-Porridge-Recipe-2138-I-1.jpg,"['¼ cup uncooked Japanese short-grain rice', '250 ml water ((1 cup + 2 tsp))', 'green onion/scallion ((chopped))', 'umeboshi (Japanese pickled plum)', 'toasted white sesame seeds', 'shredded nori seaweed (kizami nori)', 'shredded Japanese salted salmon', 'mitsuba (Japanese parsley) ((for garnish))']","Gather all the ingredients. I follow the 1 to 5 rice-to-water ratio for my Okayu recipe.
Rinse the rice in water, then drain. Repeat until the water runs clear.
Soak the rice in the pot for at least 30 minutes.
After 30 minutes, drain the water completely.
Then add 250 ml of water into the pot.
Cover the pot and bring to a boil over high heat.
When boiling, lower the heat to the stove’s lowest setting (make sure to use the right size of stove burner for your pot size). Open the lid and gently mix with the spoon once, making sure rice is not stuck to the bottom of the pot.
Cover the lid and simmer the rice for 30 minutes (Tip: With a good size pot and the lowest heat on the stove, the water should not boil over. If you cook with more water or your pot is smaller than my pot, you may want to cover the lid at a slight angle so the water doesn’t boil over). During this time, I never open the lid or mix the rice. (Tip: If you are worried, you can take a quick peek and make sure there’s enough water so the rice doesn’t burn the bottom of the pot. If necessary, you can stir the pot or add “hot” water. Otherwise, don’t touch the rice because you would end up breaking the nice shape of rice kernels.)
After 30 minutes, turn off the heat and let it steam for 10 minutes. The rice should be soft and thickened. If you want to add something, like a beaten egg or salt, this is the time to add. I keep this recipe plain and simple. Serve into the individual rice bowls and garnish and put toppings of your choice.",en-US,{},4.7,,Just One Cookbook,65,1 serving(s)
Banana Bread,Namiko Chen,https://www.justonecookbook.com/banana-bread/,American,https://www.justonecookbook.com/wp-content/uploads/2015/02/Banana-Bread.jpg,"['½ Tbsp unsalted butter ((for greasing the baking dish))', '1 ⅔ cups all-purpose flour (plain flour)', '½ tsp kosher/sea salt (I use Diamond Crystal; Use half for table salt)', '½ tsp baking soda', '½ tsp baking powder', '½ cup unsalted butter ((soften))', '½ cup sugar', '2 large eggs (50 g each w/o shell) ((at room temperature))', '1 Tbsp neutral-flavored oil (vegetable, canola, etc)', '1 tsp pure vanilla extract', '4 ripe bananas ((separated; a 7-8"" medium-size banana is roughly 4 oz/113 g with peel; See Notes))', '½ cup raisins ((optional))']","Gather all the ingredients.
Preheat oven to 350°F (175°C). For a convection oven, reduce cooking temperature by 25ºF (15ºC). Grease an 8” square baking dish (the bottom and sides) with butter.
In a bowl, combine 1 ⅔ cup (200 g) flour, ½ tsp salt, ½ tsp baking soda, and ½ tsp baking powder and whisk all together.
In another bowl, whisk together ½ cup (113 g) soften butter and ½ cup (100 g) sugar.
Add 2 eggs, 1 Tbsp oil, and 1 tsp vanilla and beat with the whisk until well blended.
Mash 3 bananas with a fork and mix into the egg mixture.
Add the flour mixture to the banana mixture and stir just until blended. Add raisins, if you like to include them.
Pour the batter into the prepared pan, spreading it evenly with the rubber spatula. Slice 1 banana thinly into rounds and decorate on top of the banana bread.
Bake at 350°F (175°C) until a toothpick inserted into the center of the bread comes out clean, about 1 hour. Remove the baking dish from the oven and let cool for 20 minutes.
To Store
Wrap each slice or the whole cake with plastic wrap. Store at the cool place and enjoy within 2-3 days.",en-US,{},4.58,,Just One Cookbook,75,1 serving(s)
Miso Soup,Namiko Chen,https://www.justonecookbook.com/homemade-miso-soup/,Japanese,https://www.justonecookbook.com/wp-content/uploads/2019/09/Homemade-miso-soup-6037-I-3.jpg,"['4 cups water', '1 piece kombu (dried kelp) ((⅓ oz, 10 g; 4"" x 4"" or 10 x 10 cm))', '1 cup katsuobushi (dried bonito flakes) ((packed; I used loose 3 cups in the video for strong dashi flavor))', '1 cup dashi (Japanese soup stock; click to learn more)', '1 Tbsp miso ((18 g))', 'Ingredients of your choice ((Please read the blog post))', 'green onion/scallion ((finely chopped))']","To Make Dashi (Can be Made in Advance):
Clean the kombu with a damp towel and soak the kombu in water for 30 minutes or overnight (preferred). NEVER wash kombu and do not remove the white substance -that’s umami! These days it's pretty clean, so you can skip this process. Just make sure there are no dirty particles.
After 30 minutes (or overnight), the kombu is rehydrated. This liquid is called cold brew Kombu Dashi.
Pour kombu dashi and kombu into a saucepan. SLOWLY bring to boil on medium-low heat so you can extract umami from kombu as much as possible. Right before the stock is boiling (it gets slimy and yields a bitter taste if you leave it), remove the kombu. Now what you have is Kombu Dashi. If you’re vegetarian/vegan, use this kombu dashi for your miso soup. What to do with used kombu? You can reuse it to make Simmered Kombu or Homemade Furikake Rice Seasoning.
If you're not vegetarian/vegan, add Katsuobushi and let it simmer for 30-60 seconds. Turn off the heat and let steep for 10 minutes.
Strain over a fine-mesh sieve and now you have roughly 4 cups of Awase Dashi. You can store in the refrigerator for up to 3-5 days and in the freezer for up to 2 weeks. Repurpose the used katsuobushi to make Homemade Furikake Rice Seasoning.
STEP 1 - Add Dashi
Here I demonstrate to make 2 cups/2 servings of miso soup. You can use the formula; 1 cup (200-240 ml) dashi + 1 Tbsp (18 g) miso = 1 serving miso soup. If you add more ingredients/vegetables, the amount of soup will increase and you will also need more miso. Add 2 cups (480 ml) dashi in the saucepan.
Are you in a hurry and no time to make dashi? You can use Dashi Packet or Dashi Powder to make instant dashi.
STEP 2 - Add dense ingredients BEFORE bringing dashi to a boil
If your miso soup doesn't include hard ingredients or clams, go to the next step. Add hard ingredients like root vegetables. Once boiling, lower the heat and simmer until they become tender. If you're making Clam Miso Soup, add clams in cold brew kombu dashi. Bring it to a gentle boil and once the shells are open, turn off the heat (do not overcook).
STEP 3- Add quick-cooking ingredients AFTER dashi is boiling
If your miso soup doesn’t include these ingredients, bring dashi to a boil and go to next step. AFTER dashi starts boiling, add in soft vegetables like leafy greens, mushrooms, deep-fried tofu pouch because they require less cooking time. At this point, keep the soup at a simmer and make sure it stays warm (not OVERBOILING).
STEP 4 - Add miso
Add a small amount of miso at a time (you can start with 2 Tbsp miso for 2 cups dashi). Put miso inside a ladle and slowly add dashi into the ladle to dissolve miso completely. You can buy a miso muddler or a fine-mesh miso strainer which helps you dissolve miso faster. If you accidentally added too much miso, dilute the miso soup with dashi (or water). NEVER OVERBOIL miso soup because it loses nutrients, flavors, and fragrance.
STEP 5 - Add tofu
Add tofu AFTER miso is completely dissolved because you might break the tofu when mixing in miso. If you add chilled tofu from the refrigerator, miso soup would get cooler. Reheat miso soup until it is just hot, but NOT BOIL.
STEP 6 - Add wakame & green onions
Add rehydrated wakame (seaweed). I recommend re-hydrating dried wakame in a separate bowl of water to get rid of saltiness, instead of re-hydrating inside miso soup. Add ingredients that do not require cooking such as chopped green onions, mitsuba, yuzu, and blanched spinach right before serving to keep the fresh fragrance and color.
To Serve:
Serve immediately. Place on the right side of the table setting (Read on Ichiju Sansai, or 1 soup 3 dishes; see the picture).
To Store:
In general, it's best to use up all the miso soup because the fragrance and taste will be lost as time passes by. Let your miso soup cool at room temperature (up to 4 hours - otherwise miso soup will be spoiled) and then refrigerate. You can keep for up to 2 days in the refrigerator. If you want to make a big batch, it's best to keep the soup BEFORE adding miso. Add the miso only for the portion you need. You can freeze miso soup for up to 2 weeks. If the miso soup contains potatoes or tofu, remove them before freezing as the textures subject to change.
To Reheat Miso Soup:
Bring miso soup in a pot over medium heat, but not to overboil. Miso loses its nutrients at high temperature.",en-US,{},4.71,,Just One Cookbook,55,4 serving(s)
