title,author,url,cuisine,image_url,ingredients,instructions,language,nutrients,ratings,reviews,site_name,total_time,yields
Miso Soup with Yuzu Kosho,Namiko Chen,https://www.justonecookbook.com/miso-soup-yuzu-kosho/,Japanese,https://www.justonecookbook.com/wp-content/uploads/2018/03/Miso-Soup-with-Yuzu-Kosho-w722.jpg,"['¼ lb pork belly ((4 oz; skip for vegan/vegetarian))', '1 leek', '2 cabbage leaves', '4 shiitake mushrooms', '2.5 oz carrot ((1.5"", 3.8 cm))', '2 green onions/scallions', '1 Tbsp sesame oil (roasted)', '1 Tbsp sake', '4 Tbsp miso', '14 oz silken/soft tofu ((1 block tofu))', 'yuzu kosho (Japanese citrus chili paste) ((for taste))', '2 Tbsp toasted white sesame seeds', '4 cups water', '1 piece kombu (dried kelp) ((3” x 4”, 7.5 cm x 10 cm))', '3 cups katsuobushi (dried bonito flakes) ((skip for vegan/vegetarian))']","Gather all the ingredients first.
To make dashi: In a measuring cup (or a large pot), add 4 cups water and kombu and let it steep. You can do this process overnight or as soon as you start preparing. This is kombu dashi. If you're using dashi powder or dashi packet, follow this tutorial, and use it at Step 12.
Cut the pork belly into 1 inch (2.5 cm) pieces.
Cut the leek in half lengthwise, and then cut the halves into 1-inch pieces widthwise. Rinse under cold water to make sure there is no dirt inside the pieces.
Cut the cabbage leaves into small pieces.
Remove the stem of shiitake mushrooms and slice thinly.
Cut the carrot in half lengthwise, and slice thinly. Cut the green onions thinly.
Transfer the kombu dashi into a pot (if you didn’t use a pot at Step 2). Slowly bring the kombu dashi to a boil over medium low heat. When the water is almost boiling, remove the kombu to avoid sliminess. If you are vegan/vegetarian, skip next two steps (Step 9 and Step 10).
Add 3 cups katsuobushi and cook for 15 seconds. Then turn off the heat and let the katsuobushi steep in the pot for 15 minutes.
Meanwhile, in a separate large pot (or donabe), heat 1 Tbsp sesame oil over medium heat. Once the pot is hot, add the pork belly and stir to cook.
Once the pork belly is 80% cooked through, add 1 Tbsp sake and stir to combine. Then add chopped leeks.
Once leeks are wilted, add the rest of the vegetables and mushrooms. Stir to coat with the oil. Then using a fine-mesh strainer, strain the dashi into the pot.
Bring the soup mixture to a boil, skimming the foam and scum on the surface while cooking. Turn off the heat and add 2 Tbsp miso first, and then gradually add in more as you taste the soup. Each miso brand and type of miso tastes differently and the sodium level varies, so you want to taste before adding more miso.
Add the tofu into the soup and turn on the heat to continue to simmer until tofu is nice and warm (tofu is edible chilled, so you don’t have to worry about “cooking” it). Just make sure not to let the miso soup boil. It should take not more than 3-4 minutes to warm the tofu, and the soup is now ready.
Before serving, scoop out a small portion of Yuzu Kosho from the jar and place it on a small plate. Grind 2 Tbsp sesame seeds and put in in a small bowl. Serve them alongside with the donabe or soup pot. After you ladle the soup into individual serving bowls, add a pinch of Yuzu Kosho, sprinkle sesame seeds, stir in and enjoy!
To Store
You can keep the leftovers in an airtight container and store in the refrigerator for up to 3 days and in the freezer for 2 weeks.",en-US,{},4.92,,Just One Cookbook,35,4 serving(s)
Blueberry Creme Fraiche Scones,Namiko Chen,https://www.justonecookbook.com/blueberry-creme-fraiche-scones/,"American,Japanese",https://www.justonecookbook.com/wp-content/uploads/2012/09/Blueberry-Creme-Fraiche-Scones.jpg,"['2 cups all-purpose flour (plain flour) ((2 cups = 240 g))', '¼ cup sugar ((¼ cup = 50 g))', '2 tsp baking powder', '½ tsp kosher/sea salt (I use Diamond Crystal; Use half for table salt)', '6 Tbsp unsalted butter ((6 Tbsp = ¾ stick = 85 g) (chilled))', '1½ cup blueberries ((1½ cups = 225 g) (picture shows 2 cups, but I just needed 1 ½ cup))', '1 large egg (50 g w/o shell)', '1 large egg yolk', '7.5 oz crème fraîche ((7.5 oz = 212 g))', '1½ tsp pure vanilla extract', 'White sparkling sugar ((for sprinkling) (I did not have it today))']","Gather all the ingredients. Preheat oven to 350°F.
Whisk the flour, sugar, baking powder, and salt in a large bowl to blend.
Cut butter into small pieces.
Add the butter in the bowl and rub in butter with fingertips until mixture resembles fine meal.
Whisk eggs, crème fraîche and vanilla.
Gently stir crème fraîche mixture into flour mixture (dough will be very moist).
Add the blueberries and mix well.
Turn dough out onto generously floured work surface. Divide dough in half. Press each half into 6-inch round about 1/2 inch thick. Cut each round into 6 wedges.
Transfer wedges to baking sheet, spacing 1 inch apart. Generously sprinkle sugar on top.
Bake scones until pale golden and toothpick inserted into center comes out clean, about 25 minutes. Serve scones warm or at room temperature.",en-US,{},5.0,,Just One Cookbook,45,12 serving(s)
Mini Fruit Puff Pastry with Lemon Glaze,Namiko Chen,https://www.justonecookbook.com/mini-fruit-puff-pastry-with-lemon-glaze/,Japanese,https://www.justonecookbook.com/wp-content/uploads/2011/06/Mini-Fruit-Puff-Pastry-with-Lemon-Glaze-e1308032192840.jpg,"['1 pkg Pepperidge Farm Puff Pastry Sheets ((1 pkg = 17.3 oz) (thawed according to the package instruction))', '1 large egg (50 g w/o shell)', '1 Tbsp water', '2 Tbsp lemon juice', '½ cup confectioners’ sugar/powdered sugar', 'Strawberries ((Your choice of fruits, raspberries, and blueberries))', 'sugar ((optional))']","In a small bowl, combine ingredients for Lemon Glaze and whisk together. The consistency should be slightly thick but runny. Cover and refrigerate overnight.
While you are waiting for the pastry sheet to be thawed, wash fruits and drain well. Chop into small pieces if necessary.
After 2 pastry sheets are thawed, unfold them on a lightly floured surface. Using a round cookie cutter, cut the pastry sheet into 9 circles per sheet. Roll up the scrapes into a ball and re-roll them and cut into circles. I was able to make 24 circles with the 2 sheets.
Preheat the oven to 400 degrees. Beat the egg and water in a small bowl.
Place half of the pastry circles (12 circles for me) onto a parchment paper lined baking sheet. Then put a small amount of fruits of your choice in the center. You can sprinkle a little bit of sugar if you like. I made half with sugar and half without sugar (fruits were pretty sweet already).
After you put all the fruits, brush the edges of the pastry circles with the egg wash using a pastry brush.
Put remaining pastry circles on top of the filling.
Press the edges of circles firmly to seal with a fork.
Using a kitchen knife, make 2 small slits on top of the pastry and brush the top of pastries with the egg wash using a pastry brush.
Bake for 15 minutes or until the pastries are nice golden brown on the top. Remove from the oven and let the pastries cool slightly.
Drizzle the lemon glaze on tops. I think I made it too runny…it should have been thicker, right? Sorry this is my first time making icing!",en-US,{},3.34,,Just One Cookbook,50,12 serving(s)
Melon Pan,Namiko Chen,https://www.justonecookbook.com/melon-pan/,Japanese,https://www.justonecookbook.com/wp-content/uploads/2016/08/Melon-Pan.jpg,"['1 ¾ cup bread flour', '3 ½ Tbsp cake flour', '1 tsp kosher/sea salt (I use Diamond Crystal; Use half for table salt)', '3 Tbsp sugar', '1 ¼ tsp instant yeast ((see Notes if you use active dry yeast))', '1 large egg (50 g w/o shell) ((beaten))', '3 Tbsp whole milk', '3 Tbsp water ((3 Tbsp + 1 tsp to be precise; keep at 86ºF/30ºC))', '2 ½ Tbsp unsalted butter ((cut into small cubes and at room temp))', '4 Tbsp unsalted butter ((at room temp))', '½ cup sugar', '1 large egg (50 g w/o shell) ((beaten))', '1 ⅔ cup cake flour', '½ tsp baking powder', '2 Tbsp sugar']","Gather all the ingredients. I have 2 videos for this recipe: the hand-kneading method and the stand mixer method.
Step 1 - Making Main Dough
In a large bowl, combine 225 g (1 ¾ cup + 2 Tbsp) bread flour, 25 g (3 ½ Tbsp) cake flour, 40 g (3 Tbsp) granulated sugar, and 3 g (1 tsp) kosher salt.
Add 4 g (1 tsp) instant dry yeast and 1 large beaten egg to the bowl with dry ingredients.
Add 50 ml (3 ½ Tbsp) milk and 50 ml (3 ½ Tbsp) water, both at 86ºF (30ºC). Using a silicone spatula or your fingertips, gently mix the ingredients together until they are combined.
In the beginning, the dough is very sticky and wet, but keep mixing until it forms a loose, sticky ball. Also, use the dough to pick up the flour on the sides of the mixing bowl. This step should take about 2 minutes. Transfer the dough from the bowl to a lightly floured work surface.
Press the heels of your hands into the dough, pushing forward slightly. Fold the top half of the dough in half back toward you. Then rock forward on the lower part of your palm to press it flat.
Turn the dough slightly (to clockwise), fold it in half, and rock into it again with the lower part of your palm. This process is called ""punching"" the dough and the goal is to lengthen and stretch the gluten strands in the dough. Repeat for 5 minutes or so. Tip: If the dough doesn't seem to be losing its stickiness, sprinkle more flour over the top and work it into the dough. You can lightly dust your hands with flour to keep the dough from sticking too much.
After “punching” for 5 minutes and the dough gets more elastic, press and stretch the dough, about 10 inches (25 cm). Then put small cubes of 35 g (2 ½ Tbsp) unsalted butter on top of the dough. Roll up the dough tucking the butter in, and then continue the kneading process.
Your hands, dough, and the work surface will get oily and messy in the beginning. Don't’ be panic. I recommend using a metal/silicone dough scraper to collect the dough stuck on the work surface once in a while and keep kneading.
As you knead, the dough will absorb the butter and it will eventually become very smooth and easier to work with. Finally, start banging the dough onto the work surface and fold it over away from you. This helps develop the gluten (elasticity). Bang the dough, turn it 90 degrees, and “punch” it, using the lower part of your palm. Continue this process for 10 minutes or until the dough is smooth, supple, and silky. Tip: Don’t let go of the dough when you are banging onto the work surface and don’t let it rest for too long between turns.
When the dough gets silky and smooth, pull the end of your dough with your thumb and fingers. Keep spreading the dough with your fingers, stretching the dough into thin translucent membrane. This test is called Windowpane Test to see if the dough's gluten has been developed enough. If the dough tears, the gluten isn’t quite ready yet. Knead the dough for another 2 minutes and test again.
Shape the dough into a ball by pulling all sides of the ball to the bottom and pinching them together. Place the dough in a bowl (the seam on the bottom).
Cover the bowl with a plastic wrap and let the dough rise in a warm place until the dough has doubled in size, about 1-2 hours. I use a Proof setting (100ºF/38ºC) in my oven.
Step 2 - Making the Biscuit Dough
In a large bowl, add 60 g (About 4 Tbsp) unsalted butter and mix with the silicone spatula until it becomes smooth.
Add 100 g (½ cup) granulated sugar and mix with the silicone spatula until they blend well together.
Slowly add a very small amount of 1 large beaten egg (46-50 g/ml) into the bowl and blend well together before you add another small amount of the egg. Continue until all the egg is well blended.
Sift 200 g (1 ⅔ cup) cake flour and 2 g (½ tsp) baking powder into the mixture.
Using the silicone spatula, mix well until the dough is not floury. Collect the dough and make it into a ball.
Measure the weight of the biscuit dough. It should be around 400-410 g. Remember the weight as you’ll need it later (to measure ⅒ of the dough).
Roughly cut the dough into 10 pieces.
Starting from the big piece, measure the weight again till it weighs ⅒ of the total weight (in my case, 40-41 g). If it’s heavier, pinch off the dough and add the extra dough to a smaller dough, by stuffing the extra into the inside of the smaller dough.
Roll the 10 pieces of biscuit dough into 10 balls. Place them on a baking sheet lined with a silicone baking mat or baking sheet. Cover with plastic wrap and rest in the refrigerator for 10 minutes until it hardens a bit.
Step 1 - Making Main Dough
In a stand mixer bowl, combine 225 g (1 ¾ cup + 2 Tbsp) bread flour, 25 g (3 ½ Tbsp) cake flour, 40 g (3 Tbsp) granulated sugar, 3 g (1 tsp) kosher salt, and 4 g (1 tsp) instant dry yeast. Whisk all together.
Set your mixer with a dough hook attachment.
Add 1 large beaten egg and 50 ml (3 ½ Tbsp) milk and 50 ml (3 ½ Tbsp) water, both of which have been kept at 86ºF (30ºC), to the bowl with dry ingredients.
Start kneading on low speed (speed 2). Use a silicone spatula to scrape the sides and bottom of the bowl a couple of times.
Continue to knead until it clings to the hook and cleans the sides of the bowl.
Once the dough starts to come together, add the butter and continue to mix at low speed until the butter has been incorporated. Then increase speed to medium and knead until the dough is silky, smooth, and elastic.
When the dough gets silky and smooth, pull the end of your dough with your thumb and fingers. Keep spreading the dough with your fingers, stretching the dough into a thin translucent membrane. This test is called Windowpane Test to see if the dough's gluten has been developed enough. If the dough tears, the gluten isn’t quite ready yet. Knead the dough for another 2 minutes and test again.
Shape the dough into a ball by pulling all sides of the ball to the bottom and pinching them together. Place the dough in a bowl (the seam on the bottom).
Cover the bowl with a plastic wrap and let the dough rise in a warm place until the dough has doubled in size, about 1-2 hours. I use a Proof setting (100ºF/38ºC) in my oven.
Step 2 - Making the Biscuit Dough
In a clean stand mixer bowl, add 60 g (About 4 Tbsp) unsalted butter and 100 g (½ cup) granulated sugar.
Mix until well blended and smooth.
Slowly add a very small amount of 1 large beaten egg (46-50 g/ml) into the bowl and blend well together before you add another small amount of the egg. Continue until all the egg is well blended.
Sift 200 g (1 ½ cup + 2 Tbsp) cake flour and 2 g (½ tsp) baking powder into the mixture.
Mix until it’s incorporated and the dough is not floury. Then take out the dough and form it into a ball.
Measure the weight of the biscuit dough. It should be around 400-410 g. Remember the weight as you’ll need it later (to measure ⅒ of the dough).
Roughly cut the dough into 10 pieces.
Starting from the big piece, measure the weight again till it weighs ⅒ of the total weight (in my case, 40-41 g). If it’s heavier, pinch off the dough and add the extra dough to a smaller dough, by stuffing the extra into the inside of the smaller dough.
Roll the 10 pieces of biscuit dough into 10 balls. Place them on a baking sheet lined with silicone baking mat or baking sheet. Cover with plastic wrap and rest in the refrigerator for 10 minutes until it hardens a bit.
Step 3 - Shaping the Main Dough
Once the dough has doubled in size, dust your index finger with flour and put it in the center of the dough. If the hole doesn’t close, then the dough is ready for the next step.
Remove the dough with a silicone dough scraper and transfer to a lightly floured work surface. Press the dough with your hands to release gas in the dough and deflate.
Fold the dough in thirds and then fold in thirds again. Flip to keep the seam side on the bottom. Shape the dough into a ball. To close the seam line, rotate the dough (clockwise) with both hands while the seam line is touching the work surface.
Measure the weight of the main dough. It should be around 460-470 g. Remember the weight as you’ll need it later (to measure ⅒ of the dough).
Using a dough scraper, roughly cut the dough into 10 equal pieces. Starting from the big piece, measure the weight again till it weighs ⅒ of the total weight (in my case, 46-47 g).
If it’s heavier, pinch off the dough from the center and add the extra dough to a smaller dough, by stuffing the extra into the inside of the smaller dough. Knead to combine well. Shape each dough piece into a nice round ball, pulling from all the sides and tuck into the bottom. Place the dough on your left (right) palm, and rotate it with your right (left) hand, keeping the seam side on the bottom.
Put the dough on a baking sheet lined with parchment paper or a silicone baking mat. Cover the dough with plastic wrap (I use a portable cupcake holder lid) to prevent it from drying. Rest the dough for 15 minutes at room temperature.
Step 4 - Final Shaping
Put the biscuit dough on the lightly floured work surface and flatten the dough with your hand.
Using a rolling pin, roll out into 4 inch (10-12 cm) flat rounds. Continue the rest until the main dough is ready.
After 15 minutes of resting, flatten the main dough with your hand and fold in thirds.
Then fold in thirds one more time and pinch both ends to shape the dough into a ball.
Pull the dough from all sides towards the seam on the bottom. Place the dough on your left (right) palm, and rotate it with your right (left) hand a few times, keeping the seam side on the bottom.
Place the biscuit dough on your palm and put the main dough in the middle, seam side facing up.
Then flip to show the biscuit dough on top. Gently pull all sides of the biscuit dough wrapping around the main dough.
Coat the biscuit dough with granulated sugar (2 Tbsp) and remove the excess sugar. Then using a dough scraper or knife, gently score the biscuit dough into a crisscross pattern (I score 3 lines each side).
Place the dough on the baking sheet, seam side on the bottom. Cover the dough with plastic wrap to prevent from drying.
Let the dough rise in a warm place until the dough rises one and a half (1.5 x) in size, about 50 minutes (I used the Proof setting (100ºF/38ºC) in my oven).
When the dough has risen halfway, preheat the oven to 350ºF (180ºC). Note: If you are using the oven for proof, you have to transfer the dough to a warmer place so you can preheat the oven.
Step 5 - Baking
Bake at for 13-15 minutes. Toward the end of baking if you see the bread is not being browning evenly, rotate the bread once so that the bread gets an even color.
Once the bread is baked, transfer to a wire rack. Let it cool for 5 minutes, and enjoy!
To Store
Once the bread is cooled completely, individually wrap it in plastic to prevent it from drying. Then put it in an airtight container or bag and refrigerate for up to 3 days, or freeze for up to a month. Defrost overnight in the refrigerator or microwave to warm up inside. Then bake it in the oven at 350ºF (180ºC) until crispy on the outside.",en-US,{},4.72,,Just One Cookbook,195,10 serving(s)
The Best French Toast,Namiko Chen,https://www.justonecookbook.com/french-toast/,Japanese,https://www.justonecookbook.com/wp-content/uploads/2018/12/French-Toast-I.jpg,"['3 large eggs (50 g each w/o shell)', '¼ cup sugar', '½ tsp pure vanilla extract', '2 ½ cups whole milk', '1 French baguette', '2 Tbsp unsalted butter', 'confectioners’ sugar/powdered sugar ((if desired))', 'maple syrup ((if desired))']","Gather all the ingredients.
In a large bowl, beat the eggs.
Add ¼ cup sugar and ½ tsp vanilla. Whisk well to combine.
Add 2 ½ cup milk and whisk well together.
Cut the French baguette into 1.5-2 inch (4-5 cm) thickness.
Soak both sides of the bread in the mixture and place them in a deep baking dish, with the soft white side facing up.
Pour the leftover mixture into the baking dish.
Let it soak for 5 minutes, and flip to soak the other side for 5 minutes. The side facing up now is the “dry” side. You can prepare fruits, powder sugar, and maple syrup during this time.
Preheat the oven to 350 ºF (180 ºC). Grease the rimmed baking sheet with butter. Heat 1-2 Tbsp butter in the frying pan or griddle.
When the butter is melted and pan is hot, place the bread, facing the “dry” side DOWN. *The “dry” side is the side facing up in the image on the right.
Cook until the bottom is golden brown. Then turn over to cook the other side until golden.
When both sides are nicely brown, transfer to the baking sheet.
Bake at 350ºF (180ºC) for 6 minutes. For a convection oven, reduce cooking temperature by 25ºF (15ºC).
Remove from the oven and serve on a plate.
Sprinkle powder sugar and drizzle maple syrup as desired.
To Store
You can keep the leftovers in an airtight container and store in the refrigerator for up to 3 days and in the freezer for a month.",en-US,{},4.62,,Just One Cookbook,35,4 serving(s)
