title,author,url,cuisine,image_url,ingredients,instructions,language,nutrients,ratings,reviews,site_name,total_time,yields
Melon Pan,Namiko Chen,https://www.justonecookbook.com/melon-pan/,Japanese,https://www.justonecookbook.com/wp-content/uploads/2016/08/Melon-Pan.jpg,"['1 ¾ cup bread flour', '3 ½ Tbsp cake flour', '1 tsp kosher/sea salt (I use Diamond Crystal; Use half for table salt)', '3 Tbsp sugar', '1 ¼ tsp instant yeast ((see Notes if you use active dry yeast))', '1 large egg (50 g w/o shell) ((beaten))', '3 Tbsp whole milk', '3 Tbsp water ((3 Tbsp + 1 tsp to be precise; keep at 86ºF/30ºC))', '2 ½ Tbsp unsalted butter ((cut into small cubes and at room temp))', '4 Tbsp unsalted butter ((at room temp))', '½ cup sugar', '1 large egg (50 g w/o shell) ((beaten))', '1 ⅔ cup cake flour', '½ tsp baking powder', '2 Tbsp sugar']","Gather all the ingredients. I have 2 videos for this recipe: the hand-kneading method and the stand mixer method.
Step 1 - Making Main Dough
In a large bowl, combine 225 g (1 ¾ cup + 2 Tbsp) bread flour, 25 g (3 ½ Tbsp) cake flour, 40 g (3 Tbsp) granulated sugar, and 3 g (1 tsp) kosher salt.
Add 4 g (1 tsp) instant dry yeast and 1 large beaten egg to the bowl with dry ingredients.
Add 50 ml (3 ½ Tbsp) milk and 50 ml (3 ½ Tbsp) water, both at 86ºF (30ºC). Using a silicone spatula or your fingertips, gently mix the ingredients together until they are combined.
In the beginning, the dough is very sticky and wet, but keep mixing until it forms a loose, sticky ball. Also, use the dough to pick up the flour on the sides of the mixing bowl. This step should take about 2 minutes. Transfer the dough from the bowl to a lightly floured work surface.
Press the heels of your hands into the dough, pushing forward slightly. Fold the top half of the dough in half back toward you. Then rock forward on the lower part of your palm to press it flat.
Turn the dough slightly (to clockwise), fold it in half, and rock into it again with the lower part of your palm. This process is called ""punching"" the dough and the goal is to lengthen and stretch the gluten strands in the dough. Repeat for 5 minutes or so. Tip: If the dough doesn't seem to be losing its stickiness, sprinkle more flour over the top and work it into the dough. You can lightly dust your hands with flour to keep the dough from sticking too much.
After “punching” for 5 minutes and the dough gets more elastic, press and stretch the dough, about 10 inches (25 cm). Then put small cubes of 35 g (2 ½ Tbsp) unsalted butter on top of the dough. Roll up the dough tucking the butter in, and then continue the kneading process.
Your hands, dough, and the work surface will get oily and messy in the beginning. Don't’ be panic. I recommend using a metal/silicone dough scraper to collect the dough stuck on the work surface once in a while and keep kneading.
As you knead, the dough will absorb the butter and it will eventually become very smooth and easier to work with. Finally, start banging the dough onto the work surface and fold it over away from you. This helps develop the gluten (elasticity). Bang the dough, turn it 90 degrees, and “punch” it, using the lower part of your palm. Continue this process for 10 minutes or until the dough is smooth, supple, and silky. Tip: Don’t let go of the dough when you are banging onto the work surface and don’t let it rest for too long between turns.
When the dough gets silky and smooth, pull the end of your dough with your thumb and fingers. Keep spreading the dough with your fingers, stretching the dough into thin translucent membrane. This test is called Windowpane Test to see if the dough's gluten has been developed enough. If the dough tears, the gluten isn’t quite ready yet. Knead the dough for another 2 minutes and test again.
Shape the dough into a ball by pulling all sides of the ball to the bottom and pinching them together. Place the dough in a bowl (the seam on the bottom).
Cover the bowl with a plastic wrap and let the dough rise in a warm place until the dough has doubled in size, about 1-2 hours. I use a Proof setting (100ºF/38ºC) in my oven.
Step 2 - Making the Biscuit Dough
In a large bowl, add 60 g (About 4 Tbsp) unsalted butter and mix with the silicone spatula until it becomes smooth.
Add 100 g (½ cup) granulated sugar and mix with the silicone spatula until they blend well together.
Slowly add a very small amount of 1 large beaten egg (46-50 g/ml) into the bowl and blend well together before you add another small amount of the egg. Continue until all the egg is well blended.
Sift 200 g (1 ⅔ cup) cake flour and 2 g (½ tsp) baking powder into the mixture.
Using the silicone spatula, mix well until the dough is not floury. Collect the dough and make it into a ball.
Measure the weight of the biscuit dough. It should be around 400-410 g. Remember the weight as you’ll need it later (to measure ⅒ of the dough).
Roughly cut the dough into 10 pieces.
Starting from the big piece, measure the weight again till it weighs ⅒ of the total weight (in my case, 40-41 g). If it’s heavier, pinch off the dough and add the extra dough to a smaller dough, by stuffing the extra into the inside of the smaller dough.
Roll the 10 pieces of biscuit dough into 10 balls. Place them on a baking sheet lined with a silicone baking mat or baking sheet. Cover with plastic wrap and rest in the refrigerator for 10 minutes until it hardens a bit.
Step 1 - Making Main Dough
In a stand mixer bowl, combine 225 g (1 ¾ cup + 2 Tbsp) bread flour, 25 g (3 ½ Tbsp) cake flour, 40 g (3 Tbsp) granulated sugar, 3 g (1 tsp) kosher salt, and 4 g (1 tsp) instant dry yeast. Whisk all together.
Set your mixer with a dough hook attachment.
Add 1 large beaten egg and 50 ml (3 ½ Tbsp) milk and 50 ml (3 ½ Tbsp) water, both of which have been kept at 86ºF (30ºC), to the bowl with dry ingredients.
Start kneading on low speed (speed 2). Use a silicone spatula to scrape the sides and bottom of the bowl a couple of times.
Continue to knead until it clings to the hook and cleans the sides of the bowl.
Once the dough starts to come together, add the butter and continue to mix at low speed until the butter has been incorporated. Then increase speed to medium and knead until the dough is silky, smooth, and elastic.
When the dough gets silky and smooth, pull the end of your dough with your thumb and fingers. Keep spreading the dough with your fingers, stretching the dough into a thin translucent membrane. This test is called Windowpane Test to see if the dough's gluten has been developed enough. If the dough tears, the gluten isn’t quite ready yet. Knead the dough for another 2 minutes and test again.
Shape the dough into a ball by pulling all sides of the ball to the bottom and pinching them together. Place the dough in a bowl (the seam on the bottom).
Cover the bowl with a plastic wrap and let the dough rise in a warm place until the dough has doubled in size, about 1-2 hours. I use a Proof setting (100ºF/38ºC) in my oven.
Step 2 - Making the Biscuit Dough
In a clean stand mixer bowl, add 60 g (About 4 Tbsp) unsalted butter and 100 g (½ cup) granulated sugar.
Mix until well blended and smooth.
Slowly add a very small amount of 1 large beaten egg (46-50 g/ml) into the bowl and blend well together before you add another small amount of the egg. Continue until all the egg is well blended.
Sift 200 g (1 ½ cup + 2 Tbsp) cake flour and 2 g (½ tsp) baking powder into the mixture.
Mix until it’s incorporated and the dough is not floury. Then take out the dough and form it into a ball.
Measure the weight of the biscuit dough. It should be around 400-410 g. Remember the weight as you’ll need it later (to measure ⅒ of the dough).
Roughly cut the dough into 10 pieces.
Starting from the big piece, measure the weight again till it weighs ⅒ of the total weight (in my case, 40-41 g). If it’s heavier, pinch off the dough and add the extra dough to a smaller dough, by stuffing the extra into the inside of the smaller dough.
Roll the 10 pieces of biscuit dough into 10 balls. Place them on a baking sheet lined with silicone baking mat or baking sheet. Cover with plastic wrap and rest in the refrigerator for 10 minutes until it hardens a bit.
Step 3 - Shaping the Main Dough
Once the dough has doubled in size, dust your index finger with flour and put it in the center of the dough. If the hole doesn’t close, then the dough is ready for the next step.
Remove the dough with a silicone dough scraper and transfer to a lightly floured work surface. Press the dough with your hands to release gas in the dough and deflate.
Fold the dough in thirds and then fold in thirds again. Flip to keep the seam side on the bottom. Shape the dough into a ball. To close the seam line, rotate the dough (clockwise) with both hands while the seam line is touching the work surface.
Measure the weight of the main dough. It should be around 460-470 g. Remember the weight as you’ll need it later (to measure ⅒ of the dough).
Using a dough scraper, roughly cut the dough into 10 equal pieces. Starting from the big piece, measure the weight again till it weighs ⅒ of the total weight (in my case, 46-47 g).
If it’s heavier, pinch off the dough from the center and add the extra dough to a smaller dough, by stuffing the extra into the inside of the smaller dough. Knead to combine well. Shape each dough piece into a nice round ball, pulling from all the sides and tuck into the bottom. Place the dough on your left (right) palm, and rotate it with your right (left) hand, keeping the seam side on the bottom.
Put the dough on a baking sheet lined with parchment paper or a silicone baking mat. Cover the dough with plastic wrap (I use a portable cupcake holder lid) to prevent it from drying. Rest the dough for 15 minutes at room temperature.
Step 4 - Final Shaping
Put the biscuit dough on the lightly floured work surface and flatten the dough with your hand.
Using a rolling pin, roll out into 4 inch (10-12 cm) flat rounds. Continue the rest until the main dough is ready.
After 15 minutes of resting, flatten the main dough with your hand and fold in thirds.
Then fold in thirds one more time and pinch both ends to shape the dough into a ball.
Pull the dough from all sides towards the seam on the bottom. Place the dough on your left (right) palm, and rotate it with your right (left) hand a few times, keeping the seam side on the bottom.
Place the biscuit dough on your palm and put the main dough in the middle, seam side facing up.
Then flip to show the biscuit dough on top. Gently pull all sides of the biscuit dough wrapping around the main dough.
Coat the biscuit dough with granulated sugar (2 Tbsp) and remove the excess sugar. Then using a dough scraper or knife, gently score the biscuit dough into a crisscross pattern (I score 3 lines each side).
Place the dough on the baking sheet, seam side on the bottom. Cover the dough with plastic wrap to prevent from drying.
Let the dough rise in a warm place until the dough rises one and a half (1.5 x) in size, about 50 minutes (I used the Proof setting (100ºF/38ºC) in my oven).
When the dough has risen halfway, preheat the oven to 350ºF (180ºC). Note: If you are using the oven for proof, you have to transfer the dough to a warmer place so you can preheat the oven.
Step 5 - Baking
Bake at for 13-15 minutes. Toward the end of baking if you see the bread is not being browning evenly, rotate the bread once so that the bread gets an even color.
Once the bread is baked, transfer to a wire rack. Let it cool for 5 minutes, and enjoy!
To Store
Once the bread is cooled completely, individually wrap it in plastic to prevent it from drying. Then put it in an airtight container or bag and refrigerate for up to 3 days, or freeze for up to a month. Defrost overnight in the refrigerator or microwave to warm up inside. Then bake it in the oven at 350ºF (180ºC) until crispy on the outside.",en-US,{},4.72,,Just One Cookbook,195,10 serving(s)
Fluffy Japanese Souffle Pancakes,Namiko Chen,https://www.justonecookbook.com/souffle-pancake/,Japanese,https://www.justonecookbook.com/wp-content/uploads/2020/03/Fluffy-Japanese-Souffle-Pancake-4.jpg,"['2 large eggs (50 g each w/o shell)', '1 ½ Tbsp whole milk', '¼ tsp pure vanilla extract', '¼ cup cake flour', '½ tsp baking powder', '2 Tbsp sugar', '1 Tbsp neutral-flavored oil (vegetable, canola, etc) ((for greasing the pan))', '2 Tbsp water ((for steaming))', '½ cup heavy (whipping) cream', '1 ½ Tbsp sugar ((not so sweet, you can add more if you like))', '1 Tbsp confectioners’ sugar/powdered sugar', 'fresh berries ((strawberries, blueberries, etc))', 'maple syrup']","Gather all the ingredients.You will also need a 12-inch non-stick frying pan (large enough to cook 3 pancakes at the same time) with a lid.
Separate egg whites and egg yolks into two different bowls. Put the bowl with egg whites in the freezer for 15 minutes. Why do we freeze egg whites? Please read 3 Tips to Make Perfect Meringue (Egg Whites) in this post.
In the meantime, add milk and vanilla to the egg yolks and whisk until thick and frothy.
Sift the cake flour and baking powder into the bowl.
Whisk to combine thoroughly (but do not over-mix) and set aside.
After 15 minutes, take out the bowl with egg whites from the freezer. The egg whites should be half frozen. Now start beating egg whites.
When the egg whites turn frothy and pale white, gradually add in sugar (roughly ⅓ at a time). Continue to whip the egg whites.
The egg whites will become glossier and firmer. Stop beating when you lift up the hand mixer and the egg whites stand right up with stiff peaks slightly bending over.
Heat the large non-stick frying pan to 300ºF (150ºC) over the lowest heat. Brush with cooking oil and lightly remove any visible oil (otherwise the pancakes will have a spotty pattern). Keep the heat on while you combine egg whites and egg yolk mixture.
Take ⅓ of egg whites and add to the egg yolk mixture. Whisk together (don’t worry too much about breaking air bubbles at this step).
Next, take half of the egg whites and add to the egg yolk mixture. Using a whisk, gently fold in without breaking the air bubbles in the egg whites. Why do we use a whisk instead of a silicone spatula? Please read 3 Tips to Make Perfect Meringue (Egg Whites) in this post.
Now transfer the egg yolk mixture into egg whites. Carefully fold in two mixtures together without breaking the air bubbles. Make sure to gently mix the batter thoroughly!
For my stove and frying pan, I kept 300 ºF (150 ºC) all times on low heat. Remember each pancake gets roughly 4 scoops of batter, so that’s a total of 12 scoops for 3 pancakes. Now, scoop the batter and place on the frying pan. My recommendation is to use a small ladle (or a serving spoon that’s bigger than a regular spoon - probably 2-3 Tbsp) and make a tall pancake. Next, stack one more scoop to the first pancake. Then move on to the next two pancakes giving each 2 small scoops.
By the time all 3 pancakes have 2 scoops, the surface of the batter is slightly dry already, so you can stack one more scoop on top, keeping it up high. In the bowl, you should still have roughly 3 scoops left (if you have slightly more, that’s okay).
Set timer for 6-7 minutes, add 1 Tbsp water in 3 empty spaces inside the pan and cover with the lid. Water keeps the pancake moist. Please note: the suggested time is just a guideline and it’s based on the stove and frying pan that I'm using.
After 2 minutes passed, open the lid, and add one more scoop for each pancake (or more scoops if you have more batter). Make sure to stack high, not wide. If the water has evaporated, add a little bit more. Cover with lid and cook.
After 6-7 minutes passed, using the offset spatula, lift the pancake VERY GENTLY. If you feel the pancake is stuck, don’t touch until they firm up a little. If you force it, the pancake will crack in the middle. When the pancake is ready, you can easily move the pancake.
Here is another set of images to show the process. Slightly pull the pancake to create an empty space and gently flip over with “rolling over” motion.
Add water in empty spaces and set a timer for 4 to 5 minutes to cook the other side on the lowest heat.
Once they are nicely browned, transfer the pancakes to your serving plates.
Place fresh cream on the pancakes and top with berries. Dust the pancake with confectioners’ sugar and drizzle with maple syrup. Enjoy!
Fresh Whipped Cream
Prepare an ice bath by putting ice cubes and water in a large bowl and placing a clean and dry mixing bowl over. Add heavy cream and sugar to keep cool.
Whisk on high speed until medium to firm peaks form (should not be runny, but soft and fluffy firm whipped cream). Keep it chilled until you're ready to serve the pancakes.",en-US,{},4.54,,Just One Cookbook,45,3 serving(s)
Homemade Fruit Granola (Furugura),Namiko Chen,https://www.justonecookbook.com/easy-homemade-granola/,American,https://www.justonecookbook.com/wp-content/uploads/2020/03/Easy-Homemade-Granola-–-Copycat-Furugura-1613-I.jpg,"['3 cups old-fashioned rolled oats', ""2 cups puffed rice ((I used Crisp Rice Cereal from Trader Joe's))"", '1 ½ cup raw nuts and or seeds', '1 tsp kosher/sea salt (I use Diamond Crystal; Use half for table salt)', '½ cup coconut oil ((melted, or olive oil))', '½ cup maple syrup ((or honey))', '1 cup dried and freeze-dried fruits', '¼ cup coconut flakes ((raw or roasted))']","Gather all the ingredients. Preheat the oven to 350ºF (180ºC) and place the oven rack in the center. For a convection oven, reduce cooking time by 25ºF (15ºC). Line a rimmed half-sheet baking pan with parchment paper.
In a large mixing bowl, add the oats, puffed rice, kosher salt, and unroasted nuts and seeds (pecans, sliced almonds, and pumpkin seeds). If your nuts and seeds are roasted, mix in after the granola is completely cool.
Stir to blend together with a silicone spatula. If you are going to add spices (or other dry ingredients), you can add now before wet ingredients so you can blend well.
Pour in the coconut oil and maple syrup and mix well until everything is well-coated.
Transfer the granola onto your prepared baking pan. With the back of the silicone spatula, spread it in an even layer and press down the granola.
Bake at 350ºF (180ºC) for 12-15 minutes (We will bake a total of 25-30 minutes) and remove the pan from the oven.
Stir to get an even color and make sure the granola is cooking evenly. Press down the granola with the back of the spatula to create an even layer. If you use raw coconut flakes, add them during the last 10 minutes of baking.
Put the baking pan back in the oven, and continue to bake for another 12-15 minutes, or until lightly golden/brown and toasty. Remove the pan from the oven and let the granola cool completely on a wire rack, roughly for 1 hour. The granola will continue cooking and firm up during this time so do not touch it.
Meanwhile, chop the dried fruits and freeze-dried fruits into small pieces.
When the granola is COMPLETELY cool, top with the dried fruits and freeze-dried fruits (including my roasted coconut flakes). Break the granola into pieces with your hands (I like to keep bigger chunks).
Store the granola in airtight jars or containers at room temperature for 7-10 days. You can also freeze them for up to 2 months.",en-US,{},4.8,,Just One Cookbook,100,8 serving(s)
Tamagoyaki (Japanese Rolled Omelette),Namiko Chen,https://www.justonecookbook.com/tamagoyaki-japanese-rolled-omelette/,Japanese,https://www.justonecookbook.com/wp-content/uploads/2019/08/tamagoyaki-1049.jpg,"['3 large eggs (50 g each w/o shell)', '2 Tbsp neutral-flavored oil (vegetable, canola, etc)', '1 ½ sheet nori (seaweed) ((optional; for omelette with nori in it))', '3 Tbsp dashi (Japanese soup stock; click to learn more)', '2 tsp sugar', '1 tsp soy sauce ((use GF soy sauce for gluten-free))', '1 tsp mirin', '2 pinch kosher/sea salt (I use Diamond Crystal; Use half for table salt)', '3 oz daikon radish ((1"", 2.5 cm; choose green top part as it is sweeter than white part))', 'soy sauce ((use GF soy sauce for gluten-free))']","Gather all the ingredients.
Gently whisk the eggs in a bowl. It's best to ""cut"" the eggs with chopsticks in a zig-zag motion and do not over mix.
In another bowl, combine the seasonings and mix well.
Pour the seasonings mixture into the egg mixture and whisk gently. Then pour the mixture into a measuring cup with spout and handle (so that it'll be easier to pour into the frying pan).
Tamagoyaki Pan Method
Heat the pan over medium heat, dip a folded paper towel in oil and apply to the pan. Put a little bit of egg mixture to see if the pan is hot.
When you hear the sizzling sound, pour a thin layer of egg mixture in the pan, tilting to cover the bottom of the pan.
Poke the air bubbles to release the air. After the bottom of the egg has set but still soft on top, start rolling into a log shape from one side to the other.
Move the rolled omelette to the side where you started to roll, and apply oil to the pan with a paper towel, even under the omelette.
Pour the egg mixture to cover the bottom of the pan again. Make sure to lift the omelette to spread the mixture underneath.
When the new layer of egg has set and still soft on top, start rolling from one side to the other.
Move the rolled omelette to the side where you started to roll, and apply oil to the pan with a paper towel, even under the omelette.
Pour the egg mixture to cover the bottom of the pan again. Make sure to lift the omelette to spread the mixture underneath.
When the new layer of egg has set and still soft on top, start rolling from one side to the other.
Now this is 3rd round. Poke the air bubbles...
The 4th round. Make sure to spread all over including under the rolled egg.
Continue rolling into the log. Tip: Control the temperature of the pan by lifting the frying pan rather than adjusting the stove heat. If the heat is too weak, the egg will stick to the frying pan so be careful.
This is the 5th round.
This is the 6th round and the final...
You can brown the omelette a little bit.
Remove from the pan and place the omelette on the bamboo sushi mat and wrap it up. Shape the egg when it is still hot. Let it stand for 5 minutes.
Round Frying Pan Method
Heat the pan over medium heat, dip a folded paper towel in oil and apply to the pan. Put a little bit of egg mixture to see if the pan is hot. When you hear the sizzling sound, pour a thin layer of egg mixture in the pan, tilting to cover the bottom of the pan.
Poke the air bubbles to release the air. After the bottom of the egg has set but still soft on top, start rolling into a log shape from one side to the other. Here I put half sheet of nori and then rolled (optional).
Move the rolled omelette to the side where you started to roll, and apply oil to the pan with a paper towel, even under the omelette. Pour the egg mixture to cover the bottom of the pan again. Make sure to lift the omelette to spread the mixture underneath.
When the new layer of egg has set and still soft on top, start rolling from one side to the other. This is optional but I put another layer of nori sheet before rolling.
Move the rolled omelette to the side where you started to roll, and apply oil to the pan with a paper towel, even under the omelette. Then pour the egg mixture to cover the bottom of the pan again. Make sure to lift the omelette to spread the mixture underneath.
When the new layer of egg has set and still soft on top, start rolling from one side to the other. I put another sheet of nori here before rolling. Continue until all the egg mixture is finished.
Remove from the pan and place the omelette on the bamboo sushi mat and wrap it up. Shape the egg when it is still hot. Let it stand for 5 minutes.
To serve
Slice the omelette into ½"" (1 cm) pieces.
Peel and grate daikon. Gently squeeze water out. Serve Tamagoyaki with grated daikon and pour soy sauce over daikon.
To Keep
You can put tamagoyaki in an airtight container and store in the freezer for up to 2 weeks. Defrost overnight in the refrigerator or microwave.",en-US,{},4.62,,Just One Cookbook,10,2 serving(s)
