title,author,url,cuisine,image_url,ingredients,instructions,language,nutrients,ratings,reviews,site_name,total_time,yields
Spicy ground beef and green beans,Spice the Plate,https://www.spicetheplate.com/beef/spicy-ground-beef-green-beans/,,https://www.spicetheplate.com/wp-content/uploads/2015/01/Spicy-Ground-Beef-and-Breen-Beans-1.jpg,"['1 pound green beans, ends trimmed, let dry', '⅕ pound ground beef', '2 dried chili peppers, cut into small pieces', '1 tablespoon minced garlic', '½ tablespoon minced ginger', 'For marinating the beef:', 'a touch of salt', 'a touch of sugar', 'a touch of oil', '1 tablespoon soy sauce', '1 tablespoon cooking wine', 'For cooking and seasoning:', '½ cup vegetable oil', '¼ teaspoon salt', '¼ teaspoon sugar', '1 tablespoon soy sauce']","Marinating the beef with salt, sugar, oil, soy sauce and cooking wine for about 10 minutes.
Heat ½ cup of oil in the pan over medium heat, carefully add in the green beans, deep fry for about 8 minutes until their surfaces are crisp.
Fish the green beans out and set aside, leave half of the oil in the pan and discard the other half.
Turn to medium-high heat and stir in the dried chili peppers, garlic and ginger, sauté for about 2 minutes until fragrant and browned.
Add the ground beef into the pan and stir fry for another 2 minutes until the beef has changed color.
Stir in the green beans and toss in the salt, sugar and soy sauce, sitr fry for another 2-3 minutes and serve.",en-US,{},4.7,,Spice the Plate,40,2 serving(s)
Tasty beef and bean sprouts,Spice the Plate,https://www.spicetheplate.com/beef/tasty-beef-and-bean-sprouts/,,https://www.spicetheplate.com/wp-content/uploads/2014/12/Tasty-beef-and-bean-sprouts-11-of-12-300x200.jpg,"['⅕ pound beef steak, cut into fine strips', '1 pound bean sprouts, washed and let dry', '2 red long hot peppers', '1 green long hot pepper', '3 cloves garlic, sliced', '3 ginger slices', 'For marinating the beef :', 'a touch of salt', '1 tablespoon soy sauce', '1 tablspoon cooking wine', '½ teaspoon potato starch', 'a touch of black pepper', 'For seasoning:', '3 tablespoons vegetable oil', '¼ teaspoon salt', '½ tablespoon soy sauce', '½ tablespoon oyster sauce', 'a touch of black pepper to taste']","Massage the beef with salt, soy suace, cooking wine, potato starch and black pepper mixture and marinting for about 20 minutes.
Heat 1 tablespoon of oil in a pan over medium heat, add in the beef and stir fry for 1-2 minutes until the beef has changed color, set aside.
Turn to medium-high heat, add 2 tablespoons of oil into the pan and stir in the garlic and hot long peppers, cook for 1-2 minutes until fragrant.
Carefully add the bean sprounts into the pan and sitr fry for 3-4 minutes until soft.
Toss in the salt, soy sauce, oyster sauce and add the beef back into the pan, stir fry for another 2 minutes.
Sprinkle with a touch of black pepper and serve.",en-US,{},-1.0,,Spice the Plate,35,2 serving(s)
Beef and Tomato Stew,Spice the Plate,https://www.spicetheplate.com/beef/beef-and-tomato-stew/,,https://www.spicetheplate.com/wp-content/uploads/2015/03/Beef-and-Tomato-Stew-8-300x200.jpg,"['1 pound beef cubes', '2 tomatoes, cut into 8 pieces each', '3 stalks gren onion, cut into long strips', '3-4 slices ginger', '4 cloves garlic', '3 star anise', '2 green and 2 red small chili peppers, cut into pieces for topping (optional)', 'a handful of cilantro for topping', '¼ cup vegetable oil', '½ tablespoon sugar', '2 cups hot water', '1 teaspoon salt', '1 tablespoon soy sauce']","Rinse the beef in cold water(about 2 cups) in a pan, bring to boil over medium-high heat ( took about 5 minutes for me), boil for about 1-2 minutes until the beef is no longer pink, discard the water in the pan and rinse the beef under running cold water for about 30 seconds, drain well and set aside.
Heat oil into a pan over medium-high heat, stir in the garlic, ginger, green onion and star anise, stir fry for about 2 minutes until fragrant.
Add the beef cubes into the pan and cook for about 3 minutes until they are browned.
Add in the tomato and toss in the sugar, cook for about 2-3 minutes until the tomatoes has turned soft.
Pour in the hot water and turn to medium heat, simmer for about 20-25 minutes with lid on, stir occasionally.
Toss in the salt and soy sauce, stir and mix well, cook for another 2-3 minutes.
Top with cilantro and peppers to serve.",en-US,{},5.0,,Spice the Plate,60,2 serving(s)
Korean Style Pan-fried Pork Belly,Spice the Plate,https://www.spicetheplate.com/pork/korean-style-pan-fried-pork-belly/,,https://www.spicetheplate.com/wp-content/uploads/2015/03/Korean-style-pan-fried-pork-belly-7.jpg,"['½ pound pork belly (with or without skin)', 'cilantro for topping (optional)', 'For marinating the pork belly:', '½ teaspoon minced garlic', '½ teaspoon minced ginger', '1 tablespoon Korean hot pepper paste', '1 tablespoon honey', '1 tablespoon soy sauce', '1 tablespoon sesame oil', '1 tablespoon toasted white sesame seeds']","Marinate the pork belly with garlic, ginger, Korean hot pepper paste, honey, soy sauce, sesame oil and sesame seeds for about 20 minutes.
Turn to medium-low heat, and place the pork belly slices onto a non-stick pan.
Pan fry for about 4-5 minutes each side.
Top with cilantro to serve.",en-US,{},5.0,,Spice the Plate,40,2 serving(s)
Stir-fried Beef with Leeks,Spice the Plate,https://www.spicetheplate.com/beef/stir-fried-beef-with-leeks/,,https://www.spicetheplate.com/wp-content/uploads/2016/10/Beef-sweet-potato-noodles-10-320x320.jpg,"['½ pound thinly sliced beef ribeye', '1 stalk leek, clean and cut into shreds', '2 cloves garlic, peeled and sliced', '2-3 dried chili pepper, cut into small pieces', '3 tablespoons oil', '1 tablespoon cooking wine', '1 tablespoon soy sauce', '½ teaspoon sugar', '¼ teaspoon salt']","Heat oil in a skillet over medium-low heat, stir in the garlic and dried chili pepper, sauté for a minute or until fragrant.
Add in the beef and pour the cooking wine into the pan, stir fry quickly for 2 minutes or until the beef is no longer pink.
Stir in the leeks, continue cooking for 2 minutes or until soft, stir ocassionally.
Add soy sauce, sugar and salt, stir fry for another minute to mix well.
Serve and enjoy!",en-US,{},5.0,,Spice the Plate,11,2 serving(s)
Simple Japanese Hot Pot,Spice the Plate,https://www.spicetheplate.com/beef/simple-japanese-hot-pot/,,https://www.spicetheplate.com/wp-content/uploads/2017/02/Hot-Pot-Sukiyaki-for-One-10-320x320.jpg,"['½ pound thinly sliced beef rib eye for sukiyaki', '½ package enoki mushroom', '½ package firm tofu, cut into ½-inch slices', '½ carrot, peeled and sliced', '¼ head nappa cabbage ((about 5-6 leaves)', '1 stalk scallion, chopped', 'Broth:', '¼ cup mirin (Japanese sweet cooking rice wine)', '¼ cup soy sauce', '¼ cup water', '1 tablespoon sugar']","Combine mirin, soy sauce, water and sugar in a small sauce pan and bring it to a boil. Once boiling, turn off the heat and set aside.
Cut the ribeye steak into paper-thin slices (or most Asian grocery stores have pre-sliced beef for sale).
Brush off any loose dirt on the enoki mushrooms with a paper towel, cut off and discard the roots, tear into smaller bundles and set aside.
Cut tofu into ½-inch slices and slice the carrot.
Separate the nappa cabbage leaves from the stem, rinse them under water and set aside.
Place and arrange all the ingredients in a Japanese clay pot or a cast iron pot and pour the broth into the pot.
Cover with a lid and bring to a boil under medium-high heat.
Once boiling, turn to low heat, simmer (with lid on) for another 15-17 minutes until all ingredients are cooked through.
Sprinkle with chopped scallion to serve and enjoy!",en-US,{},-1.0,,Spice the Plate,30,1-2 serving(s)
Korean Seaweed Soup with Beef,Spice the Plate,https://www.spicetheplate.com/beef/korean-seaweed-soup-with-beef/,,https://www.spicetheplate.com/wp-content/uploads/2016/11/Korean-Seaweed-Soup-7-320x320.jpg,"['¼ cup dried seaweed', '¼ cup ground beef', '4 cups water', '1 tablespoon grated garlic', '1 tablespoon soy sauce', '1 tablespoon sesame oil', '1 tablespoon soybean sauce', 'a touch of white pepper', 'a touch of salt to taste', '1 stalk green onion, chopped for topping', 'a handful of roasted sesame seeds for topping']","Soak dried seaweed under water for about 20 minutes to rehydrate, drain well and set aside.
Mix garlic, soy sauce with the ground beef, set aside.
Heat sesame oil in a skillet, stir in the seasoned ground beef, sauté under low heat for 1-2 minutes until changed color.
Add in the hydrated seaweeds, stir fry for 2-3 minutes.
Pour in 4 cups of water, mix well, turn to high heat and cook for about 5 minutes with lid on.
Add in soybean paste, stir to mix well and simmer for about 20 minutes under low heat with lid on.
Toss in white pepper and salt to taste.
Top with roasted sesame seeds and green onion to serve.",en-US,{},-1.0,,Spice the Plate,50,4 serving(s)
Ginger Minced Pork Rice Bowl,Spice the Plate,https://www.spicetheplate.com/pork/ginger-minced-pork-rice-bowl/,,https://www.spicetheplate.com/wp-content/uploads/2016/12/Ginger-Minced-Pork-Rice-Bowl-9-320x320.jpg,"['1 pound ground pork', '1 tablespoon grated ginger', '1 tablespoon oil', '1 tablespoon sugar', '1 tablespoon rice cooking wine', '3 tablespoons soy sauce', '1 tablespoon sesame oil', '4 stalks scallion, chopped', '1 tablespoon roasted sesame seeds', '4 cups cooked white or brown rice']","Whisk together sugar, rice cooking wine and soy sauce in a small container.
Heat oil in a large skillet over medium-high heat, add ground pork and grated ginger, cook 2-3 minutes or until pork has turned brown (make sure to crumble the meat as it cooks).
Stir in the seasoning mixture, mix until well combined, allow it to simmer for 2 minutes.
Toss in sesame oil, roasted sesame seeds and chopped scallion, cook another 30 seconds before removing from heat.
Place rice in a bowl, spoon some ginger minced pork on top to serve and enjoy!",en-US,{},5.0,,Spice the Plate,11,4 serving(s)
Beef and Carrot Congee,Spice the Plate,https://www.spicetheplate.com/beef/beef-and-carrot-congee/,,https://www.spicetheplate.com/wp-content/uploads/2016/11/Beef-and-Carrot-Congee-for-Pin.jpg,"['a quarter cup long-grain white rice', '4 cups water', 'half a tablespoon oil', 'half a cup diced carrot', 'a quarter cup ground beef', '2 stalks green onion, chopped', 'half a teaspoon salt', '1 teaspoon white pepper']","Soak the white rice in water for half an hour.
While waiting for the rice, prepare carrot, green onion and beef, set aside.
Also, bring 4 cups of water to boil under high heat.
After half an hour, drain the rice and mix with half a tablespoon of oil.
Carefully stir the rice into the boiling water and stir well.
Continue cooking for 7-8 minutes under high heat, stir frequently to avoid the rice sticking to the pan, now the rice should be much bigger than before after absorbing the water.
Turn to low heat and simmer for about 40 minutes with lid on halfway, stir occasionally.
Add ground beef and carrot into the congee, stir well and keep simmering for another 2-3 minutes until they are cooked through.
Toss in the green onion, salt and white pepper, stir well and let it simmer for another minute.
Remove from heat and serve (be careful, the congee is very hot)",en-US,{},5.0,,Spice the Plate,90,2 serving(s)
Sliced Beef Over Lettuce,Spice the Plate,https://www.spicetheplate.com/beef/sliced-beef-lettuce/,,https://www.spicetheplate.com/wp-content/uploads/2016/10/Sliced-Beef-in-Black-Pepper-Sauce-12-320x320.jpg,"['4-6 beef ribeye steak, thinly sliced', '1 tablespoon butter for pan fry the beef', 'a quarter head of lettuce, shredded', '2 stalks green onion, sliced for topping', 'For the sauce:', '1 tablespoon butter', '2 tablespoons minced onion', '1 tablespoon minced garlic', '½ teaspoon black pepper', 'about ½ cup water (after tasting the sauce, feel free to adjust the amount of water)', '3 tablespoons ketchup', '1 tablespoon oyster sauce', '½ teaspoon sugar', '½ teaspoon salt']","In a small container, combine ketchup, oyster sauce, sugar and salt, mix well and set aside.
Place the shredded lettuce on a plate for serving later.
Heat butter in a skillet over medium-low heat, pan fry the thin beef slices for about 1 minute or until changed color, roll the beef slices up and place them on top of the lettuce.
Heat some more butter in the skillet, sauté the minced onion and garlic over medium-low heat until fragrant, toss in the black pepper and sauté for another 30 seconds to a minute.
Stir in the ketchup mixture previously prepared and pour in some water, stir gently with the spatula to mix everything well, when the sauce starts to bubble, keep cooking for another 1-2 minutes until the sauce is thickened a little bit and turn off the heat.
Carefully pour the sauce over the beef and top with some sliced green onion to serve.",en-US,{},5.0,,Spice the Plate,12,2 serving(s)
