title,author,url,cuisine,image_url,ingredients,instructions,language,nutrients,ratings,reviews,site_name,total_time,yields
Soy-Brown Sugar Glazed Pan-fried Tofu,Spice the Plate,https://www.spicetheplate.com/veggie/soy-brown-sugar-glazed-pan-fried-tofu/,,https://www.spicetheplate.com/wp-content/uploads/2017/04/Pan-fried-Ginger-Sesame-Tofu-19-320x320.jpg,"['Stir Fry:', 'a package of 14oz. extra-firm tofu or firm tofu, press out excess water, cut into 1-inch cubes', '3-4 tablespoons potato starch for coating the tofu cubes', '2 tablespoons oil for pan-frying', 'Sauce:', '¼ cup soy sauce', '2 tablespoons brown sugar', '1 tablespoon sesame oil', '2 tablespoons rice vinegar', '2 tablespoons sriracha sauce', '1 tablespoon grated ginger', '1 tablespoon grated garlic', '½ tablespoon potato starch, for thickening the sauce', '2 tablespoons water', '2 tablespoons toasted sesame seeds', 'Garnishment:', '2 stalks green onion, chopped diagonally', '2 lime wedges', 'Optional Extras:', 'grilled baby bok choy, grilled peppers, broccoli, etc.', 'couscous, brown rice, cauliflower rice, etc.']","Line a plate with 3-4 sheets of folded-up paper towels. Remove the tofu from the package, and place it on the paper towels. Wrap the tofu block with the paper towels and then place a pan or heavy book on top to weigh it down. For extra firm tofu, pressing for 30 minutes to get the excessive water out of the tofu (60 minutes for firm tofu).
While waiting for the tofu, whisk together soy sauce, brown sugar, sesame oil, rice vinegar, sriracha sauce, grated ginger, grated garlic, potato starch, water and toasted sesame seeds in a small bowl and set aside.
Cut the pressed tofu into 1-inch cubes, sprinkle 2-3 tablespoons of potato starch over them and toss to coat. If necessary, add more potato starch until all the cubes have a decent coating on all sides.
Heat a large cast iron pan over medium heat. Once hot, add oil into the pan, and tilt it until the bottom is coated evenly with oil. Place the tofu cubes onto the pan and pan fry for about 15 min, spending about 2-3 minutes each side until they're golden brown and crispy on all sides, remove from the pan and transfer to a clean fry plate to set aside.
Turn to low heat, give the sauce in the bowl a good stir and pour it into the same pan used to cook the tofu cubes. Cook until the sauce begins to bubble and has thickened, stirring occasionally.
Turn off the heat, add the crispy tofu cubes back into the pan and stir until the cubes are all well coated in the sauce mixture.
Scoop the remaining sauce from the pan and put it in a small container as dipping sauce.
Serve the tofu over a bed of couscous and alongside grilled baby bok choy. Garnish with chopped green onion and lime wedges to enjoy!",en-US,{},5.0,,Spice the Plate,60,2 serving(s)
Pork Belly with Spicy Garlic Sauce,Spice the Plate,https://www.spicetheplate.com/pork/pork-belly-with-spicy-garlic-sauce/,,https://www.spicetheplate.com/wp-content/uploads/2016/07/Pork-belly-salad-with-garlic-cilantro-sauce-9-300x450.jpg,"['half a pound pork belly, cut into thin slices', '⅓ bunch fresh cilantro, cut into half', '2 cloves garlic, minced', 'a handful of toasted peanut, chop them into small pieces (optionally if you are allergic to peanut)', 'a touch of toasted sesame seeds', 'For seasoning sauce:', '2 tablespoons soy sauce', '1 tablespoon Lao Gan Ma black beans chili sauce', '1 tablespoon Chinese vinegar', '1 tablespoon sesame oil', '2 cloves garlic, minced', 'Spices needed for boiling with the pork belly:', '3-4 slices ginger', 'a couple bay leaves', '1 cinnamon stick', 'a handful of Sichuan peppercorn', 'a couple of dried chili peppers']","Mix soy sauce, Lao Gan Ma black beans chili sauce, Chinese vinegar, sesame oil and minced garlic into a container as the sauce and set aside.
Fill a pan with cold water, add in ginger, bay leaves, cinnamon, peppercorn and dried chili pepper and bring to boil over high heat, continue to boil for about 10 minutes until the flavor of the spices start to come out.
Carefully stir in the pork belly slices and cook under boiling water for about 7-8 minutes or until cooked through, remove the pork belly from pan, drain well and set aside.
Top the pork belly with cilantro, garlic, peanuts and sesame seeds and pour the sauce around, mix everything well and serve.",en-US,{},5.0,,Spice the Plate,30,2-4 serving(s)
Sautéed Pork Belly with Cauliflower,Spice the Plate,https://www.spicetheplate.com/pork/sauteed-pork-belly-with-cauliflower/,,https://www.spicetheplate.com/wp-content/uploads/2016/11/Pork-Belly-with-Cauliflower-6-320x320.jpg,"['3 slices of pork belly, cut into large pieces', '1 head cauliflower, cut into bite-size florets', '1 long red pepper, sliced', '4 slices of ginger', '4 cloves of garlic, sliced', '2 stalks green onion, sliced', 'For seasoning:', '1 tablespoon soy sauce', 'a quarter teaspoon black pepper', 'a touch of salt to taste']","Soak the cauliflower florets in salted water for about 10 minutes, drain well and set aside.
Heat a pan over low heat, toss in the ginger and pork belly, stir fry for 3-4 minutes until the pork belly has released fat and no longer pink.
Turn to high heat, add in the cauliflower and pan fry for about 2 minutes.
Turn the heat back down to medium, simmer the cauliflower with lid on for about 2 minutes.
Add the garlic and red pepper into the pan, mix well and toss in soy sauce and black pepper, stir fry for another 2-3 minutes and make sure ingredients are mixed well.
Sprinkle a touch of salt to taste and stir in the green onion, cook for another 30 seconds.
Remove from pan and plate to serve.",en-US,{},-1.0,,Spice the Plate,20,3-4 serving(s)
Korean Style Pan-fried Pork Belly,Spice the Plate,https://www.spicetheplate.com/pork/korean-style-pan-fried-pork-belly/,,https://www.spicetheplate.com/wp-content/uploads/2015/03/Korean-style-pan-fried-pork-belly-7.jpg,"['½ pound pork belly (with or without skin)', 'cilantro for topping (optional)', 'For marinating the pork belly:', '½ teaspoon minced garlic', '½ teaspoon minced ginger', '1 tablespoon Korean hot pepper paste', '1 tablespoon honey', '1 tablespoon soy sauce', '1 tablespoon sesame oil', '1 tablespoon toasted white sesame seeds']","Marinate the pork belly with garlic, ginger, Korean hot pepper paste, honey, soy sauce, sesame oil and sesame seeds for about 20 minutes.
Turn to medium-low heat, and place the pork belly slices onto a non-stick pan.
Pan fry for about 4-5 minutes each side.
Top with cilantro to serve.",en-US,{},5.0,,Spice the Plate,40,2 serving(s)
Minced Pork Vermicelli,Spice the Plate,https://www.spicetheplate.com/pork/minced-pork-vermicelli/,,https://www.spicetheplate.com/wp-content/uploads/2016/06/Minced-Pork-Vermicelli-7-300x450.jpg,"['2 servings vermicelli', '1 cup minced pork', '2 tablespoons chopped green onion', '2 tablespoons minced garlic', '2 tablespoons minced ginger', '3 tablespoons oil', 'For seasoning:', '1 tablespoon dark soy sauce', '2 tablespoons Laoganma (Lao Gan Ma) Black Beans Chili Sauce']","Immerse the vermicelli under hot water for about 10 minutes, drain, rinse under cold water, drain well again and set aside.
Heat oil in a pan over medium heat, add in garlic, green onion and ginger and stir fry for about 1 minute or until fragrant.
Stir in the ground pork and stir fry for another 1-2 minutes until the pork is no longer pink.
Toss in the dark soy sauce and Lao Gan Ma Black Beans Chili Sauce and cook for a minute.
Add in 2 cups of water and turn to high heat, mix all the ingredients well, wait until the water starts to boil, slowly add in the vermicelli, cook for about 2-3 minutes until the water has almost gone.
Top with fresh chopped green onion to serve.",en-US,{},5.0,,Spice the Plate,22,2-3 serving(s)
Baked Honey BBQ Baby Back Ribs,Spice the Plate,https://www.spicetheplate.com/pork/baked-honey-bbq-baby-back-ribs/,,https://www.spicetheplate.com/wp-content/uploads/2017/05/Baked-Honey-BBQ-Baby-Back-Ribs-11-320x320.jpg,"['1.5 pound baby back ribs (about 4 pieces)', 'a large pot of cold water for boiling the pork ribs', 'Marinate:', '1 cup Ebara Yakiniku Sauce Soy Sauce', '2 tablespoons dark soy sauce', '1 tablespoon brown sugar', '3-4 cloves of garlic', '2-3 pieces of ginger', '2-3 stalks green onion, cut into long pieces', 'Toppings:', '¼ cup honey', '1 tablespoon toasted sesame seeds', 'Optional Extras:', 'Arugula salad with apple cider vinaigrette dressing', 'white or brown rice']","Fill a large pan with cold water enough to cover the baby back ribs and bring to a boil.
Once the water starts to boil, transfer the ribs onto a plate to cool down a little.
Combine Ebara Yakiniku Sauce Soy Sauce, dark soy sauce, brown sugar in a bowl.
Add the baby back ribs into a large ziploc bag after cooling down a bit, pour the sauce mixture into the bag to cover the ribs.
Add the garlic cloves, ginger and green onion into the bag and marinate the pork ribs 4-8 hours in the fridge.
Preheat the oven to 350° F, while waiting, line a baking sheet with foil.
Place the pork ribs onto the foil, bake for 20-25 minutes on the middle rack until golden brown.
Glaze the baked pork ribs with honey and sprinkle with toasted sesame seeds to serve and enjoy!",en-US,{},-1.0,,Spice the Plate,505,2 serving(s)
Sweet and Sour Meat Balls,Spice the Plate,https://www.spicetheplate.com/pork/sweet-and-sour-meatballs/,,https://www.spicetheplate.com/wp-content/uploads/2016/11/Sweet-and-Sour-Meat-Balls-6-320x320.jpg,"['Making the meat balls:', '½ pound ground beef (I used 70% lean)', '⅛ onion, minced', '2 teaspoons minced garlic', '2 teaspoons minced ginger', '2 tablespoons water', '1 tablespoon potato/corn starch', '½ tablespoon dark soy sauce', '½ tablespoon sesame oil', '1 teaspoon salt', 'For the sauce:', '2 tablespoons ketchup', '2 teaspoons rice vinegar', '1 tablespoon sugar', '¼ cup water', '1 tablespoon starch', 'a touch of roasted sesame seeds for topping', 'For cooking:', '¼ cup oil']","Whisk water, ketchup, rice vinegar, sugar, water and starch in a small container and set aide.
In a large mix bowl, combine ground beef, onion, garlic, ginger, water, starch, dark soy sauce, sesame oil and salt, insert a pair of chopsticks into the mixture, stir in one direction for a couple of minutes until the meat became sticky.
Spoon some meat mixture into your hand, roll between your hands to shape into a 1.5- inch meatballs, repeat the process until all the mixture is used.
Heat oil in a skillet over medium heat, add in the meatballs, pan fry until both sides are browned, remove from pan and set aside.
Pour the sauce mixture into a sauce pan, bring to a simmer over low heat and add in the meat balls, simmer for 20 minutes or until cook through with lid on, stir occasionally.
Top with roasted sesame seeds to serve.",en-US,{},5.0,,Spice the Plate,50,2 serving(s)
Green Pepper and Sliced Pork,Spice the Plate,https://www.spicetheplate.com/pork/green-pepper-sliced-pork/,,https://www.spicetheplate.com/wp-content/uploads/2017/01/Green-Pepper-and-Sliced-Pork-7-320x320.jpg,"['half pound thinly sliced pork for hot pot (or shabu-shabu, Japanese hot pot)', '2 Korean green peppers, sliced', '2 cloves garlic, sliced', '1 tablespoon oil', '¼ teaspoon salt', '¼ teaspoon sugar', '¼ teaspoon black pepper', '1 teaspoon dark soy sauce', '1 teaspoon cooking wine', '1 teaspoon oyster sauce']","Heat oil in a skillet over medium-high heat, sauté garlic and pepper slices for up to a minute or until fragrant.
Add in the pork, stir fry for a few minutes until only a few pink spots left (80% cooked)
Toss in salt, sugar, black pepper, dark soy sauce, cooking wine and oyster sauce, stir to mix the seasonings well with the ingredients.
Continue cooking and constantly stir a few minutes until the pork has cooked through.
Transfer to a plate and serve while hot.",en-US,{},-1.0,,Spice the Plate,15,2 serving(s)
Ginger Minced Pork Rice Bowl,Spice the Plate,https://www.spicetheplate.com/pork/ginger-minced-pork-rice-bowl/,,https://www.spicetheplate.com/wp-content/uploads/2016/12/Ginger-Minced-Pork-Rice-Bowl-9-320x320.jpg,"['1 pound ground pork', '1 tablespoon grated ginger', '1 tablespoon oil', '1 tablespoon sugar', '1 tablespoon rice cooking wine', '3 tablespoons soy sauce', '1 tablespoon sesame oil', '4 stalks scallion, chopped', '1 tablespoon roasted sesame seeds', '4 cups cooked white or brown rice']","Whisk together sugar, rice cooking wine and soy sauce in a small container.
Heat oil in a large skillet over medium-high heat, add ground pork and grated ginger, cook 2-3 minutes or until pork has turned brown (make sure to crumble the meat as it cooks).
Stir in the seasoning mixture, mix until well combined, allow it to simmer for 2 minutes.
Toss in sesame oil, roasted sesame seeds and chopped scallion, cook another 30 seconds before removing from heat.
Place rice in a bowl, spoon some ginger minced pork on top to serve and enjoy!",en-US,{},5.0,,Spice the Plate,11,4 serving(s)
