title,author,url,cuisine,image_url,ingredients,instructions,language,nutrients,ratings,reviews,site_name,total_time,yields
Lanzhou Beef Noodle Soup,Judy,https://thewoksoflife.com/lanzhou-beef-noodle-soup/,Chinese,https://thewoksoflife.com/wp-content/uploads/2014/10/lanzhou-beef-noodle-soup-4-1.jpg,"['4 lbs beef or pork soup bones', '2 1/4 lbs 1 kg beef shank', '½ of a whole roasting chicken ((or a leftover roasted chicken carcass))', '10 cups water', '4 cups about 1 liter chicken stock', 'Spice mix ((see recipe below))', 'Salt ((to taste; I added about a tablespoon))', '1/2 of a small Chinese radish ((quartered and thinly sliced))', '1 pound fresh or dried white noodles', 'Hot chili oil ((to taste, see recipe below))', 'scallion ((chopped))', 'cilantro ((chopped))', '7 star anise', '12 cloves', '1 cinnamon stick', '5 bay leaves', '6 large slices of sand ginger', '1 1/2 teaspoons fennel seeds', '1 teaspoon cumin seeds', '2 teaspoons Sichuan peppercorns', '1 1/2 teaspoons white peppercorns', '5 licorice root slices ((optional but very much recommended))', '3 pieces dried orange peel', '1 black cardamom', '3/4 cup oil', '2 star anise', '1/2 of a small cinnamon stick', '½ teaspoon Sichuan peppercorns', ""3 tablespoons crushed red pepper flakes ((just the regular kind you'd sprinkle on your pizza))"", '1 teaspoon salt', '1/4 teaspoon sugar']","Rinse the soup bones and pat dry. Roast them on a baking sheet at 400 degrees for 45 minutes. Bring a large pot of water to a boil, and add the beef shank and the chicken (or chicken carcass) to the pot. Bring everything to a boil again. Once boiling, remove the shank and the chicken, discard the water, and clean the pot. This process gets rid of any impurities, and will give your broth a cleaner flavor.
Put the beef shank and chicken back into the pot along with the roasted bones, 10 more cups of water, and 4 cups chicken stock. Make the spice mix by combining all ingredients and tying them tightly in cheese cloth with a bit of kitchen string. Add this to the pot as well and season with salt. Bring everything to a boil.
Once boiling, turn down the heat to low and let everything simmer for about 2 hours. After 2 hours have elapsed, remove the beef shank and set aside. Add the sliced radish and continue simmering for another hour. After that, use tongs to pick out and discard the spice pouch, chicken, and soup bones. Taste the broth for salt and adjust the seasoning if needed. The soup base is ready.
While all that is happening, you can take the time to make your chili oil. In a small pot, add the oil, star anise, cinnamon, and Sichuan peppercorns. Place the pot over very low heat and let everything toast together slowly for 15 minutes. Take care not to burn the spices. Use a slotted spoon to remove the spices, and turn off the heat. Let the oil cool for about 5 minutes, and then add the chili flakes. Slowly toast these in the hot oil until very fragrant (it should almost smell like popcorn), and very red. Stir in the salt and sugar.
Once the broth and chili oil are done, cook the noodles in a separate pot according to the package instructions. Divide the noodles among 6 bowls. Slice the cooled beef shank into thin slices, and fan them out over the noodles. To finish, add a big ladle of broth and radishes, a spoonful of hot chili oil, and a handful each (don't be shy) of chopped scallion and cilantro.",en-US,{},4.78,,The Woks of Life,330,6 serving(s)
15-Minute Coconut Curry Noodle Soup,Sarah,https://thewoksoflife.com/15-minute-coconut-curry-noodle-soup/,Chinese,https://thewoksoflife.com/wp-content/uploads/2015/05/coconut-curry-noodle-soup-10.jpg,"['2 tablespoons oil', '3 garlic cloves ((chopped))', '1 tablespoon fresh ginger ((grated))', '3 tablespoons Thai red curry paste', '8 oz. boneless chicken breast or thighs ((225g, sliced))', '4 cups chicken broth ((950 ml))', '1 cup water ((235 ml))', '2 tablespoons fish sauce', '2/3 cup coconut milk ((160 ml))', '6 oz. dried rice vermicelli noodles ((170g))', 'lime wedges, sliced red onion, red chilis, cilantro, scallions ((to garnish))']","In a large pot over medium heat, add the oil, garlic, ginger, and Thai red curry paste. Fry for 5 minutes, until fragrant. Add the chicken and cook for a couple minutes, just until the chicken turns opaque.
Add the chicken broth, water, fish sauce, and coconut milk. Bring to a boil. At this point, taste the broth for salt and adjust seasoning accordingly (add salt if needed, or if it's too salty, add a bit of water). Pour the boiling soup over the dried vermicelli noodles in your serving bowls, add a squeeze of lime juice and your garnishes, and serve. The noodles will be ready to eat in a couple minutes.
(Alternatively, you can add the noodles to the boiling broth to cook them, and then divide among serving bowls).",en-US,"{'calories': '634 kcal', 'carbohydrateContent': '57 g', 'proteinContent': '23 g', 'fatContent': '36 g', 'saturatedFatContent': '15 g', 'cholesterolContent': '74 mg', 'sodiumContent': '1210 mg', 'fiberContent': '1 g', 'sugarContent': '2 g', 'servingSize': '1 serving'}",4.89,,The Woks of Life,15,3 serving(s)
Pickled Long Beans with Pork Noodle Soup,Kaitlin,https://thewoksoflife.com/pickled-long-bean-noodle-soup/,Chinese,https://thewoksoflife.com/wp-content/uploads/2018/01/pickled-long-bean-noodle-soup.jpg,"['8 ounces ground pork ((225g))', '3 tablespoons oil ((divided))', '2 teaspoons cornstarch', '1 teaspoon soy sauce', '1 teaspoon Shaoxing wine', '2 teaspoons minced ginger', '5 cloves garlic ((chopped))', '1 small green bell pepper ((diced))', '1 small red bell pepper ((diced))', '3 to 10 bird’s eye chilies ((thinly sliced, depending on your desired heat level))', '1 package Chinese pickled long beans ((chopped into ¼” pieces))', '1 teaspoon sugar', '1/8 teaspoon white pepper', 'Choice of noodles to serve', '8 cups Chicken broth ((about 2 cups per serving))']","First, marinate the ground pork. Mix it with 1 tablespoon of the oil, 2 teaspoons cornstarch, 1 teaspoon soy sauce, and 1 teaspoon Shaoxing wine. Set aside while you gather your other ingredients.
Heat the remaining 2 tablespoons of oil in a wok or cast-iron skillet over high heat. Add the pork and stir-fry until cooked through and lightly crisped. Add the ginger and allow to infuse the oil for another minute. Next, add the garlic and cook until the garlic is lightly browned.
Add the diced green and red bell peppers and cook until they are slightly softened. Add the chilies, long beans, sugar, and white pepper, and cook for a few minutes to heat the long beans through. If you want an extra kick, add the chilies early on along with the ginger to really infuse the oil.
To prepare the noodle soup, place the noodles and soup in a bowl, and top with a few spoonfuls of the pickled long bean stir-fry. Add salt and/or chili oil to taste.",en-US,"{'calories': '633 kcal', 'carbohydrateContent': '69 g', 'proteinContent': '33 g', 'fatContent': '28 g', 'saturatedFatContent': '6 g', 'cholesterolContent': '41 mg', 'sodiumContent': '894 mg', 'fiberContent': '8 g', 'sugarContent': '14 g', 'servingSize': '1 serving'}",4.5,,The Woks of Life,30,4 serving(s)
Shanghai-Style Red Vegetable Soup (罗宋汤 - Luo Song Tang),Judy,https://thewoksoflife.com/red-vegetable-soup-shanghai-luo-song-tang/,Chinese,https://thewoksoflife.com/wp-content/uploads/2018/10/shanghai-style-red-vegetable-soup-10.jpg,"['2 pounds oxtails', '2 tablespoons vegetable oil', '2 large onions', '6 cloves garlic', '3 small tomatoes ((about 12 ounces/340g, roughly chopped))', '2 tablespoons tomato paste', '10 cups water ((2.4L))', '2 large carrots ((about 12 ounces/340g, cut into large chunks))', '¼ cabbage ((about 12 ounces, roughly chopped))', '5 bay leaves', '2 teaspoons salt', '1 teaspoon black pepper', '1 pound potatoes ((450g, about 2 large potatoes, peeled and cut into large chunks))']","Rinse 2 pounds of oxtails and pat them very dry. Heat 2 tablespoons of oil in a thick-bottomed soup pot over medium heat to brown the oxtails.
Brown the oxtails lightly on both sides. While that’s happening, slice 2 large onions, smash 6 cloves of garlic, and add them in once the oxtails are finished browning. Stir well and cook until the onions turn soft.
While the onions are cooking, cut 3 small tomatoes into rough chunks. Add them to the pot when the onions have softened. Clear a space in the center of the pot, and add 2 tablespoons of tomato paste, letting it fry lightly. Stir and cook until the tomatoes are slightly dissolved and the oil in the pot turns reddish––a few minutes over medium heat.
Now add 10 cups water, and turn up the heat to high. Cut the carrots and cabbage, and add them to the pot, along with 5 bay leaves, 2 teaspoons salt, and 1 teaspoon black pepper. Cover and bring to a boil, then reduce the heat to simmer for 60 minutes.
After 60 minutes of simmering, peel and cut the potatoes, and add them to the soup. Bring it to boil, then reduce the heat to simmer for 30 more minutes, or until the potatoes are tender. Salt to taste before serving.
Soups (and stews) always taste better the next day, so don’t fret if you have leftovers. Freeze the soup for another meal, and you will be very happy that you did!",en-US,"{'calories': '383 kcal', 'carbohydrateContent': '16 g', 'proteinContent': '38 g', 'fatContent': '19 g', 'saturatedFatContent': '9 g', 'cholesterolContent': '125 mg', 'sodiumContent': '874 mg', 'fiberContent': '4 g', 'sugarContent': '5 g', 'servingSize': '1 serving'}",5.0,,The Woks of Life,130,8 serving(s)
Thai Grilled Chicken (Gai Yang),Bill,https://thewoksoflife.com/thai-grilled-chicken-gai-yang/,Chinese,https://thewoksoflife.com/wp-content/uploads/2020/06/Thai-grilled-chicken-gai-yang-13.jpg,"['1 stalk lemongrass ((base of stalk, cut into small pieces; 50g))', '1/2 cup cilantro ((also known as fresh coriander—stems and leaves, chopped; 25g))', '2 shallots ((chopped; 35g))', '8 cloves garlic ((chopped; 35g))', '2 tablespoons vegetable oil ((30 ml))', '2 tablespoons palm sugar ((or light brown sugar; 25g))', '3/4 teaspoon salt ((or to taste))', '1/2 teaspoon freshly ground black pepper', '1/4 cup Thai thin soy sauce', '2 teaspoons Thai sweet soy sauce ((or black soy sauce))', '2 tablespoons fish sauce', '1/2 teaspoon turmeric powder ((optional))', '1 whole chicken ((about 5-6 pounds; 2.2-2.6 kg))', '1 tablespoon palm sugar ((or light brown sugar; 12g))', '1 tablespoon hot water', '1 tablespoon tamarind paste or concentrate', '2 tablespoons fish sauce', '1 tablespoon toasted sticky rice ((kao khua; ground to a powder, optional))', '1 tablespoon cilantro ((chopped))', '1 tablespoon scallions ((chopped))', '2 teaspoons dried chili flakes ((or fresh Thai chili peppers, optional))']","Marinate the chicken:
Add the lemongrass, cilantro (coriander), shallots, and garlic to a mortar and pestle, and pound until pulverized. You can also use a food processor for this step.
Add the oil, sugar, salt, black pepper, Thai soy sauces, fish sauce and turmeric (if using). Mix until well-combined.
You can butterfly or spatchcock your chicken for grilling like it’s done on the streets of Thailand. However, I cut the chicken into individual pieces to ensure they’d cook properly. This way, I can pull each piece off the grill once cooked. Rub the chicken with the marinade paste, ensuring every piece is thoroughly coated. Cover and place in the refrigerator to marinate overnight (or at least 12 hours).
The next day, take the chicken out 1 to 2 hours before you’re ready to grill.
Make the sauce:
In a small bowl, mix the sugar and hot water until the sugar is dissolved. Mix in the rest of the sauce ingredients and set aside.
Cook the chicken:
Place the chicken on the grill, and use any remaining marinade to baste the chicken while grilling. Leave the marinade paste on the chicken, including any chunks of herbs as they will caramelize and add flavor. Turn and baste the chicken often to create a nice flavorful outer crust. Baste the chicken with the leftover marinade in the first half of the grilling process, but do not do this towards the end of cooking. The raw chicken marinade needs enough time to fully cook.
Serve immediately with some coconut rice, your nam jim jeaw sauce, and lime wedges!",en-US,"{'calories': '463 kcal', 'carbohydrateContent': '16 g', 'proteinContent': '33 g', 'fatContent': '29 g', 'saturatedFatContent': '11 g', 'cholesterolContent': '122 mg', 'sodiumContent': '950 mg', 'fiberContent': '1 g', 'sugarContent': '8 g', 'servingSize': '1 serving'}",5.0,,The Woks of Life,765,6 serving(s)
How to Make a Clear Broth,Judy,https://thewoksoflife.com/how-to-make-a-clear-broth/,Chinese,https://thewoksoflife.com/wp-content/uploads/2017/01/chicken-stock-3.jpg,"['meat, bones, and or vegetables', 'water']","Preparing Ingredients:
Soak meat/bones for at least 1 hour to get rid of excess blood and impurities. This includes chicken/chicken bones, pork/pork bones, and beef/beef bones, etc. Change the water out 1-2 times, and once soaked, thoroughly rinse clean.
After soaking and washing, you must also blanch the meat/bones. Simply add the meat/bones to a pot along with enough cold water to fully submerge. Bring to a boil, and boil for 1 minute. Drain and rinse under clean running water.
When vegetables are used, it’s important not to cut them too small. It’s best to keep them around 2 in/5 cm. Small pieces of vegetable will dissolve when simmered for a long time and make the soup cloudy.
Simmering:
Always start with cold water along with all the ingredients in the pot. Once it’s been brought to a boil, immediately turn down the heat to simmer. Stay close-by while waiting for it to boil so the soup does not have a chance to boil longer than that.
Here’s how you know if the stock is simmering at the right temperature: there should be a very slow bubbling from the stock. If there’s absolutely no movement in the liquid, the heat is too low and the “cooking” is not happening. If the soup is bubbling quickly, there is too much disturbance in the liquid, and the stock will reduce faster and lose clarity.
Be sure to simmer with the lid on!",en-US,{},5.0,,The Woks of Life,0,None
Udon Noodle Soup with Chicken & Mushrooms,Sarah,https://thewoksoflife.com/udon-noodle-soup-chicken-mushrooms/,Chinese,https://thewoksoflife.com/wp-content/uploads/2016/05/udon-noodle-soup-11-1.jpg,"['2 cups low sodium chicken broth ((475 ml))', '2 cups dashi stock ((475 ml, can also substitute more chicken stock))', '5 slices ginger', '1 tablespoon soy sauce ((plus 1 teaspoon, divided))', '2 tablespoons oil ((plus 1 teaspoon, divided))', '3 cloves garlic ((smashed))', '2 boneless skinless chicken thighs ((cut into bite-sized pieces))', 'salt and pepper', '1 teaspoon cornstarch', '4 oz. fresh shiitake mushrooms ((115g, cleaned and thinly sliced))', '1 tablespoon mirin', '8 oz. fresh or frozen udon noodles ((frozen preferred; 225g))', '1 scallion ((julienned))']","Add the chicken broth, dashi stock, ginger, and 1 tablespoon soy sauce to a large saucepan or pot and bring to a simmer. Cover and continue simmering while you prepare the rest of the dish. Heat the oil in a wok or skillet over medium heat, and add the garlic. Allow the smashed garlic cloves to crisp up in the oil for about 2 minutes.
Season the chicken with salt and pepper, and add 1 teaspoon oil and 1 teaspoon cornstarch. Mix until combined. Add the chicken to the pan in one layer and turn up the heat to medium high. Don’t move the chicken. Allow to sear until it’s browned on one side, and then stir. During this process, move the garlic on top of the chicken so that it doesn’t burn.
Remove the chicken and garlic from the pan and set aside (this prevents the chicken from drying out while the mushrooms are cooking). Add the sliced mushrooms and cook until they're tender. Stir in the mirin and 1 teaspoon soy sauce and cook for another minute. Stir the chicken and garlic back in.
Cook the udon according to package directions and distribute between two soup bowls. Taste the stock and check for seasoning. Too salty? Add water. Not seasoned enough? Add salt. Pour the hot stock over the noodles, and top with the chicken and mushroom mixture. Garnish with scallions and serve.",en-US,"{'calories': '520 kcal', 'carbohydrateContent': '61 g', 'proteinContent': '34 g', 'fatContent': '17 g', 'saturatedFatContent': '2 g', 'cholesterolContent': '72 mg', 'sodiumContent': '1221 mg', 'fiberContent': '5 g', 'sugarContent': '10 g', 'servingSize': '1 serving'}",4.67,,The Woks of Life,30,3 serving(s)
Chicken Corn Egg Drop Soup,Bill,https://thewoksoflife.com/chicken-corn-egg-drop-soup/,Chinese,https://thewoksoflife.com/wp-content/uploads/2016/10/chicken-corn-egg-drop-soup-11-1.jpg,"['4 ounces chicken breast ((115g, finely chopped))', '1 tablespoon water', '1 teaspoon cornstarch', '1 teaspoon oyster sauce', '1½ cups fresh or frozen sweet corn', '5 cups chicken stock ((organic or homemade preferred))', '½ teaspoon turmeric powder', '½ teaspoon sesame oil', '½ teaspoon salt ((or to taste))', '1 pinch white pepper', '1/4 cup cornstarch ((combined with ½ cup chicken stock))', '2 egg whites ((lightly beaten, you can also include the yolks if you want))', '1 scallion ((chopped))', '1 tablespoon cilantro ((chopped, optional))', 'Freshly ground black pepper ((optional))']","Marinate the chicken with 1 tablespoon of water, 1 teaspoon cornstarch, and 1 teaspoon oyster sauce. Mix until the liquid is absorbed into the chicken. Set aside.
Finely mince ½ cup of the corn kernels and set aside. Add the chicken stock, minced and whole corn kernels, and turmeric powder to a pot and bring to a low boil. Reduce the heat, cover, and simmer for 10 minutes.
Next, add the sesame oil, salt, and white pepper. Turn up the heat slightly. Add the chicken to the soup, and use a spoon to break up any clumps of chicken while stirring for one minute.
Re-mix the cornstarch and chicken stock slurry until incorporated (since the cornstarch and water will separate when left to sit for more than a few minutes). Use a spoon or a whisk to stir the soup while slowly pouring in the cornstarch slurry. The soup will begin to thicken further as the cornstarch cooks. Keep stirring for another 30 seconds. If the soup is too thick, add more stock, and if it’s too thin, add more cornstarch slurry until the soup is at your preferred consistency.
Next, use a large spoon or ladle to gently stir the soup in one direction, while slowly pouring the beaten egg whites into the soup. Stirring slowly in a large slow circular motion will yield large “ribbons” of egg and stirring faster will result in a finer “egg flower.” Again, use your own discretion on how you personally like the texture of the egg!
Stir in half of the scallions, and add the rest as a garnish for serving. If you’re looking for a bit more flavor, you can also drizzle a bit of sesame oil over the top and sprinkle some chopped cilantro and fresh ground black pepper over each bowl.",en-US,"{'calories': '182 kcal', 'carbohydrateContent': '24 g', 'proteinContent': '16 g', 'fatContent': '4 g', 'saturatedFatContent': '1 g', 'cholesterolContent': '18 mg', 'sodiumContent': '480 mg', 'fiberContent': '2 g', 'sugarContent': '3 g', 'servingSize': '1 serving'}",4.95,,The Woks of Life,25,4 serving(s)
Sichuan Hot Pot,Judy,https://thewoksoflife.com/hot-pot/,Chinese,https://thewoksoflife.com/wp-content/uploads/2015/10/hot-pot-14-1.jpg,"['2 tablespoons oil', '6 slices ginger', '3-5 bay leaves', '10 cloves garlic ((peeled))', '1 cinnamon stick', '5 star anise', '10 cloves', '1 tablespoon Sichuan peppercorns', '12 whole dried red chilies', '1 package spicy hot pot soup base', '12-15 cups chicken stock', 'Soy sauce', 'Sacha sauce', 'Chili oil or paste', 'Chinese black vinegar ((or rice vinegar))', 'Sesame paste ((or peanut butter))', 'Sesame oil', 'Sesame seeds', 'Chopped peanuts', 'Chopped cilantro', 'Chopped scallions', 'Chopped garlic', 'Thinly shaved beef or lamb', 'Sliced chicken', 'Assorted fish balls ((you can buy these pre-made at Asian grocery stores))', 'Thinly sliced fish fillets ((tender white fish like tilapia or sea bass work well for this))', 'Tofu sheets', 'Firm tofu ((sliced))', 'Soy puffs ((fried tofu puffs))', 'Straw mushrooms', 'Shiitake mushrooms', 'Wood ear mushrooms', 'Fresh noodles', 'Glass noodles ((mung bean vermicelli))', 'Prepared frozen dumplings or wontons', 'Chinese rice cakes', 'Bok choy ((or choy sum))', 'Green leaf lettuce', 'Napa cabbage']","For the soup base:
In a wok over medium heat, add the oil and the ginger. Cook the ginger for about a minute until caramelized, making sure it doesn't burn. Add the bay leaves, whole garlic cloves, cinnamon stick, star anise, and cloves. Cook for another 2 minutes, until very fragrant.
Add the Sichuan peppercorns, dried chilies (whole), and the spicy hot pot soup base. Cook for another 2 minutes, and then add the chicken stock. Bring to a boil and transfer to the pot you'll be using for your hot pot meal. You want the pot to be relatively wide and at least 6 inches deep.
To make the dipping sauce, simply combine whatever mix of ingredients you like.
To assemble the hotpot, simply plug in your hot plate, place the prepared pot of broth on top, and bring to a low boil or simmer. Place all of your prepared ingredients around it, have everyone mix up their own dipping sauces, and dive in. Each person just takes whatever they want, adds it to the pot, waits for it to cook, and then dips it into their sauce. As the water evaporates as you're cooking, add boiling water to the pot as needed. You can also serve rice with hot pot (we do), but it's not mandatory.",en-US,{},4.89,,The Woks of Life,70,None
Yang Chun Noodle Soup (Yang Chun Mian),Judy,https://thewoksoflife.com/yang-chun-noodle-soup/,Chinese,https://thewoksoflife.com/wp-content/uploads/2018/07/yang-chun-noodles-7.jpg,"['1 serving thin noodles ((dry or fresh))', '2½-3 cups chicken broth ((ideally, homemade))', '1 tablespoon pork lard', '2 tablespoons light soy sauce', '¼ teaspoon dark soy sauce', '¼ teaspoon sugar', '1 tablespoon finely chopped scallions', 'Salt to taste']","Cook one serving of thin noodles according to the package instructions.
While the noodles are cooking, bring 2 ½ to 3 cups of stock to a boil. Then add pork lard, light soy sauce, dark soy sauce and sugar to your noodle bowl. Stir in the hot stock.
Once the noodles are cooked, drain them, and add them to the bowl. Sprinkle with chopped scallions, and salt to taste. Serve immediately!",en-US,"{'calories': '520 kcal', 'carbohydrateContent': '56 g', 'proteinContent': '26 g', 'fatContent': '21 g', 'saturatedFatContent': '7 g', 'cholesterolContent': '30 mg', 'fiberContent': '3 g', 'sugarContent': '15 g', 'servingSize': '1 serving'}",4.91,,The Woks of Life,15,1 serving(s)
Shanghai Home-style Noodle Soup,Judy,https://thewoksoflife.com/shanghai-home-style-noodle-soup/,Chinese,https://thewoksoflife.com/wp-content/uploads/2019/01/shanghai-homestyle-noodle-soup-10.jpg,"['8 ounces pork shoulder or boneless chicken thighs, julienned ((225g) )', '2 tablespoons water', '1 teaspoon Shaoxing wine', '¼ teaspoon salt', '½ teaspoon light soy sauce', '¼ teaspoon sesame oil', '½ teaspoon cornstarch', '4 ounces dried wheat noodles', '3 tablespoons oil', '5 cups chicken and pork stock or just plain chicken stock', '6 ounces mushrooms ((170g, any kind works, sliced))', '8 ounces leafy greens ((225g, coarsely chopped))', 'Salt ((to taste))', 'white pepper ((to taste))', '2 scallions ((chopped))']","Marinate the julienned pork (or chicken thighs) with 2 tablespoons water, 1 teaspoon Shaoxing wine, ¼ teaspoon salt, ½ teaspoon light soy sauce, ¼ teaspoon sesame oil, and ½ teaspoon cornstarch for 15 minutes.
Cook the noodles in a pot of boiling water per the cooking instructions on the package. Drain and set aside. At this point, you can cut the noodles a few times by running a knife or scissors through them so they’re spoon-friendly, but this is optional. The reason for pre-cooking the noodles separately is to prevent the soup from becoming too starchy.
Preheat your wok or thick-bottomed pot until it just starts to smoke. Add 3 tablespoons oil, and cook the marinated meat until it turns opaque. Add the sliced mushrooms and stir-fry for 2-3 minutes.
Add the stock and cooked noodles. Bring to a boil, and lower the heat to a simmer for 5 minutes, until the noodles are softened and expand slightly. Next, add the leafy greens and bring to a boil again. Add salt and white pepper to taste, and sprinkle with the chopped scallion before serving.",en-US,"{'calories': '315 kcal', 'carbohydrateContent': '27 g', 'proteinContent': '19 g', 'fatContent': '16 g', 'saturatedFatContent': '2 g', 'cholesterolContent': '23 mg', 'sodiumContent': '366 mg', 'fiberContent': '2 g', 'sugarContent': '4 g', 'servingSize': '1 serving'}",4.82,,The Woks of Life,60,4 serving(s)
