title,author,url,cuisine,image_url,ingredients,instructions,language,nutrients,ratings,reviews,site_name,total_time,yields
Quick and Easy Kimchi Ramen,Sarah,https://thewoksoflife.com/kimchi-ramen/,Chinese,https://thewoksoflife.com/wp-content/uploads/2017/01/kimchi-ramen-9.jpg,"['1 tablespoon vegetable oil', '5 shiitake mushrooms ((thinly sliced))', '½ cup cabbage kimchi ((chopped))', '¼ cup kimchi juice', '2 1/2 cups chicken or vegetable stock', '2 teaspoons Korean red pepper powder ((gochugaru))', '¼ teaspoon sugar', '1 teaspoon sesame oil', '1 package instant noodles', '1 scallion ((julienned))']","In a medium pot, add the vegetable oil and the mushrooms. Stir-fry for 3 minutes. Add the kimchi and stir-fry for another 2 minutes.
Add the kimchi juice, stock, korean red pepper powder, sugar, and sesame oil. Bring to a boil and simmer for 5 minutes.
Meanwhile, open up your package of instant noodles. Discard the flavor packet, and boil the noodles according to the package instructions. Transfer the cooked noodles to a bowl. Pour your broth over the noodles, and serve with scallions on top!
Note: If you prefer, you can also boil the noodles directly in the pot of broth!",en-US,"{'calories': '602 kcal', 'carbohydrateContent': '61 g', 'proteinContent': '22 g', 'fatContent': '34 g', 'saturatedFatContent': '18 g', 'fiberContent': '5 g', 'sugarContent': '5 g', 'servingSize': '1 serving'}",4.86,,The Woks of Life,15,1 serving(s)
Cheesy Kale Prosciutto Brunch Melts with Eggs,Sarah,https://thewoksoflife.com/cheesy-kale-prosciutto-brunch-melts-with-eggs/,Chinese,https://thewoksoflife.com/wp-content/uploads/2015/05/kale-prosciutto-muffin-melts-8-1.jpg,"['Olive oil', '1 clove garlic ((sliced))', '2 cups kale ((tough stems removed and chopped))', 'salt and pepper', '1 cup cheddar cheese ((grated))', '4 oz. cream cheese ((softened))', '4 English muffins ((split in half and lightly toasted))', '4 slices prosciutto', '4 eggs']","In a pan over medium heat, heat a couple tablespoons of olive oil and add the garlic. Cook for 1 minute, and add the chopped kale. Season with salt and pepper to taste, and cook the kale until tender and wilted.
Add the cooked kale to a mixing bowl along with the grated cheddar and cream cheese. Stir to combine. Spread the mixture onto each of the lightly toasted English muffin halves, and broil on low for 3-4 minutes, until golden.
While that’s happening, add a little oil to a skillet over medium heat and cook the eggs sunny side up. To serve, tear some prosciutto over the top of the melts and serve with eggs.",en-US,"{'calories': '490 kcal', 'carbohydrateContent': '31 g', 'proteinContent': '21 g', 'fatContent': '31 g', 'saturatedFatContent': '15 g', 'cholesterolContent': '230 mg', 'sodiumContent': '805 mg', 'fiberContent': '2 g', 'sugarContent': '1 g', 'servingSize': '1 serving'}",-1.0,,The Woks of Life,20,4 serving(s)
Chinese Rice Cake Soup,Judy,https://thewoksoflife.com/chinese-rice-cake-soup/,Chinese,https://thewoksoflife.com/wp-content/uploads/2019/10/chinese-rice-cake-soup-14.jpg,"['8 ounces lean pork or chicken ((cut into small, thin strips))', '2 teaspoons Shaoxing wine', '1 tablespoon light soy sauce', '1/2 teaspoon sesame oil', '1/4 teaspoon white pepper', '2 teaspoons cornstarch', '1 teaspoon water', '4 tablespoons vegetable oil ((divided))', '4 slices ginger ((julienned))', '3 scallions ((thinly sliced on an angle, white and green parts separated))', '1 small carrot ((thinly sliced))', '1 1/4 pounds napa cabbage ((stems cut into ½-inch pieces and leaves cut into 1-inch pieces))', '4 cups low sodium chicken stock', '4 cups water', '1/2 teaspoon white pepper', '1 teaspoon sesame oil', '1 tablespoon light soy sauce', '1 pound rice cakes ((oval-shaped slices preferred))']","Combine the pork (or chicken) with the Shaoxing wine, light soy sauce, sesame oil, white pepper, cornstarch, and water. Marinate for 15 to 20 minutes.
Preheat your wok until it starts to smoke lightly. Over high heat, add 2 tablespoons oil, and stir-fry the pork until browned. Remove the pork from the wok and set aside.
Reduce the heat to medium, and add 2 more tablespoons oil to the wok, along with the ginger and the white parts of the scallions. Cook for 1 minute and add the carrots. Cook for another minute and add the napa cabbage. Stir fry everything together for a few minutes until the napa cabbage leaves are wilted.
Add 4 cups low sodium chicken stock and 4 cups water. Bring everything to a boil, then lower the heat and simmer for 5 minutes, until the thick stems of the napa cabbage are tender.
Add salt to taste, ½ teaspoon white pepper, 1 teaspoon sesame oil, and 1 tablespoon light soy sauce.
Stir in the cooked pork, and sprinkle the rice cakes over the surface of the soup, along with green parts of the scallions. The rice cakes should be resting on top of the soup so they don’t sink into it and stick to the bottom of the wok/pot. Cover and cook for another minute, or as long as it takes to cook the rice cakes through (please see the Recipe Notes if you are using dried rice cakes). Salt to taste again and serve!",en-US,"{'calories': '368 kcal', 'carbohydrateContent': '46 g', 'proteinContent': '17 g', 'fatContent': '14 g', 'saturatedFatContent': '9 g', 'transFatContent': '1 g', 'cholesterolContent': '24 mg', 'sodiumContent': '482 mg', 'fiberContent': '2 g', 'sugarContent': '2 g', 'unsaturatedFatContent': '1 g', 'servingSize': '1 serving'}",5.0,,The Woks of Life,45,6 serving(s)
Mom's Chicken Wontons,Sarah,https://thewoksoflife.com/chicken-wontons/,Chinese,https://thewoksoflife.com/wp-content/uploads/2019/05/chicken-wontons-17.jpg,"['12 ounces napa cabbage ((340g))', '3/4 teaspoon salt', '10 shiitake mushrooms ((fresh or dried; 6 oz./170g fresh or 1.5 oz./42g dried))', '3 tablespoons oil', '1 pound boneless skinless chicken breast or thighs or ground chicken ((450g))', '2 teaspoons ginger ((finely minced))', '1/4 cup scallions ((finely chopped))', '2 tablespoons soy sauce', '1 1/2 tablespoons shaoxing wine ((or dry sherry cooking wine))', '1 tablespoon oyster sauce', '1 teaspoon sesame oil', '1 teaspoon sugar', '1/2 teaspoon white pepper', '5 teaspoons Knorr Chicken Powder ((20g))', '2 tablespoons water ((preferably from soaking the mushrooms or salting the cabbage))', '2 packages wonton wrappers ((about 75-80 wrappers total))']","Wash the napa cabbage clean and shake off any excess water. If using a food processor, tear the leaves up and pulse them into small pieces (take care not to mince the napa cabbage). If hand-chopping them, slice the leaves thinly lengthwise and then finely chop them going the other way. Transfer to a bowl and mix in ¾ teaspoon salt. Set aside for 30 minutes while you prepare the other ingredients (but no more than 30 minutes). After 30 minutes, squeeze the napa cabbage dry and save the water.
Pre-soak the mushrooms if using dried shiitake mushrooms (then squeeze any water from the mushrooms and reserve the soaking liquid––if using fresh mushrooms, skip this step). Remove the mushroom stems and dice them into ½” cubes.
Heat 3 tablespoons oil in a wok or pan over medium high heat, and cook the mushrooms for about 5-8 minutes until caramelized. Turn off the heat and leave the mushrooms to cool.
Now hand-chop the chicken by using our method for grinding meat without a grinder. This allows you to choose whatever cut of chicken you like (breast or thighs) and get a better texture than conventional ground meat. If you’d like to skip this step, you can also use ground chicken.
Time to make the filling: combine the chicken, napa cabbage, cooked mushrooms (with any oil left in the pan), ginger, scallions, light soy sauce, Shaoxing wine, oyster sauce, sesame oil, sugar, white pepper, Knorr Chicken Powder, and 2 tablespoons of liquid from either soaking the mushrooms or salting the cabbage (if you have neither, just use water).
Using a rubber spatula or pair of chopsticks, stir the mixture in one direction for 10 minutes, longer if needed, until the filling is well combined and sticky, like a paste.
Prepare a large sheet pan lined with parchment paper and get a small bowl of room temperature water. Lastly, bring a small pot of water to a boil, so you can taste­ test a couple wontons.
To assemble the wontons, take your square wonton wrapper, wet your finger, and dab one side of the square with water. Add 1-2 teaspoons of filling in the center, and gently fold the wrapper in half. Seal on all sides. Using your finger, brush another dab of water on one corner (of the filling side), and gently overlap the two corners of the rectangle by pressing them together. Place on the parchment-­lined sheet pan.
Make one more wonton, boil, and taste test the two samples (we find that tasting two, and not just one, helps us get a better feel for the flavor and adjust seasoning more accurately). Make adjustments to taste before proceeding to make the whole batch.
To cook the wontons, boil water in a pot, and add the wontons (fresh or frozen, but never defrosted wontons). To prevent the wontons from sticking to the bottom of the pot, stir the boiling water gently so the water is moving when you add in the wontons. Cook uncovered for abou 5 minutes using medium heat. If necessary, add ½ cup cold water if the water is boiling too vigorously. This helps manage the starch levels in the water. The wontons are done once they float to the surface and turn slightly plump. (Cooking frozen wontons takes longer, about 8 minutes.)",en-US,"{'calories': '288 kcal', 'carbohydrateContent': '38 g', 'proteinContent': '17 g', 'fatContent': '7 g', 'saturatedFatContent': '1 g', 'cholesterolContent': '35 mg', 'sodiumContent': '865 mg', 'fiberContent': '2 g', 'sugarContent': '1 g', 'servingSize': '1 serving'}",5.0,,The Woks of Life,195,10 serving(s)
Sichuan Spicy Wontons,Bill,https://thewoksoflife.com/sichuan-spicy-wontons/,Chinese,https://thewoksoflife.com/wp-content/uploads/2015/09/spicy-wontons-2-1.jpg,"['6 oz. ground pork ((170g))', '1 tablespoon finely chopped scallions', '1/2 teaspoon sesame oil', '1 teaspoon soy sauce', '2 teaspoons Shaoxing wine', '¼ teaspoon salt', '¼ teaspoon sugar', '1 tablespoon peanut oil ((or canola oil))', '2 tablespoons water', '1 pinch fresh ground white pepper', '18 wonton wrappers', '3 tablespoons light soy sauce', '1/2 teaspoon Chinese black vinegar ((preferred, or rice wine vinegar))', '6 tablespoons homemade chili oil ((plus 2 teaspoons of the toasted chili from the oil))', 'Salt ((to taste))', '1 teaspoon sesame paste ((or tahini))', '2 teaspoons sugar', '2 cloves garlic ((finely minced))', 'Chopped scallion']","Next, add all of the wonton filling ingredients to a bowl (everything from the pork to the white pepper) and whip everything together by hand for 5 minutes or in a food processor for 1 minute. You want the pork to look a little bit like a paste.
To make the wontons, take a wrapper, and add about a teaspoon of filling. Use your finger to coat the edges with water or egg wash (this helps the two sides seal together).
Fold the wonton in half so you have a rectangle shape. Bring together the two outer corners so they overlap slightly, add another drop of water or egg wash, and press to seal.
Keep assembling until all the filling is gone, which should make you about 18 wontons. Like all wonton recipes, you can double or triple the batch, eat some, then freeze the rest for another day. Place the wontons on a baking sheet or plate lined with parchment paper to prevent sticking.
Boil a pot of water for the wontons. While the water is coming to a boil, make the sauce by mixing all of the ingredients together in a small mixing bowl. If you like spicy, add more of the chili peppers and not just the oil from your homemade chili oil. This recipe makes enough for 18 or 20 wontons.
Give the boiling water a good stir and drop the wontons in, being careful not to crowd them. Continue stirring so they do not stick. Adjust the heat to achieve a low boil, and cook the wontons for about 2 minutes or until the wrappers begin to look translucent. I like mine a little bit al dente, so I take them out right at 2 minutes when they float to the top.
Use a slotted spoon to drain the water and transfer the wontons to a serving bowl. Stir in 1/4 cup of the boiling water into your sauce, then pour the sauce over the wontons. Garnish with scallion if using and serve!",en-US,"{'calories': '308 kcal', 'carbohydrateContent': '16 g', 'proteinContent': '8 g', 'fatContent': '23 g', 'saturatedFatContent': '5 g', 'cholesterolContent': '22 mg', 'sodiumContent': '801 mg', 'fiberContent': '1 g', 'sugarContent': '2 g', 'servingSize': '1 serving'}",4.5,,The Woks of Life,50,6 serving(s)
Curried Squash Soup with Red Curry Butter Croutons,Kaitlin,https://thewoksoflife.com/curried-squash-soup/,Chinese,https://thewoksoflife.com/wp-content/uploads/2017/10/curried-squash-soup-5-1.jpg,"['2 small to medium butternut squash ((peeled, de-seeded, and cut into 1-inch chunks))', 'salt & pepper', 'olive oil', '3-5 cups hot chicken or vegetable stock ((depending on whether you like your soup thick or thin))', '3 tablespoons red curry paste', '1 cup coconut milk', '1 teaspoon salt', '1 lime ((cut into wedges for serving))', 'chopped cilantro ((for garnish))', 'red chilies ((for garnish, optional))', '1 loaf crusty bread ((such as sourdough))', '4 tablespoons butter ((at room temperature))', '1 tablespoon red curry paste', '1 tablespoon honey']","Preheat your oven to 400 degrees F. Spread out the cut butternut squash on a sheet pan lined with parchment paper, and season with salt, pepper, and a few good drizzles of olive oil. Roast the squash at 400 degrees F for 50 minutes.
When the squash is tender and lightly crisped at the edges, you’re ready to make your soup. To your blender, and add the squash, half the broth, the curry paste, coconut milk, and salt. Blend until smooth. As you’re blending, you can add more chicken broth until you reach the fill line. You may also need to tap the blender pitcher on the counter to get any air bubbles out.
Pour the soup out into a pot or soup crock for serving, and stir in the remainder of your stock if need be.
To make the curry butter croutons, grab some crusty bread, and cut it into thick slices. Combine the softened butter, red curry paste, and honey in a small bowl, and mix until thoroughly combined. Spread the toasts with butter and bake in an oven or toaster oven set to 425 degrees F. Bake until light golden brown, flipping the toasts once halfway through to ensure both sides are evenly toasted.
Cut the bread into croutons, and serve over the soup. Garnish with cilantro, lime wedges, and a sprinkling of red chilies (if using).",en-US,"{'calories': '299 kcal', 'carbohydrateContent': '40 g', 'proteinContent': '7 g', 'fatContent': '13 g', 'saturatedFatContent': '9 g', 'cholesterolContent': '15 mg', 'sodiumContent': '956 mg', 'fiberContent': '3 g', 'sugarContent': '6 g', 'servingSize': '1 serving'}",5.0,,The Woks of Life,80,8 serving(s)
Shanghai Hot Sauce Noodles (Lajiang Mian -上海辣酱面）,Bill,https://thewoksoflife.com/shanghai-hot-sauce-noodles/,Chinese,https://thewoksoflife.com/wp-content/uploads/2016/10/shanghai-hot-sauce-noodles-17-1.jpg,"['8 ounces pork shoulder ((225g, cut into ¼ inch cubes))', '1/2 cup raw shelled and skinned peanuts', '1/4 cup peanut or vegetable oil', '¼ cup doubanjiang ((spicy chili bean sauce/paste))', '¼ cup onion ((diced))', '2 medium carrots ((cut into ¼ inch cubes, about ¾ cup))', '4 ounces five spice tofu ((cut into ¼ inch cubes, 3/4 cup))', '2 teaspoons sugar', '6 cups chicken stock ((divided))', '12 ounces dried noodles ((340g))', '1 scallion ((chopped, optional))']","Blanch the cubed pork in boiling water for 30 seconds, drain, and rinse. This keeps the final dish clear of any impurities/blood from the meat.
Fry the peanuts in the oil on low heat for 2 minutes, until just starting to turn golden brown. More oil will be fried out of the peanuts, and the mixture will become fragrant.
Add the chili bean sauce to the peanuts and oil, and stir for 30 seconds to bring out the color of the red peppers in the sauce and infuse the oil, which is what you are looking for in this dish.
Next, add the onions and stir fry for 2 minutes on medium low heat until the onion begins to turn translucent.
Add the carrots, five spice tofu, and sugar, and stir fry for another 3 minutes on medium heat. Next, add 1 cup of chicken stock and the blanched pork and continue to stir fry until the liquid has evaporated (about 5 minutes). Add another cup of stock and repeat the stir-frying again until the liquid has evaporated. This continuous stir-fry melds all the flavors together.
Add the remaining 4 cups of stock, and bring it to a boil. Turn the heat down to medium low and simmer for another 30 minutes. Check the mixture every 5 minutes while simmering and give it a stir so the sauce on the side of the wok does not burn. The final sauce should have a cup of liquid and lots of oil.
Boil the noodles according to package directions until al dente. Chewy noodles are always the best for soup!
Divide the noodles and sauce among four bowls. Season with a little bit of salt if needed, and then pour over the water that you used to cook the noodles to create the soup. (This is how it’s done traditionally, but alternatively, you can use more hot chicken stock as your soup). Serve hot, garnished with chopped scallions if using.",en-US,"{'calories': '699 kcal', 'carbohydrateContent': '77 g', 'proteinContent': '35 g', 'fatContent': '31 g', 'saturatedFatContent': '4 g', 'cholesterolContent': '23 mg', 'sodiumContent': '1581 mg', 'fiberContent': '8 g', 'sugarContent': '15 g', 'servingSize': '1 serving'}",4.8,,The Woks of Life,50,4 serving(s)
Taiwanese Sesame Oil Chicken Soup (台湾麻油鸡汤),Judy,https://thewoksoflife.com/taiwanese-sesame-oil-chicken-soup/,Chinese,https://thewoksoflife.com/wp-content/uploads/2016/12/sesame-oil-chicken-soup-5-1.jpg,"['3 lbs chicken legs ((1.35 kg))', '3 tablespoons black sesame oil ((45 ml))', '3 ounces ginger', '1 bottle Taiwanese rice wine ((750 ml, aka Michiu))', '20 grams rock sugar ((or 5 teaspoons granulated sugar))', '4 cups water', 'Salt ((to taste))', '2 scallions ((julienned))']","Rinse your chicken and pat dry with a paper towel.
Heat your wok or thick-bottomed pot over high heat until it starts to smoke slightly. Turn down the heat to medium, and wait a couple of seconds. Then add the black sesame oil, along with the sliced ginger. Cook for 2 minutes.
Turn up the heat to high, and sear the chicken legs (in batches if needed) until browned on all sides. Once the chicken legs are nicely browned, turn the heat back down to medium and add in rice wine, rock sugar, and water.
Cover and simmer over medium heat for 30 mins. The soup should be bubbling, but not boiling. The idea here is to cook the chicken and intensify the soup’s flavor without cooking off the liquid.
The soup is ready once the chicken legs are tender. Season with salt to taste and garnish with scallions when serving.",en-US,"{'calories': '273 kcal', 'carbohydrateContent': '5 g', 'proteinContent': '16 g', 'fatContent': '21 g', 'saturatedFatContent': '5 g', 'cholesterolContent': '90 mg', 'sodiumContent': '380 mg', 'fiberContent': '1 g', 'sugarContent': '3 g', 'servingSize': '1 serving'}",4.91,,The Woks of Life,45,8 serving(s)
Simple Wonton Soup,Sarah,https://thewoksoflife.com/wonton-soup-recipe/,Chinese,https://thewoksoflife.com/wp-content/uploads/2013/12/wonton-soup-recipe-3.jpg,"['10 oz. baby bok choy or similar green vegetable', '8 oz. ground pork ((225g))', '2 1/2 tablespoons sesame oil', '1/8 teaspoon white pepper', '1 tablespoon soy sauce', '½ teaspoon salt', '2 tablespoons Shaoxing wine', '1 package wonton wrappers', '6 cups chicken stock ((about 1.5 liters))', '1 scallion ((chopped))']","Start by thoroughly washing the vegetables. Bring a large pot of water to a boil and blanch the vegetables just until wilted, about 60-90 seconds. Drain and rinse in cold water.
Grab a good clump of veg and carefully squeeze out as much water as you can. Very finely chop the vegetables (you can also speed up the process by throwing them in the food processor). Repeat until all the vegetables are chopped.
In a medium bowl, add the finely chopped vegetables, ground pork, 2 1/2 tablespoons sesame oil, pinch of white pepper, 1 tablespoon soy sauce, 1/2 teaspoon salt, and 1-2 tablespoons Shaoxing wine. Mix very thoroughly until the mixture is totally emulsified—almost like a paste.
Now it’s time to assemble! Fill a small bowl with water. Grab a wrapper and use your finger to moisten the edges of the wrapper. Add a little over a teaspoon of filling to the middle. Fold the wrapper in half and press the two sides together so you get a firm seal.
Hold the bottom two corners of the little rectangle you just made (the side where the filling is) and bring the two corners together. You can use a bit of water to make sure they stick. And that's it!
At this point, you can cook (boil) and taste a couple of wontons and adjust the seasoning of your filling to taste––you can always add a little more Shaoxing wine, soy sauce, sesame oil, salt, and/or white pepper to your liking.
Once you're happy with the flavor of the filling, keep assembling until all the filling is gone. Place the wontons on a baking sheet or plate lined with parchment paper, and make sure they are not touching (this will prevent sticking).
If you'd like to freeze your wontons right away, you can cover the wontons with plastic wrap, put the baking sheet/plate into the freezer, and transfer them to freezer bags once they’re frozen. They’ll keep for a couple of months in the freezer, and be ready for wonton soup whenever you want it.
To make the soup, heat your chicken stock to a simmer and add 2-3 teaspoons sesame oil and white pepper and salt to taste.
Bring a separate pot of water to a boil. Carefully add the wontons one at a time to the pot. Pick up the pot and use a swirling, twisting motion to keep the pot moving and prevent the wontons from sticking to the bottom. If they do stick, don’t worry, They should come free once they’re cooked. Once they're floating, boil them for another 1-2 minutes. Take care not to overcook them – mushy wontons are a sin! Remove the wontons with a slotted spoon and put them in bowls.
Pour the soup over the wontons and garnish with scallions. Serve!",en-US,"{'calories': '353 kcal', 'carbohydrateContent': '40 g', 'proteinContent': '15 g', 'fatContent': '13 g', 'saturatedFatContent': '4 g', 'cholesterolContent': '31 mg', 'sodiumContent': '889 mg', 'fiberContent': '1 g', 'sugarContent': '3 g', 'servingSize': '1 serving'}",4.86,,The Woks of Life,120,8 serving(s)
Cantonese Pork Soup with Carrots & Chinese Yam,Judy,https://thewoksoflife.com/cantonese-pork-soup-carrot-chinese-yam/,Chinese,https://thewoksoflife.com/wp-content/uploads/2019/10/lean-pork-soup-3.jpg,"['4 dried shiitake mushrooms ((large))', '600 grams lean pork shoulder/butt ((1 large piece, about 1 1/3 pounds))', '500 grams large carrots ((about 1 pound, cut into large chunks))', '15 grams dried red dates ((also known as dried jujubes, pitted and halved))', '15 grams dried goji berries', '1 large chunk ginger ((smashed))', '14 cups water', '500 grams Chinese yams ((about 1 pound, peeled and cut into large chunks))', 'salt ((to taste))']","Rinse the shiitake mushrooms of any dust or dirt, and pre-soak for at least 2-3 hours in warm water. Do not discard the mushroom soaking water.
Place the pork in a thick-bottomed soup pot filled with enough water to just cover the pork. Bring to a boil, then immediately remove from the heat. Drain, rinse the pork under running water, and clean the stock pot. This step ensures a very clean broth.
Transfer the pork back to the clean pot. Add the soaked Shiitake mushrooms, carrots, red dates, goji berries, ginger, and 14 cups of water, along with the mushroom water. Cover and turn the heat to high. Bring to a boil, then reduce the heat to simmer. Simmer for two hours. During this time, the heat should be high enough to gently move the soup, but not so high that there are visible bubbles.
After 2 hours, add the chunks of Chinese yam. Bring to a boil using medium heat, then immediately reduce the heat, cover, and simmer for 1 more hour until Chinese yam is fork-tender. Serve the soup with salt at the table so everyone can add salt to taste. Don’t forget to shred the pork also, and serve it with some light soy sauce for dipping.",en-US,"{'calories': '266 kcal', 'carbohydrateContent': '21 g', 'proteinContent': '25 g', 'fatContent': '4 g', 'saturatedFatContent': '1 g', 'cholesterolContent': '60 mg', 'sodiumContent': '153 mg', 'fiberContent': '3 g', 'sugarContent': '6 g', 'servingSize': '1 serving'}",5.0,,The Woks of Life,330,6 serving(s)
