index,title,author,url,cuisine,image_url,ingredients,instructions,language,ratings,reviews,site_name,total_time,yields,calories,carbohydrateContent,proteinContent,fatContent,saturatedFatContent,cholesterolContent,sodiumContent,sugarContent,servingSize,fiberContent,transFatContent
166,Kabocha Pumpkin Pie (a Lighter and Fluffier Pie),Maggie Zhu,https://omnivorescookbook.com/kabocha-pumpkin-pie/,American,https://omnivorescookbook.com/wp-content/uploads/2019/08/1710_Kabocha-Pumpkin-Pie_550.jpg,"['1 homemade chilled pie dough (for a 9-inch pie or a premade pie crust)', '1 large egg', '1/2 kabocha squash (about 1.5 pounds / 800 grams, including skin and seeds, or 1 (15-oz./425-g) can pumpkin puree)', '1 cup (232 grams ) heavy cream', '1/3 cup (80 grams) whole milk', '1/2 cup (100 grams) brown sugar', '2 large eggs (at room temperature)', '2 tablespoons (30 grams) unsalted butter', '1 1/2 teaspoon ground ginger', '1/2 teaspoon ground cinnamon', '1/2 teaspoon salt']","Filling
Microwave the kabocha squash for 2 to 3 minutes, so it’ll be much easier to cut. Halve the kabocha by tilting your knife to a 45-degree angle and slicing it down from the bottom of the squash (the softer part). Then cut to 1-inch thick slices.
Prepare a steamer with 2 inches of water in it. Top with steaming rack, and place the pumpkin on the rack. Cook covered over medium high heat until it reaches a boil and steam comes out from the lid. Steam until the squash turns tender throughout, about 15 minutes.
Transfer the kabocha to a plate and let cool for 15 minutes, until it can be handled by hand. Peel off the skin with a knife and discard. Measure 3 heaping cups (400 grams) of kabocha and transfer to a blender (I used Vitamix).
Add the butter, heavy cream, milk, brown sugar, eggs, butter, ginger, cinnamon, and salt into the blender. Turn on low spead and gradually increase to high. Blend until it forms a silky puree, 15 to 20 seconds. The puree should have a consistency thick enough to coat a spoon. You can add more milk if the texture is too thick, or add more squash if it’s too runny.
Layer a few dish towels on your kitchen counter. Drop the blender bowl from a 2-inch height onto the dish towels a few times, to release the bubbles that have formed in the puree. Transfer into a big bowl. The puree can be made a day earlier and stored in an airtight container in the fridge.
Bake
Sprinkle a thin layer of flour onto a clean working surface and place the pie dough on top. Let rest for 5 to 10 minutes, until it’s soft enough to roll out without cracking.
Dust the top of the pie dough and your rolling pin with flour. Roll out the dough into a round sheet that is about 1/8-inch (3-mm) thick, and 1-inch larger than the rim of your pie pan. Rotate the dough frequently so it won’t stick to the surface. Dust with more flour if needed.
Roll the dough over your rolling pin and unroll it over the baking dish. Gently arrange the dough to fit the pan. Trim off the excess dough with scissors, leaving about 1/2 inch (1-cm) from the rim of the baking pan.
Tuck the edge of the dough underneath so it creates a thick border that rests on the rim of the baking dish. Crimp the edges by pressing the edge with your finger while holding the two sides with the knuckles of your other hand.
Cover the dough with plastic wrap and transfer to the fridge. Let rest for 30 minutes to 1 hour, until it’s completely cooled and turns solid.
Adjust oven racks, so one is in the middle and one is on the bottom. Place a pizza stone on the bottom rack (Optional). Preheat the oven to 425 degrees F (220 C).
Beat the egg with 1 tablespoon water in a small bowl to make an egg wash.
When the pie is well chilled, transfer to the kitchen counter. Crumple a piece of parchment paper and flatten it, cover the bottom of the pie and arrange it so it fits the shape. Add pie weights, beans, or rice onto the parchment paper. Transfer the pie onto the pizza stone. Turn the oven to 400 F (200 C). Bake for 30 minutes, or until the edges turn golden.
(Optional) If you made the pie garnish, you can now place them on the middle rack and bake until the surface turns golden, 15 to 17 minutes.
Transfer the pie crust to the kitchen counter and remove the pie weights. Brush the entire pie crust surface with a thin layer of egg wash. Return it to the bottom of the oven and bake for another 5 to 7 minutes, until the egg wash has dried completely and the bottom of the pie crust turns solid. If you plan to make the pie in advance, you can pre-bake the pie crust one day in advance.
Let the pie crust cool completely. Turn the oven to 350 F (176 C).
Fill the pie with the kabocha squash puree, up to 3/4 of the crust. Bake on the middle rack until the filling sets and the center jiggles slightly, about 40 minutes. Transfer the pie to a cooling rack and let cool completely before serving.
Slice the pie and top with whipped cream or vanilla ice cream. Enjoy!",en-US,5.0,,Omnivore's Cookbook,105,1 serving(s),287 kcal,23.7 g,4.2 g,19.9 g,,90 mg,265 mg,6.5 g,1 of the 8 slices,1.4 g,
167,4-Ingredient No-Churn Black Sesame Ice Cream,Maggie Zhu,https://omnivorescookbook.com/black-sesame-ice-cream/,Chinese,https://omnivorescookbook.com/wp-content/uploads/2019/08/1705_Black-Sesame-Ice-Cream_550.jpg,"['6 tablespoons black sesame seeds (, roasted)', '1 can (14-oz) sweetened condensed milk', '2 teaspoons vanilla extract', '2 cup heavy cream (cold)', 'Pinch salt']","Chill a 6-cups volume loaf pan or baking pan in the freezer.
Add sesame seeds in a medium-size skillet and toast over medium heat. Stir occasionally until you can hear a gentle sizzle if you lean towards the sesame seeds, about 5 minutes. Turn to low heat and toast for another minute, or until you smell a strong nutty aroma. Transfer to a big plate to cool for 5 minutes.
Transfer the sesame seeds to a food processor. Mix until it just starts to form a paste. Add condensed milk, vanilla and salt. Mix until everything is combined. Transfer to a big bowl.
Add the heavy cream in a large deep bowl. Whip with a mixer on medium-high speed, until it forms firm peaks, about 2 minutes. Transfer about 1 cup of the whipped cream into the condensed milk mixture. Fold with a rubber spatula until just combined. Then transfer the lightened condensed milk mixture into the whipped cream. Fold until just blended. Pour into the loaf pan. Cover and transfer into the freezer.
Freeze until the ice cream turns solid, about 5 hours.",en-US,5.0,,Omnivore's Cookbook,26116074,6 serving(s),192 kcal,19.1 g,3.5 g,11.8 g,,39 mg,50 mg,18.1 g,1 /2 cup,0.5 g,
168,"Sheng Jian Bao (生煎包, Shanghai Pan-Fried Pork Buns)",Maggie Zhu,https://omnivorescookbook.com/shen-jian-bao/,Chinese,https://omnivorescookbook.com/wp-content/uploads/2021/01/201111_Sheng-Jian-Bao_550.jpg,"['1 1/2 tablespoons ginger (, minced)', '1/4 cup hot water', '250 g (1 2/3 cup) all-purpose flour', '50 g (1/3 cup + 1 tablespoon) cornstarch', '4 g (3/4 teaspoon) instant yeast', '5 g (1 teaspoon) sugar', '150 g (2/3 cup) warm water ((*Footnote 1))', '15 g (1 tablespoon) vegetable oil', '8 oz (227 g) ground pork ((*Footnote 2))', '1 and 1/2 teaspoons light soy sauce', '1/2 teaspoon dark soy sauce ((or soy sauce) (*Footnote 3))', '2 teaspoons Shaoxing wine', '1/2 teaspoon salt', '1/4 teaspoon sugar', '1/4 teaspoon ground white pepper', '4 green onions (, sliced)', '1 tablespoon toasted sesame oil', '4 tablespoons vegetable oil', '1/2 cup hot water (, separated)', 'Chopped green onions (, for garnish (Optional))', 'Roasted sesame seeds (, for garnish (Optional))']","Prepare ginger water
Combine the minced ginger and hot water in a small bowl. Stir to mix well and set aside.
Prepare the dough
In a large tall plate or a big bowl, combine the all-purpose flour, cornstarch, instant yeast and sugar. Stir to mix well.
Slowly pour in the warm water, a few tablespoons at a time, and mix with a pair of chopsticks (or a fork). Once all the water has been added, keep mixing and scrape off the dry flour on the side of the bowl, until it forms many small dough flakes.
Pour in the vegetable oil. Keep mixing with the chopsticks until the oil is absorbed.
Start kneading by hand while further incorporating the dry flour, until there’s no dry flour left in the bowl.
Transfer the dough onto a working surface. Knead for 15 to 20 minutes, until the dough is quite smooth and elastic and there’s no dry flour left in the bowl. It’s OK if there’s some unevenness in the dough, which will smooth out after resting. The dough should be quite tough and not sticky to the touch. Cover and seal the bowl with plastic wrap. Let rest until it doubles in size, 1 hour or so.
Prepare the filling
Add the ginger water, light and dark soy sauce, Shaoxing wine, salt, sugar, and white pepper to the ground pork in a large bowl. Beat with a pair of chopsticks or a wooden spatula in a circular motion, until all the liquid is absorbed and the meat is sticky. This process might take a few minutes. (*Footnote 4)
Add the green onions and sesame oil. Mix until they are incorporated. Cover the bowl with plastic wrap. Store in the fridge until ready to use.
Assemble the buns
When the dough has rested, transfer to a work surface and punch it down. Knead for 1 minute to deflate the air out completely, then form it back into a ball.
Cut the dough in half. Wrap half of the dough in plastic wrap and store in the fridge while working on the other half.
Poke a hole in the center of the dough you’re working with. Stretch the dough into a large oval by running your fingers along the inside of the hole in a circular motion. Once the diameter of the dough is about 1” (2.5 cm), tear apart the ring so it creates a long, thin strip.
Cut the dough strip into 12 even pieces by cutting it in half, then further cut each half into 6 pieces. Gently use a circular motion to round up each dough piece then flatten it with your palm. Cover them with plastic wrap to prevent drying out.
Work on one piece of dough at a time - take one dough piece and place in front of you. Roll it with a rolling pin in one hand, using the other hand to rotate the dough while rolling, until the diameter reaches 5” (13 cm). You should keep the edges thinner than the center, so the wrapper of the bun will be even once you make the pleats.
Place the rolled dough in your palm and add 1 tablespoon of filling in the center.
Start wrapping the bun by folding and pinching the edge over itself, in one direction, until it is almost sealed. Then rotate and pinch the top of the pleats to fully seal the bun. (View my video for more details)
Repeat with the remaining dough pieces to wrap all the buns. Keep the wrapped buns under a piece of plastic wrap to prevent drying out. Once done wrapping, let rest for 10 minutes. Once rested, you should cook the buns immediately. You can store the wrapped buns in a sealed container in the fridge for up to 1 hour before cooking.
Repeat the wrapping steps to wrap the other half of the dough.
To cook the buns:
Add 2 tablespoons of oil and carefully place 12 wrapped buns into a 9” or 10” skillet. Heat over medium-high heat until hot. Turn to medium heat. Cook, uncovered, for 3 minutes, until the bottoms are lightly browned.
Pour about 1/4 cup hot water into the pan, just enough to cover the buns halfway up. Cover the pan and cook over medium heat for about 8 minutes, until the water is completely evaporated.
Turn the heat to medium-low and cook for another 2 to 3 minutes. Turn the heat off and remove the pan from the stove. Let the buns rest with the lid on for an additional 2 minutes. Remove the lid and transfer to a plate. Repeat the steps to cook the rest of the buns.
Serve hot immediately. (*Footnote 5) Or you can store the cooked buns in an airtight container in the fridge for up to 4 days or in the freezer for up to 3 months.",en-US,4.5,,Omnivore's Cookbook,150,24 serving(s),74 kcal,10.8 g,3.7 g,1.7 g,0.3 g,7 mg,85 mg,0.4 g,1 bun,0.5 g,
169,Peach Squares,Sarah,https://thewoksoflife.com/peach-squares/,Chinese,https://thewoksoflife.com/wp-content/uploads/2020/08/peach-squares-10.jpg,"['1 cup sugar', '1 stick salted butter ((melted; 1 stick = 4 oz., or 110g, or 1/2 cup))', '2 eggs ((at room temperature))', '1 teaspoon vanilla extract', '1 1/2 cups all purpose flour ((sifted))', '3 medium peaches ((about 2 cups, peeled, pitted and cut into chunks))', '1 cup walnut pieces', 'Powdered sugar ((for dusting, optional))']","Preheat oven to 350 degrees F/175 degrees C. Grease and flour a 9x13 inch pan.
In a large mixing bowl, add the sugar, melted butter, eggs, and vanilla. Whisk until well-combined.
Alternately fold in the sifted flour, peaches, and walnuts until well-combined. Pour into the prepared pan, and smooth out the batter so it’s evenly distributed.
Bake 35-40 minutes, or until the edges are golden brown and a toothpick inserted in the center comes out clean.
Cool, slice, and serve. (Refrigerate for 30 minutes for easier slicing.) Dust with powdered sugar if desired.",en-US,5.0,,The Woks of Life,60,12 serving(s),280 kcal,34 g,4 g,15 g,6 g,48 mg,78 mg,20 g,1 serving,2 g,
170,Jianshui Zong (Alkaline Rice Dumplings - 碱水粽),Judy,https://thewoksoflife.com/alkaline-rice-dumplings-zongzi/,Chinese,https://thewoksoflife.com/wp-content/uploads/2017/05/alkaline-zongzi-24-1.jpg,"['9 ounces dried adzuki beans ((255g, 1 ¼ cups))', '3 ¾ cups water ((890 ml))', '½ teaspoon baking soda', '1/2 cup sugar ((100g, or to taste))', '¼ cup vegetable oil ((60 ml))', '1 pound sweet rice ((also called sticky rice, 450g or about 2 ¼ cups))', '1 ½ tablespoons lye water', '½ tablespoon vegetable oil', '30-40 dried bamboo leaves', '1 ½ teaspoons lye water', 'Kitchen string']","The Day Before: Make the Red Bean Paste:
Soak the red beans in water for 2 to 3 hours, then rinse off and drain.
Add the soaked red beans, 3 ¾ cups water, and baking soda to a medium pot. Cover and bring to a boil, then immediately reduce the heat to a simmer until the beans are softened and opened-up (about 30 minutes). Stir periodically to avoid burning.
If you see a lot of liquid remaining even after the beans are softened and have opened up, turn up the heat, remove the lid, and let the liquid cook off. While you’re doing this, watch the beans closely and stir occasionally to avoid burning. Remove from the heat and let the beans cool for a bit before pureeing the cooked beans in a food processor. You can also use an immersion blender, but a food processor will result in a more even puree.
Put the red bean puree in a thick-bottomed pan set over medium-high heat, and cook off the liquid, stirring constantly. This process will take about 25 to 30 minutes. Add the sugar (about 1/2 cup or to taste) early in the cooking process so it has a chance to fully dissolve.
Towards the end of the cooking time, add the ¼ cup of vegetable oil in two batches. The oil will prevent the puree from sticking to the pan too much. The paste is done once it “stays” in place rather than oozing across the pan. Transfer the paste to a dish, and let it cool before storing it in the refrigerator, covered.
The Night Before: Soak the Rice and Bamboo Leaves:
Rinse the sweet rice a couple of times until the water runs clear rather than cloudy. Next, transfer the rice to a large bowl with enough water so that the water line is ½-inch above the rice. Stir in 1½ tablespoons of lye water and ½ tablespoon vegetable oil. Once the lye water hits the fresh water, both the rice and water will turn a light yellow color––that’s normal. Soak the rice, covered, in the refrigerator overnight.
In a large basin (or your kitchen sink), soak the bamboo leaves overnight. Weigh the leaves down with something heavy to make sure all of the leaves are submerged.
The Next Day: Making and Cooking the Zongzi:
Clean each bamboo leaf, front and back, with a clean kitchen towel, shaking off any excess water and trimming off about a half inch of the bamboo leaf at the base (this part is too tough and rigid to handle). Set aside.
Take the soaked rice out of the refrigerator, and drain off all of the liquid. Set it aside.
Take out the red bean paste, and divide it into 15 equal-sized balls.
Now you’re ready to assemble the zongzi! Take two bamboo leaves and follow the steps shown in the photos, tying them off with kitchen string. Each rice dumpling takes about 2 tablespoons of soaked rice and one portion of red bean paste. Just remember not to tie the string too snugly, as the rice will need room to expand during the cooking process. After unwrapping a zongzi, it shouldn’t look like it has been wearing a pair of pants that’s two sizes too small. :)
In a large pot, arrange the zongzi neatly, and fill the pot with water--about 1-inch above the top of the zongzi. Add 1 ½ teaspoon of lye water to the pot, and place a heat-proof bowl or plate on top of everything to weigh down the zongzi. Bring the water to a boil, and then turn the heat to medium to slow cook the zongzi for 2½ hours. Check the water levels periodically, replenishing the pot with boiling water when the waterline falls below the top of zongzi.
After 2 ½ hours, turn off the heat, and take out the zongzi to let them cool. Serve the zongzi at room temperature with sugar or the syrup of your choice!",en-US,5.0,,The Woks of Life,360,15 serving(s),229 kcal,42 g,5 g,4 g,3 g,,43 mg,7 g,1 serving,3 g,
