index,title,author,url,cuisine,image_url,ingredients,instructions,language,ratings,reviews,site_name,total_time,yields,calories,carbohydrateContent,proteinContent,fatContent,saturatedFatContent,cholesterolContent,sodiumContent,sugarContent,servingSize,fiberContent,transFatContent
251,Chocolate Oatmeal Sandwich Cookies (Brussels Cookies Recipe),Sarah,https://thewoksoflife.com/brussels-cookies-recipe/,Chinese,https://thewoksoflife.com/wp-content/uploads/2015/12/brussels-cookies-8-1.jpg,"['½ cup sugar ((plus 2 tablespoons))', '7 tablespoons butter ((at room temperature))', '1 teaspoon vanilla', '3 tablespoons milk', '½ cup all purpose flour', '½ cup ground oat bran ((or steel cut oats, ground into a flour in a blender))', '1/4 teaspoon baking powder', '1/4 teaspoon salt', '8 oz. dark or semisweet chocolate chips']","Preheat oven to 325 degrees F. In a bowl, cream the sugar and butter until light and fluffy, about 2-3 minutes. Stir in the vanilla and milk. In a separate bowl, mix together the flour, oat bran, baking powder and salt. Gradually mix the dry ingredients into the butter mixture until well blended.
Scoop rounds (1 teaspoon for 2-inch cookies, or more if you want the cookies to be bigger) and place on parchment-lined baking sheets, 3 inches apart. Bake for 11-12 minutes, until the cookies are golden around the edges. Cool completely (they’ll flatten as they cool).
Set up a double boiler to completely melt the chocolate. Take a cookie, add about a teaspoon of melted chocolate to the flat side, and sandwich with another. Set aside to let the chocolate set and continue until all the cookies are assembled.",en-US,5.0,,The Woks of Life,42,20 serving(s),136 kcal,16 g,2 g,8 g,6 g,11 mg,43 mg,9 g,1 serving,1 g,
252,Steamed Red Bean Buns,Judy,https://thewoksoflife.com/steamed-red-bean-buns/,Chinese,https://thewoksoflife.com/wp-content/uploads/2020/11/red-bean-buns-13.jpg,"['7 ounces red bean paste ((recipe here))', '1 teaspoon granulated sugar', '1/4 cup lukewarm water', '1 teaspoon active dry yeast', '1 2/3 cups all purpose flour ((plus more for dusting))', '3 tablespoons powdered sugar', '1/4 teaspoon salt', '1/3 cup lukewarm milk (Milk should be lukewarm or at room temperature)']","First, prepare the red bean paste. You can use our recipe for sweet red bean paste, or opt for store-bought. Our original recipe makes a large batch, but you can freeze leftovers to make other recipes. To make the exact amount needed for this recipe, scale the serving size down from 21 to 4 in the recipe card. The filling must be cooled completely and can be made up to several days in advance.
In a large mixing bowl, add 1 teaspoon sugar to ¼ cup warm water, and stir in the yeast until dissolved. Let sit for 15 minutes until the yeast foams up.
Next, stir in the milk and add the flour, powdered sugar, and salt. With the dough hook attachment, turn the mixer on low. Let the mixer go for 5 minutes, or knead by hand for 8 minutes, or until the dough is soft and smooth. The dough should not stick to your hands or the bowl.
Cover with a plate to proof for 1 hour in a warm spot, or until the dough doubles in size. I proof the dough inside my closed microwave with a large mug of just boiled water next to it.
While the dough is proofing, roll 8 balls of red bean filling between your palms. Each should weigh about 25g. Cover them with a damp towel to prevent them from drying out. Set aside.
Cut out eight 3""x 3"" squares of parchment paper for the buns to sit on in the steamer.
Once the dough is done proofing, put it back in the mixer and knead for another 2 to 3 minutes to get rid of any air bubbles (or knead by hand). Transfer to a clean, lightly floured surface. Use a kitchen scale to equally divide the dough into 8 pieces (mine were 50g apiece). Cover with a clean kitchen towel while you assemble the buns.
To assemble, roll a dough ball into a 4-inch disc, making the edges slightly thinner than the center. Put one ball of red bean filling in the center of the dough. Gather the edges of the dough around the filling, and pinch the edges together to close the opening.
Place the dough seam side down on a parchment square, and transfer to your steaming rack. The buns need at least 1-inch of space between each other. Repeat with the remaining dough until all the buns are assembled.
Prepare your steamer with about 5 cups of warm water. Put the buns in the steamer and cover. Your steamer water should be lukewarm to help with proofing, but do not turn on the heat at this time. Let them proof for 30 minutes.
Now turn the heat on to medium/high. Set your timer for 15 minutes, during which the heat will slowly bring the water to a boil and steam the buns. It may seem slow to heat in the beginning, but don’t be tempted to disturb the buns or remove the lid.
After the 15-minutes have elapsed, turn off the heat, and let the buns sit in the steamer with the lid tightly covered for another 5 minutes. DO NOT UNCOVER THE LID AT ANY POINT DURING THE STEAMING AND POST-STEAMING TIME. The buns need 5 minutes to set, or they will collapse and become wrinkly, so be patient. They can only be revealed after the final 5-minute timer goes off! Enjoy.",en-US,-1.0,,The Woks of Life,140,8 serving(s),187 kcal,40 g,5 g,1 g,1 g,1 mg,79 mg,16 g,1 serving,2 g,
253,Mango Sago,Judy,https://thewoksoflife.com/mango-sago/,Chinese,https://thewoksoflife.com/wp-content/uploads/2020/07/mango-sago-8.jpg,"['1/2 cup small-sized uncooked tapioca ((about 60g))', '3 ripe mangos ((about 1 kg))', '200 ml unsweetened coconut milk ((1/2 of a 13.5 oz. can))', '60 ml sweetened condensed milk ((1/4 cup, or more to taste if you like it sweeter))', '1/2 teaspoon vanilla extract']","In a pot, bring 4 cups of water to a boil. Add the mini pearl tapioca (don’t add it before the water is at a full boil!). Stir and bring it to boil again. Simmer for 15 minutes, or until the tapioca is completely transparent, which means they’re fully cooked.
When the tapioca is cooked through, drain, rinse in cold water to cool, then soak in a bowl of cold water and set aside.
Meanwhile, peel the mango, trimming to remove the center pit. Set aside a large handful of nice chunks for topping. The rest will be blended.
In a blender, add the coconut milk, condensed milk, vanilla extract, and mango. Blend until smooth, and transfer to a large bowl. At this stage, if you like your dessert cold, chill the mango mixture for at least an hour before adding the tapioca.
When you’re ready to serve, drain the cooked tapioca, and add to the mango mixture. Scoop into individual bowls and top with mango chunks.",en-US,4.88,,The Woks of Life,40,4 serving(s),326 kcal,51 g,4 g,14 g,12 g,5 mg,28 mg,32 g,1 serving,4 g,
254,Grilled Peach Crisps with Yogurt,Sarah,https://thewoksoflife.com/grilled-peach-crisps-yogurt/,Chinese,https://thewoksoflife.com/wp-content/uploads/2018/08/grilled-peaches-11.jpg,"['1/2 cup all purpose flour', '1/4 cup brown sugar', '1/4 teaspoon cinnamon', '1/3 cup pecans ((chopped))', '4 tablespoons butter ((softened))', '½ cup granola', '4 peaches ((pitted and halved))', '3 tablespoons maple syrup ((divided))', '2 cups plain yogurt ((whole milk yogurt preferred))']","Preheat the oven to 350 degrees. In a medium bowl, combine the flour, brown sugar, cinnamon, and pecans. Stir in the butter until a coarse crumble is formed. Spread the crumble on a parchment lined sheet pan, and transfer to the oven. Bake for 15 mins.
Remove from the oven, cool for 10 minutes, and toss the granola into your crumble. Set aside.
Take your peaches and brush their cut sides with maple syrup. Grill them on a hot grill or grill pan brushed with olive oil until they’re caramelized and have nice grill marks on both sides.
To serve, add about a half cup of yogurt into a serving bowl. Top with two peach halves and your crumble mixture. Drizzle with maple syrup if desired, and serve!",en-US,5.0,,The Woks of Life,40,4 serving(s),512 kcal,67 g,10 g,25 g,11 g,46 mg,167 mg,44 g,1 serving,4 g,
255,SUMMER BERRY PIE,Sarah,https://thewoksoflife.com/summer-berry-pie/,Chinese,https://thewoksoflife.com/wp-content/uploads/2013/07/summer-berry-pie-16.jpg,"['7 cups fresh or frozen berries ((we used strawberries and blueberries, but use whatever you’ve got))', '¾ cup sugar', '4 tbsp tapioca starch', '1 tablespoon freshly squeezed lemon juice', 'zest of 1 lemon', '¼ teaspoon allspice', '¼ teaspoon nutmeg', '1 egg white', '1 teaspoon sugar', '2 ½ cups all-purpose flour ((plus extra for rolling))', '2 tablespoons sugar', '1 teaspoon salt', '8 tablespoons vegetable shortening ((or more butter, chilled))', '1 ½ sticks butter ((chilled and cut into ½ inch pieces))', '6 tablespoons ice water']","Start by making the crust. In a large mixing bowl, combine the flour, sugar, and salt. If your kitchen is a bit warm, make sure to work quickly from now on!
Add in the chilled shortening and cut it in with a pastry cutter or two butter knives. Once that’s looking crumbly, cut in the chilled butter. You’ll want it to resemble coarse crumbs. It might start looking like pie dough already, especially if it’s summer and the temperature in your kitchen is a bit warmer than usual. Work fast to keep the ingredients as cold as possible. Sprinkle 5-6 tablespoons of ice water into the mixture and stir it in until it forms a dough. If you’re in a dry climate, you may need a couple extra tablespoons.
Divide the dough into two pieces and place each one on a piece of plastic wrap. Flatten them into disks, wrap them up, and put them in the fridge for at least an hour.
Once the dough is ready to roll, set your oven rack to the lowest position, throw a baking sheet on it, and heat the oven to 500 degrees.
Toss the berries, sugar, tapioca starch, lemon juice, lemon, and spices together. Then roll out the crust. Take one of the disks out of the fridge (Again, if the kitchen is warm, leave the other one in there until you’re ready to use it). Sprinkle some flour onto a clean surface and roll the crust into a 12-inch circle. Spread it into the pan, pressing it into the sides.
Check your fruit at this point. If it’s looking pretty wet, stir in a couple more teaspoons of the tapioca starch. Then take out your second piece of crust and roll it out slightly smaller (10-11 inches). Fill the pie shell with the fruit and lay the top crust over it. Seal and crimp the edges and cut six vent holes in the top.
Brush with egg white and sprinkle lightly with that last teaspoon of sugar. Put the pie on the heated baking sheet and lower the oven temperature to 425 degrees. Bake about 25 minutes until the crust starts to get some color.
Then rotate the baking sheet, reduce the temperature to 375 degrees, and bake for another 30-35 minutes until the juices are bubbling. Cool before serving.",en-US,-1.0,,The Woks of Life,140,12 serving(s),286 kcal,48 g,3 g,9 g,2 g,,201 mg,23 g,1 serving,3 g,
256,How to Cook Tapioca Pearls,Judy,https://thewoksoflife.com/how-to-cook-tapioca-pearls/,Chinese,https://thewoksoflife.com/wp-content/uploads/2019/08/how-to-cook-tapioca-pearls-11.jpg,"['6 cups water', '1 cup large tapioca pearls ((160g))', '3 tablespoons sugar ((plus 1 cup water))']","Bring 6 cups water to a boil in a deep pot, and add the tapioca. Bring it to a boil again, cover, and turn the heat down to medium low. Cook covered for 15 minutes, stirring occasionally to prevent sticking. After 15 minutes, turn off the heat, keep the pot covered, and allow to sit for another 15 minutes.
Drain the tapioca pearls and rinse under cold water.
If the tapioca pearls still have opaque white centers, repeat STEP 1 and STEP 2 until all the tapioca balls are translucent. You may have to repeat a few times depending on their size.
In the meantime, dissolve 3 tablespoons sugar into 1 cup warm water.
Once the tapioca pearls are cooked, drain and rinse under cold water one more time. Then put them into the sugar water to prevent them from sticking together.",en-US,5.0,,The Woks of Life,60,8 serving(s),,,,,,,,,,,
257,Olive Oil Pecan Rum Cake,Kaitlin,https://thewoksoflife.com/olive-oil-pecan-rum-cake/,Chinese,https://thewoksoflife.com/wp-content/uploads/2014/12/rum-cake-11-1.jpg,"['1/3 cup nonfat dry milk powder', '1/3 cup cornstarch', '1/4 cup granulated sugar ((plus 3 tablespoons))', '1/2 teaspoon Kosher salt', '1 cup pecans ((finely crushed))', '1 1/2 cups granulated sugar ((plus 1 tablespoon))', '1 stick unsalted butter ((4 ounces/110g))', '3 tablespoons olive oil ((plus 1/2 cup))', '1 3/4 cups all-purpose flour ((plus 1 tablespoon))', '1/4 cup cornstarch', '4 teaspoon baking powder', '1 teaspoon salt', '4 large eggs', '3/4 cup whole milk', '3/4 cup dark rum', '2 teaspoons pure vanilla extract']","If you're going to make homemade vanilla pudding mix, mix together those ingredients before you begin. Preheat oven to 325 degrees F.
Grease and flour a bundt pan, and sprinkle half of the crushed pecans along the bottom. Some fine pecan dust alongside the larger chunks is just fine. Set aside the pan and the rest of your pecans.
In an electric mixer, cream 1 1/2 cups granulated sugar with 1 stick of butter. Add 3 tablespoons of your olive oil. In a separate bowl, whisk together 1 3/4 cups flour, cornstarch, baking powder, and salt.
With the mixer on low, add the dry mixture to the butter/sugar mixture. Then add in the pudding mix. Scrape down the sides and then turn on the mixer again to combine evenly. The mixture is very dry and will look like fine crumbs.
In a separate bowl, whisk together the eggs, milk, rum, vanilla extract, and remaining 1/2 cup of olive oil. With the mixer on low, add it to the dry mixture and mix well until combined. Pour into your prepared bundt pan.
Mix the rest of your pecans with the extra tablespoon each of flour and sugar. Sprinkle the mixture evenly over the top of the batter.
Bake the cake for 50 to 60 minutes, or until a toothpick inserted in the cake comes up clean. Try a few different areas and if the toothpick comes up clean but glistens slightly, give it an extra 10-15 min. The addition of the pudding mix makes it so that the cake sets, but is still a bit gelatinous. In other words, your cake may need a bit more time in the oven.
Let the cake cool in the pan for 20-30 minutes, then invert onto your serving platter.",en-US,5.0,,The Woks of Life,70,16 serving(s),330 kcal,40 g,5 g,14 g,5 g,58 mg,256 mg,24 g,1 serving,1 g,
258,Pineapple Buns,Sarah,https://thewoksoflife.com/pineapple-buns/,Chinese,https://thewoksoflife.com/wp-content/uploads/2015/04/pineapple-buns-8-1.jpg,"['2/3 cup heavy cream ((160 ml, at room temperature))', '1 cup ((plus 1 tablespoon milk, at room temperature; total 250 ml))', '1 large egg ((at room temperature))', '1/3 cup sugar ((75g))', '1/2 cup cake flour ((70g))', '3 1/2 cups bread flour ((500g))', '1 tablespoon active dry yeast ((11g))', '1 1/2 teaspoons salt ((7g))', '¼ cup nonfat dry milk powder ((30g))', '1¼ cups all-purpose flour ((160g))', '½ teaspoon baking soda', '¼ teaspoon baking powder', '2/3 cup superfine sugar ((150g, it’s very important that it’s superfine))', '¼ cup vegetable shortening ((50g))', '2 tablespoons milk ((30 ml))', '1 egg yolk', '1/8 teaspoon vanilla extract', '1 egg yolk']","Start by making the bread dough. In the bowl of a mixer, add the heavy cream, milk, egg, sugar, cake flour, bread flour, yeast, and salt (in that order). Using the dough hook attachment, turn on the mixer to “stir.” Let it go for 15 minutes, occasionally stopping the mixer to push the dough together.
After 15 minutes, the dough is ready for proofing. Cover the bowl with a damp towel and place in a warm spot for 1 hour. The dough will grow to 1.5X its original size.
After the bread dough has proofed for an hour, put the dough back in the mixer and stir for another 5 minutes to get rid of air bubbles. Dump the dough on a lightly floured surface and cut into 12 equal pieces. Form each piece into a circular bun, and place on a baking sheet. Cover the buns with a clean, dry kitchen towel and let rise for another hour.
While that's happening, make the topping. Add the dry milk powder to a mixing bowl. If your dry milk powder has some larger clumps, crush them up with your fingers so it’s uniformly powdery.
Add the flour, baking soda, baking powder, and superfine sugar. Stir to combine. Add the shortening, milk, egg yolk, and vanilla. Use your hands to mix everything together into a dough. If it’s too dry, add a little more milk a teaspoon at a time until it comes together. Cover tightly with plastic wrap and set aside at room temperature.
When the buns are done rising for a second time, preheat the oven to 350 degrees F. Separate the topping dough into 12 equal pieces and roll them into balls. On a clean surface, roll out each ball into a flat circle and place one onto each bun.
Brush with egg yolk and bake at 350 degrees for 12-13 minutes.",en-US,4.81,,The Woks of Life,162,12 serving(s),374 kcal,59 g,9 g,11 g,5 g,65 mg,365 mg,18 g,1 serving,1 g,
259,Cantonese Steamed Custard Buns (Nai Wong Bao),Judy,https://thewoksoflife.com/nai-wong-bao-custard-buns/,Chinese,https://thewoksoflife.com/wp-content/uploads/2016/09/nai-wong-bao-18-1.jpg,"['2 eggs', ""½ cup powdered sugar ((also known as confectioner's sugar or icing sugar, 60g))"", '¼ cup milk ((60 ml))', '3 tablespoons heavy cream ((45 ml))', '3 tablespoons all-purpose flour ((25g))', '¼ cup cornstarch ((or wheat starch, 30g))', '¼ cup dry milk powder ((30g))', '2 tablespoons melted butter ((30g))', '1 teaspoon yeast ((2g))', '¼ cup warm water', '1½ cups all purpose flour ((235 grams))', '3 tablespoons powdered sugar ((22g))', '¼ teaspoon salt', '3 tablespoons coconut milk ((45 ml))', '3 tablespoons milk ((45 ml, added 1 tablespoon at a time; the quantity may vary depending on humidity))']","Start by making the filling. Heat some water in a medium to large, deep pot. The water should be about 2 inches deep, and the pan should be large enough to accommodate the mixing bowl. Once the water boils, turn the heat to down to a simmer.
In a large heatproof bowl or the metal mixing bowl that came with your stand mixer, add the eggs and powdered sugar. Beat for a minute on low. Next, add the milk and heavy cream, and beat for a few seconds to combine. Then sift in the flour, starch, and dried milk powder. Mix everything in until there are no lumps. Now add in the melted butter, and stir to combine.
Next, carefully lower the mixing bowl into the pan of water, and begin stirring the mixture quickly and continuously. I used a stainless steel mixing bowl, so the egg mixture solidified rather quickly--it took about a minute. It’s essential that you stir quickly in this process. It may take longer if you use a thicker bowl. Once the egg mixture solidifies into a thick custard, remove from the heat. Do not overcook! Let it cool completely, and it’s ready to use.
Cover the custard to prevent it from drying out while you make the dough. Note: If you’d like to make the filling a day or two early, store it in an air-tight container and refrigerate it.
Now make the dough. In a large mixing bowl, dissolve the yeast in ¼ cup of warm water. Let sit for 10-15 minutes until you see yeast bubbles floating on top of the water.
Now add in the flour, powdered sugar, salt, and coconut milk. Turn on the mixture with the dough hook attachment and set it to low, then slowly add in the regular milk, one tablespoon at a time until a dough is formed. A perfect dough should not stick to your hands or to the bowl--the texture should be smooth like a baby’s bottom!
Cover the dough with a dry kitchen towel, and let it proof for 1 hour. I usually proof my dough in my microwave with the door closed and a mug of just-boiled water next to it. While the dough is proofing, let’s prepare a few things:
Equally divide the egg custard filling into 12 pieces and roll them in your palms to form round balls. Cover them to prevent them from drying out. Prepare the steamer. With this recipe, we will start steaming with cold water, so there is no need to pre-boil the water. Cut out twelve 4""x4"" pieces of parchment paper.
The proofed dough should be about 2½-3 times its original size. Once the dough has finished proofing, put it back in the mixer and let it go for another 2-3 minutes to get rid of any air bubbles.
Now, transfer the dough to a clean and lightly floured surface. With the help of your kitchen scale, equally divide the dough into 12 pieces, and cover with a dry kitchen towel while you assemble the buns. Take one dough ball, roll it out into a 4-inch disc, taking care to make sure the edges are slightly thinner than the center. Put a ball of custard filling on top, pleat, and close the top of the bun--see the video! Place it on a piece of pre-cut parchment paper, and set it on your steaming rack. Repeat until all of the buns are assembled.
Put the buns in the steamer filled with warm water, covered with the lid (do not turn on the heat at this time). Let them sit and proof for another 30 minutes. After 30 minutes, turn the heat on and set it to medium. Set your timer for 12 minutes. During these 12 minutes, the medium heat will slowly bring the water to a boil and steam the buns. It may seem slow and lack action at the beginning, but trust me, the buns will be steamed nicely after just 12 minutes.
VERY IMPORTANT NOTE!!! After the 12-minute timer (for steaming) goes off, set the timer for another 5 minutes and turn off the heat. DO NOT UNCOVER THE LID. The buns need about 5 minutes to cool and set or they will collapse, so be patient. They can only be revealed after the 5-minute timer goes off.
Eat them while they are hot, just like you would if they were straight off the dim sum cart. You can also freeze the leftover buns in a zip-lock bag, and just re-steam when you want to have a bun for a rainy day!",en-US,4.66,,The Woks of Life,195,12 serving(s),167 kcal,25 g,5 g,5 g,3 g,39 mg,97 mg,9 g,1 serving,1 g,
260,Old-Fashioned Chinese Almond Cookies,Judy,https://thewoksoflife.com/almond-cookies-chinese/,Chinese,https://thewoksoflife.com/wp-content/uploads/2018/12/almond-cookies-11.jpg,"['1 1/4 cups all-purpose flour ((160 g))', '¾ cup powdered sugar ((95 g))', '3 tablespoons cornstarch ((20 g))', '1 teaspoon baking soda ((4 g))', '1 teaspoon baking powder ((4 g))', '2 egg yolks ((plus 1 additional egg yolk for brushing))', '½ cup melted lard ((at room temperature))', '1 teaspoon almond extract', '18 toasted almonds']","Sift together 1-1/4 cups (160 g) all-purpose flour, ¾ cup (95 g) powdered sugar, 3 tablespoons (20 g) cornstarch, 1 teaspoon (5 g) baking soda, and 1 teaspoon (4 g) baking powder in a large mixing bowl. Sift the mixture together again to make sure that all the ingredients are light and well-incorporated.
Next, beat 2 egg yolks into ½ cup melted lard (at room temperature). Beat in 1 teaspoon almond extract. Fold this mixture into the dry ingredients with a rubber spatula, then knead the dough with your hand to create a dough ball. Try not to overwork the dough—it will be similar to a crumbly pie crust in texture. Cover with an overturned plate, and allow the dough to rest for 20 minutes.
Meanwhile, preheat your oven to 350 degrees F, and toast the almonds for 5 minutes. Cool completely before using. Beat the last egg yolk, and set it aside.
Now, raise the oven temperature to 375 degrees F. Take the dough, and divide it into 18 equal pieces. Press and squeeze each into a small disc, and transfer to a baking sheet so the cookies are placed at least 2 inches apart (they will spread out).
Brush all sides with the beaten egg yolk. Press one toasted almond onto the center of each dough ball. They may crack a little bit—that's ok. Just gently squeeze them back together if there are particularly large cracks. Bake for 15-18 minutes until golden brown.",en-US,4.73,,The Woks of Life,90,18 serving(s),121 kcal,13 g,1 g,7 g,2 g,27 mg,62 mg,5 g,1 serving,1 g,
