index,title,author,url,cuisine,image_url,ingredients,instructions,language,ratings,reviews,site_name,total_time,yields,calories,carbohydrateContent,proteinContent,fatContent,saturatedFatContent,cholesterolContent,sodiumContent,sugarContent,servingSize,fiberContent,transFatContent
90,Almond Cookies,Namiko Chen,https://www.justonecookbook.com/almond-cookies/,"Chinese,Japanese",https://www.justonecookbook.com/wp-content/uploads/2020/01/Chinese-Almond-Cookies-2350-I-1.jpg,"['1 cup almond meal/flour', '1 ½ cup all-purpose flour (plain flour)', '½ cup sugar ((½ cup + 2 Tbsp to be precise))', '¼ tsp kosher/sea salt (I use Diamond Crystal; Use half for table salt)', '1 tsp baking powder', '1 tsp baking soda', '½ cup neutral-flavored oil (vegetable, canola, etc) ((may need more oil))', '1 large egg yolk', 'roasted unsalted almonds ((optinoal; for decoration))']","Gather all the ingredients. Center a rack in the oven and preheat the oven to 350ºF (180ºC). For a convection oven, reduce cooking temperature by 25ºF (15ºC).
Combine all the dry ingredients in a stand mixer. With your mixer on low medium speed (with the beater attachment), mix all together.
Slowly add oil and mix until a cohesive dough forms.
The dough should be just enough to hold its shape when you try to roll it into a ball. If they look more like crumbs, add 2-3 tsp (10-15 ml) vegetable oil at a time.
Weigh the dough to make 1-inch (2.5 cm) cookie (0.4 oz, 10 g) or 1 ½-inch (3.8 cm) cookie (0.7 oz, 20 g). Roll the dough into a ball with your palms. Place it on a baking sheet lined with parchment paper and repeat until all the dough is used up. You can make a 10-gram ball using a teaspoon measuring spoon.
[optional] If you want to put a piece of almond on the cookie, hold the cookie ball on your palm and gently press the almond into the dough.
Beat the egg yolk in a small bowl. Using a pastry brush, lightly glaze the top of the cookie balls with the egg yolk.
Bake at 350ºF (180ºC) for 15-20 minutes, or until the cookies become slightly golden. Let them cool on a wire rack and store in an airtight container.
To Store
You can keep the leftovers in an airtight container and store on the countertop for 4-5 days or in the freezer for a month.",en-US,4.49,,Just One Cookbook,40,54 serving(s),,,,,,,,,,,
91,Imagawayaki (Obanyaki),Namiko Chen,https://www.justonecookbook.com/imagawayaki-obanyaki/,Japanese,https://www.justonecookbook.com/wp-content/uploads/2017/08/Imagawayaki-w600.jpg,"['2 large eggs (50 g each w/o shell)', '2 Tbsp sugar', '2 Tbsp honey', '1 ¼ cup whole milk', '2 cups all-purpose flour (plain flour)', '2 tsp baking powder', '14 oz red bean paste (anko) ((2 Tbsp (50 g) for each piece))', '1 Tbsp neutral-flavored oil (vegetable, canola, etc) ((for greasing pan))']","Gather all the ingredients.
To Make the Batter
In a large mixing bowl, mix eggs and sugar.
Add the honey and milk and whisk all together.
Sift the all purpose flour and baking powder together and add to the egg mixture.
Mix well till well combined and rest the batter for at least 15 minutes (to relax the gluten).
Meanwhile, scoop 2 Tbsp (50 g) of red bean paste and make it into a round disk that fits in the center of the pancake.
To Cook Obanyaki
Slowly heat up the pan to 350ºF (175ºC) over low heat. If you use high heat, some parts get hot and the heat is not even. Take your time to heat up the pan.
Dip a small piece of paper towel in vegetable oil and grease the pan. Then use a clean paper towel to wipe off the excess oil (key for even color on imagawayaki).
When the temperature reaches 350ºF (175ºC) over low heat, pour the batter into a liquid measuring cup for easy pouring. The batter makes about 2¼ cups.
Add the batter half way full and cook for 2 minutes.
Add red bean paste and set timer for 3 minutes. After 1 minute passed (on your 3 minute timer), pour the batter into the empty pan third full and cook for the rest of 2 minutes.
[optional] If you like to use custard cream instead of red bean paste, use an ice cream scooper to drop the custard in the middle of batter.
Using a small metal spatula or skewer, pick up two pancakes with the filling and place on top of the pancakes without filling.
[optional] If you use custard cream for filling, you may want to add a few minutes of cooking time as custard cream is probably chilled prior to the use.
Press down gently and cook for 2 minutes. Loosen up the edges of the pancakes and remove them from the pan.
Let cool on wire rack. Repeat this process until you’re done with the batter.
To Serve and Store
Serve immediately while it's hot/warm. Keep the leftovers in an airtight container and store in the refrigerator for 2 days or in the freezer for a month. You can defrost overnight in the refrigerator or reheat the frozen piece in the microwave (reduce power so it won't explode). And then bake at 350ºF (175ºC) in the oven toaster or oven till crispy outside.",en-US,4.91,,Just One Cookbook,50,8 serving(s),,,,,,,,,,,
92,Kabocha Pie,Namiko Chen,https://www.justonecookbook.com/kabocha-squash-pie/,Japanese,https://www.justonecookbook.com/wp-content/uploads/2019/11/Kabocha-Squash-Pie-3481-I-1.jpg,"['2.5 lb kabocha (squash/pumpkin) ((with seeds and skin))', '2 Tbsp unsalted butter', '2 Tbsp sugar', '1 large egg yolk', '2 large eggs (50 g each w/o shell)', '⅓ cup brown sugar ((packed))', '2 tsp pumpkin pie spice', '½ tsp kosher/sea salt (I use Diamond Crystal; Use half for table salt)', '1 Tbsp rum', '¾ cup heavy (whipping) cream ((¾ cup + 4 tsp))', '1 pie crust ((you can use my Tart Crust recipe for your pie crust))', '1 cup heavy (whipping) cream', '2 Tbsp sugar']","Gather all the ingredients.
[Optional] Blind Baking – Please read the blog post first
Preheat the oven to 400ºF (200ºC). For a convection oven, reduce cooking temperature by 25ºF (15ºC). Take out the pie crust from the freezer and thaw for 10 minutes.
When the pie crust has softened a little bit, prick both bottom and sides of the pie crust with a fork, make sure not to poke through. This allows steam to escape and prevents bubbles from forming from the bottom of the crust. Alternatively, you can use pie weights. Bake the pie crust for 15-20 minutes or until golden brown. Remove from the oven, let it cool until room temperature.
Kabocha Pie
Put 1 cup of water into the pan (I use a wok) and place the steamer basket on top.
With a very firm chef’s knife, cut kabocha in half and scoop out seeds. Cut kabocha into 1 ½ inch (4 cm) cubes.
Place kabocha cubes in a steamer basket and cover with lid. Turn heat to high and steam for 15 minutes.
After 15 min, check if kabocha ready by inserting the skewer into a thick kabocha cube. If it goes through smoothly, then they’re done. Otherwise, keep steaming and check back in 1 minute. Remove the steamer basket from the pan. When the kabocha is cool enough for you to touch, remove the skin with a knife.
Transfer the kabocha to a food processor or blender. Puree kabocha until smooth. Since the kabocha was steamed and contains a good amount of moisture, you don’t need to add any liquid. However, if the kabocha has been sitting out too long and seems dehydrated, add 1 Tbsp water at a time to help it puree. My kabocha yields about 3 cups (675 g). For this recipe, you will need 2 cups (450 g) of pureed kabocha.
If you don’t have a food processor or blender, transfer kabocha to a large bowl and mash with a fine mesh strainer like this to pass through kabocha for finer texture. You can also use a potato masher but it won’t be as refined.
Preheat the oven to 400ºF (200ºC). For a convection oven, reduce cooking temperature by 25ºF (15ºC). Take out the pie crust from the freezer and thaw for 10 minutes.
In a large bowl, combine 2 Tbsp (30 g) unsalted butter and 2 Tbsp (30 g) granulated sugar. Whisk until it’s a creamy consistency.
Add 1 egg yolk and 2 eggs, one at a time and whisk well to combine before adding next one.
Add 2 cups (450 g) pureed kabocha and mix well to combine.
Add ⅓ cup (72 g) brown sugar, 2 tsp pumpkin pie spice, and ½ tsp kosher salt into the bowl and mix all together.
Add 1 Tbsp rum and ¾ cup + 2 Tbsp (200 ml) heavy whipping cream and whisk well.
Pour the filling into the pie crust. Tap the crust on the counter a few times to make sure there is no air gap in the fillings.
Bake at 400ºF (200ºC) for 15 minutes and then reduce oven temperature to 350ºF (180ºC) and bake for 50 minutes, or until the skewer inserted near the center comes out clean. If you pre-baked the pie crust, you might need to shield the edges with foil to avoid the crust becoming too brown and overdone.
Cool on a wire rack for 2 hours before serving.
To Serve
Serve the pie with a big dollop of fresh whipped cream (recipe follows).
To Make Whipped Cream
Place a metal mixing bowl and metal whisk into the freezer for 10 to 15 minutes (If you don’t use an electric mixer, this step helps you to make whipped cream faster). Add 1 cup (240 ml) heavy whipping cream and 2 Tbsp sugar into the mixing bowl. Whisk just until the cream reaches stiff peaks.
Store any unused portion in an airtight container for up to 24 hours. When ready to use, re-whisk for 10 to 15 seconds.
To Store
You can keep the leftover pies in an airtight container and store in the refrigerator for up to 3 days.",en-US,4.5,,Just One Cookbook,230,1 serving(s),,,,,,,,,,,
93,Strawberry Mochi (Ichigo Daifuku),Namiko Chen,https://www.justonecookbook.com/strawberry-daifuku/,Japanese,https://www.justonecookbook.com/wp-content/uploads/2020/03/Strawberry-Mochi-Ichigo-Daifuku-3671-I.jpg,"['6 strawberries', '150 g red bean paste (anko) ((5.29 oz; I used store-bought ""koshian"" today. See Notes for homemade recipe))', '100 g Shiratamako (glutinous rice flour/sweet rice flour) ((3 ½ oz, roughly 3/4 cup))', '20 g sugar ((2 Tbsp))', '150 ml water', 'potato starch/cornstarch ((for dusting))']","Rinse, dry, and hull the strawberries. Divide anko into 6 same size balls. Anko gets sticky on your hands, so wash your hands and dry completely each time you make a ball.
Wrap the strawberries with anko. Leave the tip of the strawberry uncovered. Wash your hands and dry completely each time you wrap a strawberry with anko.
In a medium microwave-safe glass bowl, mix shiratamako and sugar with a whisk.
Using a silicone spatula, slowly add water in 3 parts and stir until the mixture has reached a thick consistency. Cover loosely with plastic wrap.
First, microwave 1 minute (for 1000W microwave). Mix well with a wet silicone spatula. The mixture is still whitish and floury.
For the second time, microwave 1 minute again, and mix well with the wet silicone spatula. Now it starts to resemble mochi, but there are still some floury parts.
For the last time, microwave only 30 seconds. Now the mochi mixture should look translucent.
Sift corn starch on the tray and put the mochi on top.
With silicone spatula or kitchen scraper, fold the mochi in half one time so it won’t be as sticky and then divide into 6 equal pieces.
Put some corn starch on your hands and flatten and expand each mochi into a 3” round or square. Then put the anko covered strawberry on top of it, with the tip facing down.
Start covering the strawberry from all sides and use your thumb to hold the mochi on top.
When all sides of mochi meet at the top, twist and close. Hold the mochi with both hands and form into nice round shape. Repeat the process for the remaining mochi.
Serve at room temperature and they must be consumed within 2 days.",en-US,4.6,,Just One Cookbook,43,6 serving(s),,,,,,,,,,,
94,No-Bake Creme Caramel (Japanese Purin),Namiko Chen,https://www.justonecookbook.com/no-bake-creme-caramel/,Japanese,https://www.justonecookbook.com/wp-content/uploads/2019/11/No-Bake-Creme-Caramel-5961-I.jpg,"['⅔ cup sugar', '2 Tbsp water', '2 Tbsp boiling water', '4 sheets gelatin powder/sheet', '¼ cup water', '4 large egg yolks', '80 g sugar ((⅓ cup + 1 Tbsp to be precise))', '1 ¾ cups whole milk ((divided))', '½ cup heavy (whipping) cream', '2 tsp pure vanilla extract']","Gather all the ingredients. You will also need 8 4-oz ramekins (4 oz is ½ cup or 120 ml).
Caramel Sauce
Prepare boiling water (you will only need 2 Tbsp) and a cold damp towel (for Step 4).
Combine sugar and water in a saucepan over medium heat. Gently shake the saucepan to evenly distribute sugar and do not touch until the mixture starts to turn golden brown. Gently swirl and tilt the pan again to distribute the mixture to have even color until it becomes amber color (like darker honey color), about 6 minutes.
Immediately remove from heat to a cold damp towel and add 2 Tbsp boiling water. It will create a huge splash so please be careful. You can shield with a lid or wear oven mitts to protect your hands. Stir the saucepan to mix together. This will slightly thin out the caramel sauce and ensure that it doesn’t become too thick in the ramekins.
Briefly dip the ramekins in hot water to warm up. This will prevent the caramel from solidifying (just shake off excess water and no need to dry).
While caramel is still hot, evenly distribute the caramel among the 8 ramekins. Set aside and let the caramel thicken naturally (which is why the caramel will not mix with the custard mixture later).
Custard
In a small bowl, cut 4 gelatin sheets into thin ½ inch (1.3 cm) strips. Add ¼ cup (60 ml) cold water and set aside for 5-6 minutes until the gelatin “blooms” (expands).
If you’re using powder gelatin, combine 3 tsp (10 g) gelatin powder and ¼ cup (60 ml) water and let stand for 1 minute. Then microwave on high for 30-40 seconds and stir. It’s ready to use.
Once gelatin sheets are bloomed, bring 1 inch (2.5 cm) of water to simmer and place the bowl of gelatin mixture over the saucepan (double boiler). Make sure to use a heat resistant bowl, which is larger than the opening of the saucepan. Steam will immediately warm up the glass bowl and start dissolving the gelatin. Turn off the heat and set it aside. If somehow you end up taking a long time to do the following process and the gelatin has set into a solid, you will need to melt it back into a liquid with a double boiler again.
In a large mixing bowl, whisk together the egg yolks and sugar until pale and creamy.
In a medium saucepan, heat 200 ml (roughly 1 cup) milk (keep the rest for later) over medium heat until the milk is warm to the touch.
Slowly add the warm milk, whisking constantly (tempering the egg mixture).
Pour the mixture back into the saucepan. Cook over medium-low heat, stirring constantly (keep an eye on the pot ALL THE TIME; otherwise the mixture will burn on the bottom), until the mixture coats a spoon with a thin film or small bubbles start to form at the edges of the pan, or reaches 160ºF (71ºC).
Add in the gelatin mixture and mix well. Remove from the heat.
Strain the mixture through a fine-mesh strainer into a clean bowl.
Add the rest of the milk (200 ml), heavy whipping cream, and vanilla and whisk all together. We’re adding them at the end to help the mixture cool down.
Divide the custard into the 8 ramekins. Cover with plastic wrap and chill in the fridge overnight or up to 3 days. The caramel on the bottom will become thinner after the moisture from the custard transfers to the caramel.
To serve, run a small sharp knife or toothpick around the edge of each ramekin to loosen the custard. Quickly invert each custard onto a plate. If it doesn’t release right away, gently shake the ramekin a few times to help it out.
To Store
Store in the refrigerator for up to 2-3 days. Consume soon as the quality degrades.",en-US,4.71,,Just One Cookbook,50,8 serving(s),,,,,,,,,,,
95,Strawberry Frozen Yogurt,Namiko Chen,https://www.justonecookbook.com/strawberry-frozen-yogurt/,"American,Japanese",https://www.justonecookbook.com/wp-content/uploads/2012/08/Strawberry-Frozen-Yogurt.jpg,"['3 cups strawberries ((3 cups = 1 lb or 450 g))', '¾ cup sugar', '2 Tbsp lemon', '¼ tsp kosher/sea salt (I use Diamond Crystal; Use half for table salt)', '1 cup full fat plain yogurt (full fat)', '½ cup sour cream']","Gather all the ingredients. Rinse the strawberries under cold water and use the point of the knife to remove the hull out of the tops. When you have big strawberries, cut them in half.
Blend strawberries, sugar, lemon juice and salt in blender until well combined.
Add yogurt and sour cream and blend until well combined.
Process the mixture in your ice cream maker according to manufacturer’s instructions (usually about 25 minutes). Transfer the frozen yogurt to an airtight container and freeze it for several hours before serving.
If you do not have an ice cream maker, then transfer the mixture to a container and put it in a freezer. Stir every few hours (3-4 times) to break up the ice crystals until it’s completely frozen.",en-US,5.0,,Just One Cookbook,255,2 serving(s),,,,,,,,,,,
96,Meyer Lemon Pound Cake,Namiko Chen,https://www.justonecookbook.com/meyer-lemon-pound-cake/,Japanese,https://www.justonecookbook.com/wp-content/uploads/2020/01/Meyer-Lemon-Pound-Cake-2677-I.jpg,"['½ Tbsp unsalted butter ((for greasing))', 'all-purpose flour for dusting', '1½ cups all-purpose flour (plain flour)', '½ tsp baking powder', '¼ tsp baking soda', '¼ tsp kosher/sea salt (I use Diamond Crystal; Use half for table salt)', '¾ cup sugar', '2 Meyer lemons ((zested))', '¼ cup unsalted butter ((softened))', '1 large egg (50 g w/o shell)', '½ tsp pure vanilla extract', '¼ cup plain fat-free yogurt', '¾ cup low-fat buttermilk', '½ cup confectioners’ sugar/powdered sugar ((sifted))', '1 Tbsp Meyer lemon juice', '½ tsp Meyer lemon zest']","Gather all the ingredients.
Center a rack in the oven and preheat the oven to 350°F (175°C). Butter an 8 x 4 inch loaf pan, dust the inside of the pan with flour, and tap out the excess. Line the bottom with parchment paper, butter the paper, dust the paper with flour and tap out the excess. Or spray the loaf pan with non-stick spray if you have one. Set aside.
Whisk together flour, baking powder, baking soda, and salt in a medium bowl.
Place sugar and Meyer lemon zest in a food processor and pulse 30 seconds.
Beat butter and lemon-sugar in a large mixer bowl at medium speed until light and fluffy and then beat in egg and vanilla.
Combine yogurt and buttermilk in a small bowl.
Reduce speed to low and add half of flour mixture, beating just to combine. Add yogurt mixture, then finish with remaining flour mixture.
Pour batter into prepared pan and smooth top. Give the pan several sharp taps on the counter to bring up any air bubbles that may be trapped in the batter. Bake for 60 minutes, or until a toothpick inserted in the center comes out clean.
Cool in pan on a wire rack for 10 minutes; carefully remove cake from pan and cool completely on wire rack.
To prepare glaze, sift powder sugar in a bowl and add Meyer lemon zest.
Add Meyer lemon juice and whisk all together.
Drizzle glaze over cooled cake and let set before serving. Store leftovers in an airtight container in the refrigerator up to 3 days.",en-US,4.56,,Just One Cookbook,75,1 serving(s),,,,,,,,,,,
97,Green Tea Mochi,Namiko Chen,https://www.justonecookbook.com/green-tea-mochi/,Japanese,https://www.justonecookbook.com/wp-content/uploads/2019/07/Green-Tea-Mochi-9189-I.jpg,"['3.5 oz White Bean Paste (Shiroan)', '1 tsp matcha (green tea powder)', '1.8 oz Shiratamako (glutinous rice flour/sweet rice flour) ((⅜ cup, 6 Tbsp))', '2 Tbsp sugar', '6 Tbsp water ((⅜ cup))', '100 g White Bean Paste (Shiroan)', '1.8 oz Shiratamako (glutinous rice flour/sweet rice flour) ((⅜ cup, 6 Tbsp))', '2 Tbsp sugar', '1 tsp matcha (green tea powder)', '6 Tbsp water ((⅜ cup))', '½ cup potato starch/cornstarch']","Gather all the ingredients.
Prepare the Fillings
In a small bowl, combine 100 g white bean paste (Shiroan) with 2 g matcha (green tea powder).
Using a small spatula or spoon, blend the paste and matcha until the mixture is homogeneous.
Cover the bowl of matcha paste and the other bowl of 100 g white bean paste with plastic wrap. Freeze the bowls of paste for 30 minutes (or refrigerate for 60 minutes) to firm up the texture.
After 30-60 minutes, take out the bowls.
We'll start with the white bean paste first by dividing it into thirds. Wet your hands with water.
Take ⅓ of the paste into your hands and roll into a ball. Continue with the rest.
Transfer to a plate. Don’t worry if they are not perfectly round.
Now we'll work on the matcha paste by dividing into thirds. Wet your hands with water and take ⅓ of the paste into your hands.
Roll each third into a ball. Refrigerate until ready to use.
Make Mochi and Assemble
First, we make white mochi with matcha filling. In a bowl, combine 50 g Shiratamako and 25 g sugar and whisk well.
Add 90 g water and whisk well until there is no lump.
Cover the bowl with a paper towel and microwave for 1 minute (my microwave is 1200W). If you do not have a microwave, you can steam the mixture. Please see the Daifuku recipe and video for the tutorial.
Wet your silicone spatula with water.
Mix the mochi dough so that it will be cooked evenly.
Cover and microwave for an additional 30 seconds (or more/less depends on your microwave strength). The cooked mochi dough will look opaque.
Spread the potato starch or corn starch well on a baking sheet. Remember, mochi dough will stick if the surface is not covered with starch. Transfer the mochi dough on top of the starch.
Sprinkle potato starch on top of the mochi dough and on your hands. Your hands must be well coated; otherwise, they will be very sticky.
Use a dough scraper, divide the mochi dough into equal thirds.
If one is bigger than the other, cut off the edge and add to the center of the smaller dough. Flatten the dough into a circle shape.
Place the matcha paste ball in the center of the dough. Bring all four corners of the dough over the ball.
Bring the rest of the edges to the top.
Pinch the seam line by pulling the mochi dough.
If the dough is too sticky, tap the seam line with potato starch. If the dough is covered with too much potato starch, dust it off and pull the dough at the seam so the sticky surface appears and you can seal the seam.
Once the seam is tightly closed, flip the mochi so the seam line is on the bottom. Twist the mochi a few times on your palm to reshape until even thickness.
Repeat the same for the next 2 mochi dough.
Now, we make the green tea mochi with white bean filling. In a bowl, combine 50 g Shiratamako and 25 g sugar and whisk well.
Add 2 g matcha into the mixture and whisk well.
Add 90 g water and whisk well until there is no lump.
Cover the bowl with paper towel and microwave for 1 minute (my microwave is 1200W).
Wet your silicone spatula with water. Mix the mochi dough so that it will be cooked evenly.
Cover and microwave for an additional 30 seconds (or more/less depends on your microwave strength). The cooked mochi dough will look opaque.
Spread the potato starch or cornstarch generously on a baking sheet. Remember, mochi dough will stick if the surface is not covered by the potato starch. Transfer the mochi dough on top of the starch. Sprinkle more starch on top of the mochi dough and on your hands. Your hands must be well coated; otherwise, they will be very sticky.
Use a dough scraper, divide the mochi dough into equal thirds. If one is bigger than the other, cut off the edge and add to the center of the smaller dough.
Flatten the dough into a circle shape.
Place the white bean paste ball in the center of the dough. Bring all four corners of the dough over the ball.
Then bring the rest of the edges to the top and pinch the seam line by pulling the mochi dough. If the dough is too sticky, tap the seam line with potato starch. If the dough is covered with too much potato starch, dust it off and pull the dough at the seam so the sticky mochi surface will appear and you can seal the seam.
Once the seam is tightly closed, flip the mochi so the seam line is on the bottom. Twist the mochi a few times on your palm to reshape.
Repeat the same for the next 2 mochi dough.
To Serve and Keep
Serve mochi at room temperature. It goes well with green tea or hojicha.
To Store
The mochi will stay fresh for up to 2-3 days, but it's best to consume on the same day. On warm days, it's best to keep in the refrigerator. Make sure to individually covered so that the mochi will not become dry. You can freeze up to 2 weeks. Defrost first and enjoy or microwave for 10 seconds to make it softer.",en-US,4.5,,Just One Cookbook,63,6 serving(s),,,,,,,,,,,
